outlet,author,rating,text,date_posted,review_id
Anytime Fitness Orchard,Muhammad Zulfadly Bin Abdul Manap,5,"The location is quite convenient especially if you're those who like to workout during the weekend and go shopping/eating out at town after. The staff is friendly. Plenty of machine varieties suitable for bodybuilding or powerlifting. The free weights area might be a bit cramped, but thank God the squat racks/lifting platforms are not. The changing rooms are well-equipped with toiletries.",,ChZDSUhNMG9nS0VQS1Y2X1RfNE1xMGVnEAE
Anytime Fitness Orchard,Naveen Vasudevan,5,"AF Orchard is conveniently located near public transport and surrounded by plenty of restaurants, making it easy to fit workouts into a busy schedule. The gym is well-equipped with properly maintained machines and clean, modern facilities including toilets and lockers. Experienced trainers are always on hand to offer guidance and support. Equipment is handled with care, and the overall environment is safe and welcoming. The support staffs are welcoming and approachable.",,ChdDSUhNMG9nS0VJQ0FnTUNJejZDenFRRRAB
Anytime Fitness Orchard,chat noir wow,5,"Update 6 April: I’m so glad that they managed to get the air con back for the cardio area. It is now so comforting to run at AF orchard, no other AFs have such pleasant air con for running. It keeps the humidity low and easier for breathing.

I've been coming to AF Orchard for runs on treadmill. The air con used to be good for 10km runs. However, the staff mentioned that the reason for the weak air con at the cardio area is run by the management. While there are fans, but the air remain hot and humid at the treadmills area. I have also observed other runners checking out which treadmill has better ventilation. But they are mostly similar in terms of temperature and ventilation. Otherwise, the staff are great! I once forgot my hair band and the staff gave me hers. ❤️ The space is perfect, not claustrophobic. If the air con temperature could be cooler, this will be the best gym I visited among AF. They also have members treat!",,ChdDSUhNMG9nS0VJQ0FnTUNJdnJtMHdBRRAB
Anytime Fitness Orchard,Taylor L,5,"I tried it for a day with a free trial. First of all, the location was perfect, as it's connected to the MRT. The gym was a bit smaller than I expected, but it was clean. The staff was friendly and helpful.",,Ci9DQUlRQUNvZENodHljRjlvT2toSWJqUjBUM2xEYjNKUVNTMXZPWE5ZVFRGUFJFRRAB
Anytime Fitness Orchard,Suf,5,"Gym is equipped with many of the machines I find useful and the crowd is pretty okay, even during peak hours. Well-maintained and furnished with gorgeous decor and goodies for members from time to time. Highly recommended.",,ChZDSUhNMG9nS0VJQ0FnSUNQM011Vk9BEAE
Anytime Fitness Orchard,Ahmad Taufiq Muhammad,4,"Came to the gym a few time due to its convenience in town for a quick training session in  the early morning or during lunch.

Positives
- Convenient, easy parking and smack in the middle of town
- Equipment pretty standard

Some negatives
- toilets need a bit of sprucing up, mold on the wall and the fibreglass ceiling is coming apart.
- Can get quite crowded",,ChZDSUhNMG9nS0VObm56b2llOEkyOUt3EAE
Anytime Fitness Orchard,Jeremy Chan,5,"My 1st time coming to this AF gym & I must say, definitely not disappointed. All the AF gyms that are pretty much central; city area; have proven to be more than adequate for a fruitful workout. They have all the necessary equipment required for a great work out.

Top 3 AF gyms for me in Singapore are pretty much all in the main city, lol. City Hall, Wheelock, & this Orchard Gateway/313 outlet. This definitely won’t be the last time I hit this gym. I’m just glad my 3 favorite AF gyms are all close to where I reside.

5 outta 5 stars for this gym as well!

P.S. This gym & the Wheelock branch have nice views, this one more right smack on Orchard though hahaha.",,ChZDSUhNMG9nS0VJQ0FnSUN6aktIQkRBEAE
Anytime Fitness Orchard,Lucien Lim,4,"A great branch of AF that has an excellent location and friendly staff! It is clean and well maintained, and has most of the equipment one would need.

The only downside to this gym is also it’s plus, that being it’s good location. Situated on the 4th floor of Orchard Gateway, it’s a convenient 5 min walk from Somerset MRT, making it busy/crowded even at 11pm. This can be an issue as one would have to wait a while to use the equipment.",,ChdDSUhNMG9nS0VJQ0FnSUQta28tRnV3RRAB
Anytime Fitness Orchard,limsungting98,5,"Gym is very clean, vibrant and pretty much has everything for a full body workout. Definitely recommend for those working nearby who want to clock in their gym session as they have showers and vanity area. Most importantly, they have Dyson hair dryer which is amazing.",,ChZDSUhNMG9nS0VJQ0FnSURqdWZ1alJnEAE
Anytime Fitness Orchard,Carmen Chai,5,"I am very impressed with gym. The equipments are modern and well maintained. The gym is always clean and the staffs are friendly and knowledgeable, always making me feel welcome. The atmosphere is energetic and although it can get crowded during peak hours, I usually find space work work out. Highly recommend!",,ChdDSUhNMG9nS0VJQ0FnTURJeHJyempRRRAB
Anytime Fitness Orchard,K T,2,"me and my friend took the empty hip thrust machine (no weights on it) and a PT came up to us and said he was using it for his client, this just seems like he is using his power to get us to leave the machine so he can use for his client... so rude that he lied and cannot just be frank about wanting to use, if he asked nicely instead of saying oh im using this, we would not have felt angry",,Ci9DQUlRQUNvZENodHljRjlvT2toYVQwcFVkazVFVUhFMVZqVjROSFF5UjJsMGJWRRAB
Anytime Fitness Orchard,John Ko,1,"Anytime Fitness Orchard is too cheap to turn on their AC to help ventilate, allowing its members to cool down. Damn they won’t even turn their fans on. Avoid this gym unless you love working out in a sauna.",,Ci9DQUlRQUNvZENodHljRjlvT21adWJ6RXdhelpuZVdGQ1VFa3lVR3hDZUZCblJsRRAB
Anytime Fitness Orchard,Syamira Zayana Rasedi,5,"This gym is super clean and perfect for anyone working nearby who wants to squeeze in a session, like me, especially with the showers and vanity area. I visited the gym recently and was really impressed! Big shoutout to Syakir and Anwar for being so helpful with the machines. Definitely recommend! ^^",,ChdDSUhNMG9nS0VJQ0FnSUNYcDVlMTVBRRAB
Anytime Fitness Orchard,Munny L,4,"Located on level 4 after the concierge on the right, in Orchard Central.

One of the best anytime fitness gym experiences, ample of workout equipment, 2 squat racks!

Great view overlooking orchard road (not pictured) and Dyson hairdryers at the shower rooms. Lots of lockers for you to pick from! Finally can workout in orchard central.

About 20-25 pax on a Saturday,  lunchtime workout.

Open 24/7! Staff hours are till 10pm daily.

Missing a shaker or forgot a tee? Anytime has got your back with 5 colours to choose from, I had to refrain from buying too many shakers.

I think it just lacked the vending machine with the protein shakes though, it's more convenient!",,ChZDSUhNMG9nS0VJQ0FnSURXNnN5TVpBEAE
Anytime Fitness Orchard,Sihan Goi,4,"Pretty good gym with ample strength equipment even though it's not very big (2 platforms, 2 power racks, 1 half rack, 6 regular Olympic bars, other assorted bars, bumper plates). The gym advertised Eleiko bars but apparently it's only during manned hours (I saw staff taking 2 of them out slightly before 9am), and they are PL bars (was hoping for WL bars). Out of the 6 regular bars, only 1 spins well.

Despite the equipment, there were multiple signs prohibiting slamming of weights, even with bumpers and platforms, so I don't think management would take kindly to weightlifting. Machines are placed very near one another too, and the warmup/stretching area is tiny, and also no studio for classes. Lastly, there's a Life Fitness kinetic rower which I thought was a really dumb idea, because in order to even turn the rower on, you have to keep pulling it (apparently it runs off the kinetic energy generated from pulling). I had the rower die on me twice while trying to just set up a session, and before I even started my session I must've rowed  a few dozen times. The resistance is also adjusted by a knob that goes clockwise or anticlockwise, but doesn't show you what resistance it's currently at so there's no way of knowing. Why so many AF outlets get all sorts of weird indoor rowers instead of just getting C2 rowers, I'll never know...

There are showers but no sink or toilets, so if you need to wash your hands or use the toilet, you'll have to walk 2 min to the toilet outside.
Crowd wise, I was surprised to see the racks all being used at 7am, but they were free by the time I was done with warmup. Strangely, most of the free weights were being used by ladies rather than men. While that was a welcome sight, c'mon men, we can do better.",,ChdDSUhNMG9nS0VJQ0FnSUR1dk1hNmtRRRAB
Anytime Fitness Orchard,Rui Ren,5,"Been coming to this outlet more recently and the vibe here makes me wanting to come back more! Very good gym equipment and facilities, and learned that are in partnership with ReFormd Personal Training!!",,ChZDSUhNMG9nS0VJQ0FnSUNUcTc2ZEpREAE
Anytime Fitness Orchard,Terry Samuels,5,"Rather impressed despite the crowd. Instructors were nice and genuine. A weird dude was using the machines dangerously, when informed, they approached him nicely.",,Ci9DQUlRQUNvZENodHljRjlvT2tWT01rZFliREZIWkZkSWJHMUtlSE5tVVVaQmQxRRAB
Anytime Fitness Orchard,Farhan Lim,5,"My first time coming to this Anytime Fitness branch earlier today, no crowd, maybe bcuz its in the morning. The gym is super neat and clean. Good aircon and ventilation. AMAZING view while doing my warm up on the treadmill. I was mind blown to see a protein vending machine however alot of flavours sold out (i am sure it is a popular, high traffic gym in the evening), so i asked the staff Anwa if they were gonna top-up and have it available. Anwa was very nice and also explained to me how it works so bought one serving from the vending machine and we chatted for a bit. Seems like an amazing gym with fantastic location which is so convenient for some ppl cuz MRT is on B1! When i left the gym there was another staff who smiled and greeted her goodbye see you again to me! So comforting to see such warm service. I am coming here again tomorrow for sure!!",,ChZDSUhNMG9nS0VJQ0FnSUNObTg3ZUFnEAE
Anytime Fitness Orchard,Ahmed Sakr,2,"Great location, but the gym was disappointingly small. It was so cramped that we kept bumping into each other while trying to work out. Definitely not ideal if you're hoping for a comfortable exercise space.",,ChdDSUhNMG9nS0VJQ0FnSUNuaHJQcWxRRRAB
Anytime Fitness Orchard,Danial Y.,5,"Great ambience and settings, most equipments are in great working condition. Most importantly, the staffs are reliable helpful and friendly. Shoutout to Aizel if i got his name correct. Definitely need more people like him. A positive service disposition👏🏻👏🏻👏🏻 keep it up team Orchard …",,ChZDSUhNMG9nS0VJQ0FnSUREdDZhaWR3EAE
Anytime Fitness Orchard,Kenneth Soh,5,Compact but has a good selection of machines. One of the few places with an individual arm incline press and glute kickback machine. Comes with nice views of the city too!,,ChZDSUhNMG9nS0VJQ0FnSURIXzZ5NUFnEAE
Anytime Fitness Orchard,Matthew Ting,5,"I’ve had a really good experience training at Anytime Fitness Orchard, and I wanted to take a moment to thank Aaqil in particular. He’s consistently friendly and approachable, and it’s clear that he genuinely cares about the members. Whether it’s answering questions, helping with equipment, or just checking in, Aaqil is always patient and respectful.

What I appreciate most is that he creates a comfortable atmosphere in the gym. It makes a difference, especially on days when motivation is low. You know you’ll still feel supported and welcome.

Thanks, Aaqil, for your positive attitude and for being someone the gym can rely on.",,ChdDSUhNMG9nS0VJcVhpTC00MGVLYXdBRRAB
Anytime Fitness Orchard,jannelle faith,5,treadmills are so clean and the equipment is properly maintained. enough space for warms ups too,,ChdDSUhNMG9nS0VJQ0FnTUNZc0llcnlBRRAB
Anytime Fitness Orchard,Weimin Li,5,"Have been here and member since AF opened in year 2022.

Great place to hit the gym during non peak hours. Haha",,Ci9DQUlRQUNvZENodHljRjlvT2pKSVZ6bFFaSFYxU20xYVZEZG9SVkpHWjJob1RtYxAB
Anytime Fitness Orchard,Fuzzy Sowtali,5,"Awesome vibes! Great equipments! Fantastic team! Any faulty equipment upon feedback is fixed immediately! All ready by my next session! Cleanliness is superb! The cleaning lady is meticulous in her task , every nook n corners are mopped with hot water n sanitising liquid! Highly recommend! Sunshine and outdoor view thru the big window n high ceiling ! You will not feel claustrophobic here! N get good circadian rhythm with the good sun light !",,ChZDSUhNMG9nS0VJQ0FnSUNKa3A3ZkZ3EAE
Anytime Fitness Orchard,jannelle,5,Love the atmosphere in this gym and the AC is turned to the max so you won’t sweat during your workout :) Equipment and shower area are really clean and organised. Staff is super friendly!,,ChdDSUhNMG9nS0VKcTRtOGJWbjd2VzFnRRAB
Anytime Fitness Orchard,Burnzzzz Osman,5,"Love the convenience of having a gym so close to the office which has all the necessary equipment to get a workout session in! My go to gym during lunch and some evenings! Love the vibes here as well, staff are super friendly and the place is well maintained and kept sanity! Keep up the good work guys! 💪🏽 …",,ChdDSUhNMG9nS0VJQ0FnTUNJMDZQRGh3RRAB
Anytime Fitness Orchard,Joshua G,1,Hot garbage. Literally. AC doesn’t come on until after 9am. Place turns into a sweaty soupy mess. Zero ventilation means you’re sucking in all the body odors and farts from everyone else trying to get their morning exercise on. Cant believe I’m paying for this.,,ChZDSUhNMG9nS0VJQ0FnSURadnN2eEp3EAE
Anytime Fitness Orchard,Charles Hooi,5,"This gym offers a wide range of well-maintained equipment to suit various fitness needs and maintains a comfortable atmosphere, even during peak hours. The space is stylishly decorated, impeccably clean, and occasionally surprises members with thoughtful perks. Highly recommended!

Special mention to Romano for his outstanding service—friendly, efficient, and hassle-free. If you’re looking for a great gym experience, he’s the one to reach out to. 100% recommend!",,ChZDSUhNMG9nS0VJQ0FnSUR2M09ubkN3EAE
Anytime Fitness Orchard,Brandon Hoon,5,"Always a wonderful experience coming to AF Orchard Central, the staff are all really friendly and welcoming and the members are mostly polite and willing to share tips with each other, the gym is also really clean and there is a wide array of equipment which is maintained well! Good job team :))",,ChdDSUhNMG9nS0VJQ0FnTURnejVUNmlnRRAB
Anytime Fitness Orchard,Nikki,5,Yulun at Reformd AF orchard is a good staff that helped me out with queries on membership as well as gave a detailed overview of the gym. I highly recommend everyone to come down and try this gym 👍🏻 …,,Ci9DQUlRQUNvZENodHljRjlvT2sxS1pVZFljME4zVTFaemFVeEtRMWd4YTJ4SlJtYxAB
Anytime Fitness Orchard,Elisabeth,1,"I’ve generally had a positive experience at this gym, but recently, mall management implemented a baffling new policy—turning off the air conditioning from 10:30 PM to 10:30 AM. This decision has significantly impacted the gym environment, making workouts not only uncomfortable but also unsafe.

With Singapore’s already high temperatures and humidity, the lack of proper ventilation leads to excessive sweating, making machines slippery and increasing the risk of injury. A gym should be a space that encourages people to push their limits safely, not one that discourages attendance due to poor conditions.

I urge management to reconsider this policy, as it negatively affects the gym experience and potentially endangers members. Maintaining a cool, well-ventilated workout space is not a luxury—it’s a necessity.",,ChdDSUhNMG9nS0VJQ0FnTUN3cjQzNXR3RRAB
Anytime Fitness Orchard,Joshua Nair,5,"The most premium feel I've had in an Anytime Fitness. Good selection of machines / equipment and a thoughtful seating area. Machines are very close to each other though, so being polite and considerate is expecially important. Everyone was nice in my first visit today.",,ChZDSUhNMG9nS0VJQ0FnSURPeUktR1BBEAE
Anytime Fitness Orchard,Angel Lee,5,"Great gym with excellent facilities and a welcoming atmosphere. The equipment is well-maintained, and the space is clean and comfortable for workouts. The staff are friendly, helpful, and always ready to assist. Highly recommend for anyone looking for a convenient and well-equipped gym in Orchard!",,ChZDSUhNMG9nS0VJQ0FnTUNBd2R1YmNnEAE
Anytime Fitness Orchard,dvxhupe,5,"staff here very friendly and chill always says “hi, welcome” when i came to the gym.  i love it and the place here is quite chill.",,ChdDSUhNMG9nS0VJTzlxX3EtanFUaHJRRRAB
Anytime Fitness Orchard,Sylvester,1,"In a city where the sweltering heat is already a formidable foe, one would expect a reputable gym like OC Anytime Fitness to provide a sanctuary of sorts – a cool, refreshing oasis where one can escape the oppressive temperatures and focus on their fitness journey. Alas, dear reader, this is not the case.

Upon entering the gym during morning hours, I was immediately struck by the stifling air, thick with the stench of sweat and stagnation. It's as if the very walls were exhaling a collective sigh of despair. The reason for this sauna-like atmosphere? The gym's steadfast agreement to only turn on the air conditioning that follows the building's designated schedule.

And don't even get me started on the staff's apparent lack of initiative to provide even the most basic form of ventilation. A simple opening of the door, carefully monitored to ensure security, would have gone a long way in alleviating the suffocating atmosphere. But no, that would require too much effort, and apparently, that's too much to ask.

To add insult to injury, OC Anytime Fitness sees no need to inform its members about this egregious situation through social media or any other means. It's as if they're will-fully ignoring the problem, hoping that their patrons will simply suffer in silence. This is a gym that seems more concerned with following arbitrary rules than with providing a decent, comfortable experience for its members.",,ChdDSUhNMG9nS0VJQ0FnTUNJelBYSTRBRRAB
Anytime Fitness Orchard,Darren Teo,5,This gym is well ventilated and equipped with state-of-the-art equipment. Lovely place to train with good vibes and music. Staff is also very friendly and easy to talk to :),,ChZDSUhNMG9nS0VJQ0FnTURJb2EyV0lBEAE
Anytime Fitness Orchard,李仲秋,5,"Clean and tidy, very pleasant fitness environment, a good place to exercise with family and friends",,ChdDSUhNMG9nS0VJQ0FnTUNJdnF5WjZBRRAB
Anytime Fitness Orchard,Descloud 86,1,"I’ve been a regular at AF Orchard but lately, the conditions have become unbearable. The mall has switched off the air conditioning, leaving the gym with no ventilation. The result? Stuffy, humid air, excessive condensation on the equipment, and an overall unpleasant workout environment.

The condensation makes machines and weights wet and slippery, which is not only frustrating but also a serious safety hazard. On top of that, with no airflow, body odor lingers in the gym, making the experience even worse. It’s nearly impossible to get through a workout comfortably.

A gym should provide a clean, safe, and comfortable environment for its members. Unfortunately, this gym is failing at all three. Until management fixes the air circulation and improves hygiene, I wouldn’t recommend this place to anyone.",,ChdDSUhNMG9nS0VJQ0FnTUN3aXNHXzJBRRAB
Anytime Fitness Orchard,A Lee,4,"Ooh check out those artic blasts of cold air on a hot day! It’s a swell place to be in but personally found it a bit cramped, particularly if you are looking for an open space to do your own body weight exercises, kettlebell swings… well, this ain’t the place to be.",,ChdDSUhNMG9nS0VJQ0FnSURMaHZUel9BRRAB
Anytime Fitness Orchard,Amirul Aqqmal,5,"I visited this gym recently and had a positive experience. The facility was clean and well-maintained with modern equipment. The staff were friendly and helpful, providing a quick orientation. The gym offers a good variety of classes and training options suitable for different fitness levels. Despite being busy during peak hours, I still found it easy to access the equipment I needed. Overall, I recommend this gym for a welcoming and functional fitness center.",,ChZDSUhNMG9nS0VJQ0FnSURqbDgzMEZBEAE
Anytime Fitness Orchard,Charles Dominguez,5,First time at this branch. Gym equipment were good. Arrived when there weren't much people too. Overall good place to get a quick workout in when in the city,,ChdDSUhNMG9nS0VJQ0FnTUNJNF9XRnB3RRAB
Anytime Fitness Orchard,Kristin (크리스틴),5,Great ambience and lots of equipments for me to do my workouts whenever i am in town! Friendly staffs who always greet when i enter the gym 🤟🏻😄 …,,ChZDSUhNMG9nS0VJQ0FnTUNvd2Y2V1JnEAE
Anytime Fitness Orchard,Haziq Salim,5,"The staff is friendly and knowledgeable, always willing to offer assistance or advice. Personal trainers are available for those seeking more structured guidance, and they provide excellent, personalized workout plans.

The gym has a welcoming atmosphere that fosters both community and individual focus. With its top-notch facilities, flexible hours, and great customer service, Anytime Fitness Orchard is an excellent choice for anyone looking to stay fit in the heart of Singapore.",,ChZDSUhNMG9nS0VJQ0FnSURYNUpuaEh3EAE
Anytime Fitness Orchard,Hong Ee 18,5,"I’ve been to a lot of gyms, but AF orchards stands out from the rest. From the moment you walk in, the energy is electric, and the vibe is so motivating! The equipment is top-notch, with a variety of machines and free weights for every kind of workout. Whether you're a beginner or a seasoned lifter, you'll find everything you need.

The trainers here are next-level – super knowledgeable and genuinely invested in helping you reach your goals. They take the time to tailor workouts to your fitness level and push you in the best way possible. 💥

The group classes? 🔥 Whether it's high-intensity circuits, yoga, or spin, the classes are challenging but fun, and the community vibe is incredible. It feels like everyone is cheering each other on.

The best part is the cleanliness and organization. Everything is spotless, and the equipment is always ready to go – no long waits or broken machines.

If you're looking for a gym that pushes you to be your best while feeling like part of a fitness family, AF orchard is the place to be. Highly recommend! 💯🏋️‍♂️",,ChZDSUhNMG9nS0VJQ0FnSUNuNDRtVEhREAE
Anytime Fitness Orchard,Sassy Hortelano,5,"Clean, new equipments, nice ambiance and very accomodating staffs",,ChZDSUhNMG9nS0VJQ0FnTUR3dnU2S1l3EAE
Anytime Fitness Orchard,faith woo,5,"great and super clean gym! staff is friendly and helpful especially kyan who helped guide me,  music curation is good and vibey + gym is well maintained as well, will bring my friends back soon 😊 …",,ChZDSUhNMG9nS0VJQ0FnTURJeHFxX0dnEAE
Anytime Fitness Orchard,Shayuslyn Sharif,4,"Wide range of machines to use, but you may want to come during non-peak period for more floor space and access to machines. Friendly staff, very approachable and responsive to queries. Keep up the great work! 👍🏻 …",,ChdDSUhNMG9nS0VJQ0FnTUNnaVp2QzNnRRAB
Anytime Fitness Orchard,tan jen,5,"Not too packed usually just the best amount of crowd, has all the equipment I need, convenient location whenever I need a session mid-day! Staff are always friendly :)",,ChZDSUhNMG9nS0VJQ0FnTURJbHI2R0RnEAE
Anytime Fitness Orchard,Xavier XAvier,5,"i love this place it feels good and the staff here erol and jadel are super nice and they are informative, especially jadel who was even willing to give me advice on the machines",,ChdDSUhNMG9nS0VJQ0FnSURYMllpOG13RRAB
Anytime Fitness Orchard,Doug Pong,5,Very helpful and friendly front desk! Great gym environment with many machines that suit everyone’s needs!,,ChdDSUhNMG9nS0VJQ0FnTUNZdlAyeHJnRRAB
Anytime Fitness Orchard,Mike Tan,1,Terrible condition. Floor soaking wet due to leakage and it’s not fixed for the longest time. Rubbish everywhere. 3 shower room but only one is open for use and shower gel not re-filled. Aircon not turned on in the morning. Strongly urge the management to fix these issues quickly,,ChZDSUhNMG9nS0VJQ0FnTUNRdVlUdFhBEAE
Anytime Fitness Orchard,Aditya,4,"My first gym ever and the only gym that I personally prefer. It has all the machines I require and I've made quite the transformation in one year. The staff is very friendly and helpful and the always try to fix your problem as best as they can. Obviously, a gym can get full so you have to share with other people and sometimes I can't do my sets fully but overall its amazing to be with the AF community.",,ChdDSUhNMG9nS0VJQ0FnSUNia2VIQnlnRRAB
Anytime Fitness Orchard,Jack,4,"Nice and clean gym with enough quality equipment for a good workout,
The equipment it's very close together and spaces are tight. The main problem is the very strong air cond blowing on your neck while you workout, that is not healthy.",,ChdDSUhNMG9nS0VJQ0FnTURBX3Z5UjRRRRAB
Anytime Fitness Orchard,Nicholas Tan,5,Friendly staff and well-equipped. Left my AirPods case here on accident once and the staff kept it for me securely until I came back to retrieve it,,ChZDSUhNMG9nS0VJQ0FnTUNJdm9xWGJnEAE
