outlet,author,rating,text,date_posted,review_id
Anytime Fitness Clementi 354,Filza,3,"Gym is pretty spacious and has plenty of Matrix machines & cool attachments. However it is extremely hot and stuffy. Out of 7 aircon on the second floor, only 2 are turned on. There aren’t even 10 people upstairs now - I can’t imagine how much stuffier it would be during peak periods!",,ChZDSUhNMG9nS0VPRGZwTXlmNGZpS1pREAE
Anytime Fitness Clementi 354,Preesha Chandra,5,"I've been going to this gym for a while now. The equipments and environment are clean, and well-maintained. The staff are always friendly, professional, and willing to help — whether you’re a beginner or not.

Whether I’m there for a quick workout or a long session, I always leave feeling stronger and more focused. Highly recommend !",,Ci9DQUlRQUNvZENodHljRjlvT25SM2FrUjNRVWR1Ym01SGRuUktWSFJqYjA5cmIyYxAB
Anytime Fitness Clementi 354,John Hii,5,"New outlets so everything are new, friendly lady trainer, Mel who afternoon shift. Only thing quite crowded after 7.30pm so need avoid this timing. Overall good so must join this outlet now.",,ChdDSUhNMG9nS0VKemF2LUtwcHZDZDJ3RRAB
Anytime Fitness Clementi 354,Wendy CSY,5,"Update: 3 May: After I sign up the membership and try out the gym equipment, I must say the whole environment is very encouraging and comfortable to work out. Mel just gave me a training session on how to use the equipment correctly today. Thank you Mel for coming down on a public holiday just to go through the session with me. She is very patient and I learn a lot today! The staff here are very helpful in general.

25 Apr: Excellent service from Mel! Very friendly and helpful in showing me around and explaining on what the gym offers. Love this new gym! Convenient and nicely equipped!",,ChZDSUhNMG9nS0VJQ0FnTURvbnR1RUt3EAE
Anytime Fitness Clementi 354,Samantha Keo,5,"Everything is well taken care of and it’s clean where the equipment are. Staff are friendly too and super helpful when I was new to the gym :)
Easy to find and get to! No regrets joining",,Ci9DQUlRQUNvZENodHljRjlvT21SSE5WcHlXVXRtVjI1a1RYWTJlVkpxTnpSb04wRRAB
Anytime Fitness Clementi 354,Gurl xoxo,5,"Love the vibes here! The gym is always clean, the equipment is well-maintained, and it’s not too crowded when I go. Staff are super friendly and chill too. Feels like my second home now! 🥳 …",,Ci9DQUlRQUNvZENodHljRjlvT25Wc2NFRndPVlJaWWpSYVpFdzFSRFJOWXkxa2VWRRAB
Anytime Fitness Clementi 354,Alysa Heavienne,5,staff are really friendly and so helpful! the gym is really cozy and chill. great variety of different equipment. really clean compare to the other anytime fitness outlets! COME COME JOIN JOIN!,,Ci9DQUlRQUNvZENodHljRjlvT2pWVk5YSXhPRGQxUzNOQlZHeGxTa2RrU2tWMVNYYxAB
Anytime Fitness Clementi 354,Orlando García,5,"The place has everything you need, all brand-new, and the front desk ladies are super friendly!",,Ci9DQUlRQUNvZENodHljRjlvT2paNFJESk1NRlYxZUhKQ1NWOWpNRTU2ZW01QmMxRRAB
Anytime Fitness Clementi 354,Ethan Ong,5,well equipped and spacious! the staff were very friendly and professional! definitely give it a try to enjoy a good workout💪💪 …,,Ci9DQUlRQUNvZENodHljRjlvT21kTVRsWmlWVzB0WTJFMlVESlRaRUZRU1d4WFFXYxAB
Anytime Fitness Clementi 354,Shakii Shafie,5,"good equipment, clean and friendly staff. usually will avoid peak hours since the gym is funsize (small) so it will be quite packed!",,Ci9DQUlRQUNvZENodHljRjlvT2toclpERkdORWN0Y2twTFRubHlUMDFoWTJaaU5YYxAB
Anytime Fitness Clementi 354,Omar Chik,5,Great space for workouts with good equipments. Been a regular since for my daily routine workout. Checkout this outlet to experienced it…🤙🏼 …,,ChdDSUhNMG9nS0VPM2RzTTJmN2RUZXJRRRAB
Anytime Fitness Clementi 354,Haashir Malik,5,"Very convenient location in the neighborhood with equipement and good working out environment.

Essential amenities available surrounding the gym!

Worth the subscription.",,ChdDSUhNMG9nS0VQRHkzZTZkNUlPSWhRRRAB
Anytime Fitness Clementi 354,Samantha Lua,5,Love the space and it appears to be adequately planned. Wide variety of new equipments and that was a pleasant surprise.  Staffs are great and friendly!,,ChdDSUhNMG9nS0VJQ0FnTURvNXNHSnlnRRAB
Anytime Fitness Clementi 354,joel,5,"equipments are good, staff is very friendly. 13/10",,Ci9DQUlRQUNvZENodHljRjlvT25CRVZYaGpVR3hvZFZKemMzUkVhMnhqUlVoVFptYxAB
Anytime Fitness Clementi 354,Darrell Joshua,5,"All the equipments here are very new, the team is very professional, solid place to gym!!! feels like a family",,ChdDSUhNMG9nS0VJQ0FnTURvdnRqdnh3RRAB
Anytime Fitness Clementi 354,Reston Ho,5,"Great new outlet in the neighbourhood, fresh equipment and walking distance from Clementi MRT, really convenient ! 😁 …",,ChZDSUhNMG9nS0VLYm8wX1gzNFBMUUlBEAE
Anytime Fitness Clementi 354,Lim Ding Xuan,5,"Lovely and cosy gym here, recommended!",,Ci9DQUlRQUNvZENodHljRjlvT2tsT2NuaHlSMkpYT0Zaa2JWQXpaSEptVVhCQlJsRRAB
Anytime Fitness Clementi 354,Yibin Teo,5,Friendly staffs and comfortable environment to workout,,Ci9DQUlRQUNvZENodHljRjlvT2tGSWFqVTBZVGhIUmtaYWRXMUxSMUZOT1Mxc2VsRRAB
Anytime Fitness Clementi 354,Nur Amelina,5,Great cozy gym! Staffs are very helpful and friendly!,,ChZDSUhNMG9nS0VJQ0FnTURvNW9HQkxBEAE
Anytime Fitness Clementi 354,Lucas,5,Friendly staff and nice gym !,,Ci9DQUlRQUNvZENodHljRjlvT2psQlF6aHpWWHBDTmkweVFsVlNhMUZ2Y25WVlpsRRAB
Anytime Fitness Clementi 354,koh tristan,5,"new and clean environment, been here everyday since i’ve signed up",,ChZDSUhNMG9nS0VQak10YzdYeFk3cEdREAE
Anytime Fitness Clementi 354,Shiori,5,great location and equipment!,,Ci9DQUlRQUNvZENodHljRjlvT20xNFZuZEZkWFZPVVZSRVlWbENibVYyT1hKdFowRRAB
Anytime Fitness Clementi 354,Ramki sriram,5,Very awesome gym in Clementi,,ChZDSUhNMG9nS0VMVzhyYkNQbUtESUFREAE
Anytime Fitness Clementi 354,Hans Chan,5,Great new gym in the neighborhood,,ChdDSUhNMG9nS0VJQ0FnTURvc2Fma2xBRRAB
Anytime Fitness Clementi 354,John Doe,1,No aircon,,Ci9DQUlRQUNvZENodHljRjlvT2xsWE0xQkVZWEI2TVcxTFVrdGhRM2cwZVV4M2NGRRAB
Anytime Fitness Clementi 354,pek patricia,5,Great space and friendly staff!,,ChZDSUhNMG9nS0VJQ0FnTURvNXBHMFZREAE
Anytime Fitness Clementi 354,Matt Ong,5,really well equipped😃 …,,ChZDSUhNMG9nS0VJQ0FnTURvM29YUlFBEAE
Anytime Fitness Clementi 354,Chai You Wei,5,best staff ever 👍🏼 …,,ChZDSUhNMG9nS0VJQ0FnTURveHBQR1NnEAE
Anytime Fitness Clementi 354,Snehal Jain,5,,,Ci9DQUlRQUNvZENodHljRjlvT2tsNVdFcGxUalJCV1d4emRUSk9lV3QwTUVWdVFYYxAB
Anytime Fitness Clementi 354,Syed Zulfadhli,5,,,Ci9DQUlRQUNvZENodHljRjlvT2kxeFRIQk5lbnA0WW5wM05uSnFUbVpZVGpRMlpHYxAB
Anytime Fitness Clementi 354,Sofian Osman,5,,,Ci9DQUlRQUNvZENodHljRjlvT25weWJ6ZElaMnROTlRGNk9VeEJZMWxzUVROWWVGRRAB
Anytime Fitness Clementi 354,Li Jiayu,5,,,Ci9DQUlRQUNvZENodHljRjlvT21OU2FGaEVVVkpWVEVSSFJtWnlRWEZqUTA1aVpYYxAB
Anytime Fitness Clementi 354,dav,5,,,Ci9DQUlRQUNvZENodHljRjlvT2pKQ2QwWjFiWG95V1VsWFVUQjBUV2hsVjNSdk9IYxAB
Anytime Fitness Clementi 354,Rajendra Tunga,5,,,Ci9DQUlRQUNvZENodHljRjlvT21RM2JtVnBRa2RVTmpsQlVtc3RWVmxrZG14ZlMyYxAB
Anytime Fitness Clementi 354,james lim,5,,,ChZDSUhNMG9nS0VMSHE2OWFyMjRmYkRREAE
Anytime Fitness Clementi 354,Rvjes,5,,,ChZDSUhNMG9nS0VJQ0FnTURveHZQNGZnEAE
