outlet,author,rating,text,date_posted,review_id
Anytime Fitness Orchard,Marcela,5,"Had a good workout today at AF Orchard, staffs are friendly thank you Farrah and Anwar for assisting! 👍🏼 …",,ChZDSUhNMG9nS0VJQ0FnSURCcmF1Z1JREAE
Anytime Fitness Orchard,Salamah Jalani,5,Love my time at AF orchard! amazing staff and crowd here!,,ChZDSUhNMG9nS0VJQ0FnSURMd0l6Q0x3EAE
Anytime Fitness Orchard,D Loner,5,"Stuff is very friendly and knowledgeable, always there to have your back when you need it 👍 …",,ChZDSUhNMG9nS0VJQ0FnSUREdllhTFFREAE
Anytime Fitness Orchard,J lim,5,The place was very nice since the facilities were great and the staff were very friendly as well especially Sinead!,,ChZDSUhNMG9nS0VJQ0FnSURCNjY2ZFFREAE
Anytime Fitness Orchard,cheyenne,5,"had my first gym trial at this outlet, good experience! clean gym!",,ChdDSUhNMG9nS0VJQ0FnSURqOF9YU29nRRAB
Anytime Fitness Orchard,Debbie,5,"Nice gym!! good song selections, clean equipment, friendly staffs and aircon is super strong 👍🏼 …",,ChZDSUhNMG9nS0VJQ0FnSURXbGNHSUl3EAE
Anytime Fitness Orchard,Jerry Chok,5,"Gym is clean, workers greet you friendly and helpful",,ChdDSUhNMG9nS0VJQ0FnSUNMNHRPbzdRRRAB
Anytime Fitness Orchard,Benjamin Teng,5,"Great gym, very good vibes",,ChdDSUhNMG9nS0VJQ0FnSUN2dnBuYXpRRRAB
Anytime Fitness Orchard,Eka Qashrina,5,Such a nice place to gym. Staff there are so helpful and friendly,,ChZDSUhNMG9nS0VJQ0FnSUNKcE5fV0RBEAE
Anytime Fitness Orchard,Syarifuddin Rahiman,5,Great customer service from farah and her team. Greeting everyone with a smile. Will come by here often.,,ChdDSUhNMG9nS0VJQ0FnSUMtNklLRnpRRRAB
Anytime Fitness Orchard,Mr. Clean,5,Well maintained equipment and super nice staff. Great atmosphere to train,,ChdDSUhNMG9nS0VJQ0FnSURSczlYRTB3RRAB
Anytime Fitness Orchard,Iryan Iraimi,5,Ma big boy boy Anwar was lit always giving good vibes. Love the space!,,ChdDSUhNMG9nS0VJQ0FnSUNKNllQaF93RRAB
Anytime Fitness Orchard,Syafiq Zaidi,5,a very nice gym with respectful staff,,ChdDSUhNMG9nS0VJQ0FnSUN2OVBQdjl3RRAB
Anytime Fitness Orchard,Niklaus Cheong,5,"excellent service. pretty gym. great workouts. friendly ppl like farah, amanda, midzi, zahir, chester!!",,ChZDSUhNMG9nS0VJQ0FnSUMtc3FEYUdREAE
Anytime Fitness Orchard,Shahila Juraimi,5,"Always good vibes at AFO.
Clean gym, and most importantly very friendly and helpful staffs.",,ChdDSUhNMG9nS0VJQ0FnSUMtbVBUZmpRRRAB
Anytime Fitness Orchard,Xavier Chem,5,Receptionist very nice good aesthetic,,ChZDSUhNMG9nS0VJQ0FnTURvMHM3WmRnEAE
Anytime Fitness Orchard,Kay Kalla,4,"Good gym, good equipments. Friendly staff. Farah and Anwar are super helpful. 👌🏽 …",,ChdDSUhNMG9nS0VJQ0FnSUQtNUx2OXZ3RRAB
Anytime Fitness Orchard,David Lim,5,Best ANYTIME trainers! Warm and friendly. Great Environment! Excellent location!,,ChdDSUhNMG9nS0VJQ0FnSUR4cDlHSC1RRRAB
Anytime Fitness Orchard,Ryan Ryan,5,"Great people all around, from the staffs to the members. Positive vibes, cosy and lovely ambience, with an awesome view! 😍 …",,ChdDSUhNMG9nS0VJQ0FnSURXbE9iQ3FnRRAB
Anytime Fitness Orchard,amirmoriable,4,"Great gym with good space, but they could add vending machine for post and pre workout drinks",,ChdDSUhNMG9nS0VJQ0FnSUQtdmNpRjJBRRAB
Anytime Fitness Orchard,Alexander Griesbach,3,"Was mid. $30 drop in for the bare minimum. Good location though, very convenient.",,ChdDSUhNMG9nS0VJQ0FnSURidktmcmxBRRAB
Anytime Fitness Orchard,Risvi Aaqil,5,great equipments and very well maintained,,ChZDSUhNMG9nS0VJQ0FnSUR2OFlELUZREAE
Anytime Fitness Orchard,Krish Pareek,5,Amazing staff and exceptional services provided in the gym,,ChdDSUhNMG9nS0VJQ0FnSUNYMkluRTRRRRAB
Anytime Fitness Orchard,muhammad nurul,5,Personally is the best place I can workout. The staff are friendly and people here way helpful.,,ChdDSUhNMG9nS0VJQ0FnSUR4eDZQX2l3RRAB
Anytime Fitness Orchard,Amir Rudin,5,Great Gym! Love the staff 👍 …,,ChdDSUhNMG9nS0VJQ0FnSUN2aU16bHRRRRAB
Anytime Fitness Orchard,X Lee,5,"service was great, vibes were amazing, had a great workout with my friends and everyone there was super friendly 😃👍🏻 …",,ChZDSUhNMG9nS0VJQ0FnSUNXcmRfQkp3EAE
Anytime Fitness Orchard,hello katie,5,"No changing room!! But overall experience was great. Great view, good music!",,ChZDSUhNMG9nS0VJQ0FnSUNXX2YzOEl3EAE
Anytime Fitness Orchard,Claudia Si Tho,5,Anwar was a great and friendly staff at AF Orchard!,,ChdDSUhNMG9nS0VJQ0FnSURYbXBtLXVnRRAB
Anytime Fitness Orchard,chloe! (chhloe1862),5,compact but facilities are nice :),,ChdDSUhNMG9nS0VJQ0FnTUN3dUk2N2lRRRAB
Anytime Fitness Orchard,eli,5,great gym and friendly staffs too,,ChdDSUhNMG9nS0VJQ0FnSURfdWVqODJ3RRAB
Anytime Fitness Orchard,Brave Warrior,5,"Farrah, Colin, Amanda, Norrina, Kimmy, Anwar are very nice. Good to be here!",,ChZDSUhNMG9nS0VJQ0FnSUMtOTl6YkJ3EAE
Anytime Fitness Orchard,Cleo Bruns,5,"Good experience, staff were friendly and knowledgeable",,ChZDSUhNMG9nS0VJQ0FnSURYMGYtTklBEAE
Anytime Fitness Orchard,chanboramey Lak,5,Staffs are very friendly and amazing gym.,,ChdDSUhNMG9nS0VJQ0FnSUNUbGZhSnFnRRAB
Anytime Fitness Orchard,Jerald Ng,5,isaiah was a great help and very friendly. Answered all my questions when i had any doubts,,ChdDSUhNMG9nS0VJQ0FnSUNqNlpiRnhBRRAB
Anytime Fitness Orchard,Matt Anthony,5,"Friendly staff, good equipment 👍🏻 …",,ChdDSUhNMG9nS0VJQ0FnSUNmNTRhaDRBRRAB
Anytime Fitness Orchard,vcb,5,"Good facilities, nice and friendly staff.",,ChdDSUhNMG9nS0VJQ0FnSUNQN0lPQjN3RRAB
Anytime Fitness Orchard,Yun Shuen Cassandra FOO,5,Staff was very friendly and helpful! (:,,ChdDSUhNMG9nS0VJQ0FnTUN3X0pQN2pnRRAB
Anytime Fitness Orchard,Qashrina,5,Great place to workout! Worth the membership sign up.,,ChdDSUhNMG9nS0VJQ0FnSUNUcGFMSHdnRRAB
Anytime Fitness Orchard,Bryan Joseph,5,Best gym in town!,,ChdDSUhNMG9nS0VKUENrT19jeU1LNGxnRRAB
Anytime Fitness Orchard,Elson Tan,5,Nice vibes but air con abit cold 🥶 …,,ChdDSUhNMG9nS0VJQ0FnSUNQcXJmMHZnRRAB
Anytime Fitness Orchard,Phoebe,5,"the equipment is clean and well maintained, staff are friendly and helpful!",,ChdDSUhNMG9nS0VJQ0FnSUN4b2NQS3pRRRAB
Anytime Fitness Orchard,Da Hyun Yu,5,"The gym was very clean. Had a training session with Herzy, would recommend it!",,ChZDSUhNMG9nS0VJQ0FnSUN1OUxDWkFREAE
Anytime Fitness Orchard,Caroline Tan CL,5,"Convenient location, a good option especially on rainy mornings and no fuss is signing in.  Tried this gym on a one-day pass.",,ChdDSUhNMG9nS0VJQ0FnSUNlcThlU3ZnRRAB
Anytime Fitness Orchard,Franzbabu,5,"very great equipment, nice staff, good restrooms, great location (food around etc.)",,ChdDSUhNMG9nS0VJQ0FnSUR1OVkzcjh3RRAB
Anytime Fitness Orchard,Charmaine Lee Yong En,5,very friendly staff and good facilities,,ChdDSUhNMG9nS0VJQ0FnSUNQbFpDVHhnRRAB
Anytime Fitness Orchard,Itsme,5,"Staffs are friendly and with that little gesture they do right when coming into the space , makes the day even better ! Thank you!",,ChZDSUhNMG9nS0VJQ0FnSUNKcWRXT1dBEAE
Anytime Fitness Orchard,Fengrui Shi,4,A bit tight space compared to other gyms,,ChdDSUhNMG9nS0VJQ0FnTURBN3FQWXp3RRAB
Anytime Fitness Orchard,Tropical_storm X,4,Good location but can get crowded. Well equipped gym inside mall,,ChdDSUhNMG9nS0VJQ0FnSURCMnBxei1RRRAB
Anytime Fitness Orchard,Dominick Goh,5,"Well equipped gym , has many machines and eleiko bars .",,ChdDSUhNMG9nS0VJQ0FnSUREdll6UHhBRRAB
Anytime Fitness Orchard,Matthew Chiang,5,"Great gym to workout at, convenient, sufficient equipment, nice ambience. Everything that a gym goer needs!",,ChZDSUhNMG9nS0VJQ0FnSUMtbVBpRkFREAE
Anytime Fitness Orchard,Irfan Imran,5,Friendly stuff and well maintained equipments! Love it so much! :D,,ChdDSUhNMG9nS0VJQ0FnSUR4cDRXbjN3RRAB
Anytime Fitness Orchard,Iman Hoque,5,Extremely friendly staff and make it feel like home 🫶 …,,ChdDSUhNMG9nS0VJQ0FnSUNIaDRUZzVRRRAB
Anytime Fitness Orchard,glenda,5,great facilities and friendly staff! always a great workout here,,ChZDSUhNMG9nS0VJQ0FnSUNKX1BLWWZREAE
Anytime Fitness Orchard,Olivier Chhuon Buntha,4,Amazing gym with lots of equipment,,ChZDSUhNMG9nS0VJQ0FnTUNJdnRyTmZBEAE
Anytime Fitness Orchard,sabi rah,5,"Came to the gym at about 9pm Nirel and Herzy were really friendly and shared with me about the gym amenities, excellent service",,ChZDSUhNMG9nS0VJQ0FnSUN1aXRMUExBEAE
Anytime Fitness Orchard,alvin lye,5,The staff are very friendly and helpful. Great place to work out!,,ChdDSUhNMG9nS0VJQ0FnSUN4aHFfM2xBRRAB
Anytime Fitness Orchard,lin syi,5,"Best gym ever, nicest front desk ever!!! Shoutout QJ & anwar.",,ChZDSUhNMG9nS0VJQ0FnSUNKcnFEMVNBEAE
Anytime Fitness Orchard,Thineesh Selvaraju,5,The gym is very clean!!,,ChZDSUhNMG9nS0VJQ0FnTURvOE0yWkpBEAE
Anytime Fitness Orchard,Irfan z,5,"Very good, I like. Especially this Dian girl, very very friendly and very very helpful, good I like",,ChZDSUhNMG9nS0VJQ0FnSUNUbXVTQ1FnEAE
Anytime Fitness Orchard,wilfred alejandro gómez colmenares,5,everything excellent!! Good installations!! good place to train!!,,ChdDSUhNMG9nS0VJQ0FnSUN6X2VMZWdBRRAB
Anytime Fitness Orchard,Sudharshan Madhavan,5,"Good gym, clean equipment and lots of machines/free weights to use",,ChZDSUhNMG9nS0VJQ0FnSUNKNnVmM01nEAE
Anytime Fitness Orchard,Xyra Lafiguera,5,Great place to workout at! The ambience is good and the staff are accommodating and friendly 😊 …,,ChZDSUhNMG9nS0VJQ0FnSUNPN3JpUUtBEAE
Anytime Fitness Orchard,Gene 7788,5,Nice place to gym ! Staff friendly especially Ms Amanda !!  ◡̈,,ChZDSUhNMG9nS0VJQ0FnSUMtcWJiVVRnEAE
Anytime Fitness Orchard,Emily Tan,5,Very very strong aircon!,,ChdDSUhNMG9nS0VJQ0FnTURvMHJyZzBBRRAB
Anytime Fitness Orchard,james dylan,5,Wonderful experience using the gym and reason it gets relatively packed henceforth.,,ChZDSUhNMG9nS0VJQ0FnSUNPaHBmTFdnEAE
Anytime Fitness Orchard,Masanao Suzuki,5,Here is very clean. I spent good workout time.,,ChdDSUhNMG9nS0VJQ0FnSURIMUlXY2tBRRAB
Anytime Fitness Orchard,Javier,5,Friendly experience and great environment!,,ChdDSUhNMG9nS0VJQ0FnTURnczZTOThBRRAB
Anytime Fitness Orchard,Raine Ong,5,"I really enjoy the ambiance at AF orchard, staffs are helpful and friendly as well!",,ChdDSUhNMG9nS0VJQ0FnSUNKbU5uMG53RRAB
Anytime Fitness Orchard,Lynn Woo,4,My home gym! Love the feel of the leather cushioned machines/benches :-) And of course the friendly staff,,ChZDSUhNMG9nS0VJQ0FnSUNCdkpLa1RnEAE
Anytime Fitness Orchard,Tzeming Law,5,Super well maintained gym with good equipment and friendly staff!,,ChZDSUhNMG9nS0VJQ0FnSURPOVpxWE5REAE
Anytime Fitness Orchard,Pung YunYee,5,very clean and well ventilated,,ChdDSUhNMG9nS0VJQ0FnTURnejVUVzlBRRAB
Anytime Fitness Orchard,stanley low,5,friendly good and cute,,ChdDSUhNMG9nS0VJQ0FnSUNUOEtyM3pnRRAB
Anytime Fitness Orchard,Trevor Wong,5,Very new and nice place to workout.,,ChZDSUhNMG9nS0VJQ0FnSURYMnVIUUJBEAE
Anytime Fitness Orchard,Jomari Esquivel,5,"ANWAR, KIMMY AND COLIN BEST AF GYM STAFF IN SG,  BEST GYM ENVIRONMENT AND GOOD VIBESS!! RECOMMEND BROOOOO",,ChdDSUhNMG9nS0VJQ0FnSUNCbHNqcTl3RRAB
Anytime Fitness Orchard,hyewon,5,great gym with quality equipments and friendly management team🤍 …,,ChZDSUhNMG9nS0VJQ0FnSURodDVyNFFnEAE
Anytime Fitness Orchard,J G,2,good music new equipment but it’s pointless .. more crowded and cramp than active sg gyms,,ChZDSUhNMG9nS0VJQ0FnSURoeHBhMVdBEAE
Anytime Fitness Orchard,Melissa Wong,5,"Friendly staff and well-maintained gym, highly recommended!",,ChZDSUhNMG9nS0VJQ0FnSUNKa1lPN0h3EAE
Anytime Fitness Orchard,Emilyn Wong,5,Thanks Erol for helping with the signup and being so friendly!,,ChZDSUhNMG9nS0VJQ0FnSUNudTQyZVBBEAE
Anytime Fitness Orchard,Man from Wuhan,1,"Kicked me out for wearing crocs, no consideration for first time either. Unacceptable.",,ChZDSUhNMG9nS0VJQ0FnSUMxb3NLWlBBEAE
Anytime Fitness Orchard,Tenh JinRen,5,"I like the environment here , the equipments are clean and the people here are awesome :)",,ChdDSUhNMG9nS0VJQ0FnSURlaVBucDNRRRAB
Anytime Fitness Orchard,Joseph Lim,5,"Great place, lots of good equipment and friendly staff",,ChdDSUhNMG9nS0VJQ0FnSUNKc29fUXNRRRAB
Anytime Fitness Orchard,Setya,5,Wonderful and great staff,,ChdDSUhNMG9nS0VPenk0cWJBZ2VqbjZnRRAB
Anytime Fitness Orchard,Junying Lao (Jacob),5,"Nice place, view and friendly staff",,ChdDSUhNMG9nS0VJQ0FnSUNQN01QNDNRRRAB
Anytime Fitness Orchard,Risvi samsuri,5,great and lots of varieties of equipments,,ChZDSUhNMG9nS0VJQ0FnTUNBbTVHb2VBEAE
Anytime Fitness Orchard,Shadow,5,Good lighting and sufficient equipment although quite narrow.,,ChdDSUhNMG9nS0VJQ0FnSUR0cV9Uc19BRRAB
Anytime Fitness Orchard,simone lin,5,"cozy vibes w friendly staff, especially kate! :)",,ChZDSUhNMG9nS0VJQ0FnSURUMGR1b0lBEAE
Anytime Fitness Orchard,Laven Lee,5,very cool vibes. lighting is immaculate at night. VIEW IS SUPER AMAZING 😩😩 …,,ChZDSUhNMG9nS0VJQ0FnSUNXcmJmSVZnEAE
Anytime Fitness Orchard,Jol Mike,5,"Good stuff frfr. Lighting and whatever all good stuff frfr. Like no joke. Like a good joke, without a joke. It's just really good lah you know",,ChdDSUhNMG9nS0VJQ0FnSUNKZ0tPdXJBRRAB
Anytime Fitness Orchard,aelly,5,friendly front desk.,,ChdDSUhNMG9nS0VJS1RvSUQ0bXVXYW93RRAB
Anytime Fitness Orchard,Sarah Jay,5,Farah help me with the check in when i forgot to bring my keyfob. She is super helpful:))),,ChdDSUhNMG9nS0VJQ0FnSUMtbVBTZjVBRRAB
Anytime Fitness Orchard,Ben Grant,5,"Good equipment , nice and cold.",,ChZDSUhNMG9nS0VJQ0FnSURYMjhqckpREAE
Anytime Fitness Orchard,Rainey Jing wen,5,Anwar & Zahin is really welcoming 🤍🤍🤍💜💜💜 good job purple warriors 🤙🏽 …,,ChZDSUhNMG9nS0VJQ0FnSUR4bDR5RGR3EAE
Anytime Fitness Orchard,Dastala Lucki,5,"Its always been a joy going to this AF gym the equipments are new, the place is clean and the staff are friendly.",,ChZDSUhNMG9nS0VJQ0FnSUNPcnAzcUV3EAE
Anytime Fitness Orchard,chew zixuan,5,"clean and vibey gym, good place to just train and have some alone time to yourself, especially in the morning",,ChZDSUhNMG9nS0VJQ0FnSUR4ajZ5OExnEAE
Anytime Fitness Orchard,Carol Wong,5,"Central area, well maintain of equipment and great embience for workout. 👍 …",,ChdDSUhNMG9nS0VJQ0FnSUQ5LUx5U3VRRRAB
Anytime Fitness Orchard,Philip,4,Everything else is nice. Except that there's no toilet inside the gym.,,ChZDSUhNMG9nS0VJQ0FnSUNlN3ZlTE1BEAE
Anytime Fitness Orchard,Shinchan Iscute,5,"Dien is very helpful, friendly and cheerful :)",,ChdDSUhNMG9nS0VJQ0FnSUNQbXZXXy1BRRAB
Anytime Fitness Orchard,One Flamie,5,The staff is very friendly and the equipment is in very good condition :),,ChZDSUhNMG9nS0VJQ0FnSUR4cThHS0x3EAE
Anytime Fitness Orchard,Maya ILIADES,5,Extremely friendly staff and very convenient location. Highly recommend :),,ChdDSUhNMG9nS0VJQ0FnSUNKenNuUHp3RRAB
Anytime Fitness Orchard,Monty B,1,Shifty staff members pocketing the $85 deposits for fobs required for access,,ChZDSUhNMG9nS0VJQ0FnSURaMlAzNklnEAE
Anytime Fitness Orchard,Victoria Jane Kiew,5,"great equipment, great music, friendly staff (esp anwar)!",,ChdDSUhNMG9nS0VJQ0FnSUR4cC1tMDZRRRAB
Anytime Fitness Orchard,sheng-ern,5,great vibes with very clean facilities,,ChZDSUhNMG9nS0VJQ0FnSUNueko2TUdnEAE
Anytime Fitness Orchard,Chin Yong Jun,5,Staff was very friendly and the environment is nice 👍 …,,ChZDSUhNMG9nS0VJQ0FnSURqODdyU0dBEAE
Anytime Fitness Orchard,Jim Vega,5,Very clean and the staff was very helpful,,ChdDSUhNMG9nS0VJQ0FnSUMzMXFYcW1BRRAB
Anytime Fitness Orchard,Juliana,5,Has a lot of equipment and it's not crowded during weekend lunch time.,,ChZDSUhNMG9nS0VJQ0FnSUNodjZYdk1REAE
Anytime Fitness Orchard,bob Wong,5,Staff zahin and yu da was very friendly and helpful!,,ChdDSUhNMG9nS0VJQ0FnSUNUMXVxSHRRRRAB
Anytime Fitness Orchard,Herman Soh,5,"Amazing atmosphere, new equipment and top tier service from Siti and Farah",,ChZDSUhNMG9nS0VJQ0FnSURXanFhVE1BEAE
Anytime Fitness Orchard,Zubair Ibrahim,5,"Good Gym, friendly staff, well equipped.",,ChZDSUhNMG9nS0VJQ0FnSURXckpiOWZnEAE
Anytime Fitness Orchard,Charis Koh,5,"Good service, very friendly",,ChdDSUhNMG9nS0VJQ0FnSUNfdFBYbm1nRRAB
Anytime Fitness Orchard,Michelle Kii,5,nice AC,,ChZDSUhNMG9nS0VJQ0FnTURJaHF1eVJnEAE
Anytime Fitness Orchard,Thaddeus Sharvin,5,great staff great equipment overall excellent gym,,ChdDSUhNMG9nS0VJQ0FnSUMtNktiN3lnRRAB
Anytime Fitness Orchard,Mel Chua,5,Really good services and nice space,,ChZDSUhNMG9nS0VJQ0FnSUNQLU5HTWV3EAE
Anytime Fitness Orchard,qwerty “qwerty”,5,EXTREMELY FRIENDLY PPL HERE!! Esp to newer guys like me!,,ChZDSUhNMG9nS0VJQ0FnSUREdmJ6ZU1REAE
Anytime Fitness Orchard,Lydia Liu,5,The first visit experience is good and the staff is very friendly!,,ChZDSUhNMG9nS0VJQ0FnSUR4XzZYUkZnEAE
Anytime Fitness Orchard,Alice Tan,5,Very nice outlet and friendly staff,,ChdDSUhNMG9nS0VJQ0FnSUNuOU9xS19RRRAB
Anytime Fitness Orchard,Joshua Ezekiel Moses,5,Awesome gym with great ambience,,ChdDSUhNMG9nS0VJQ0FnSUNQeXJTajJ3RRAB
Anytime Fitness Orchard,osnap itzari,5,Friendly and knowledgeable AF staff.,,ChZDSUhNMG9nS0VJQ0FnSURQNC1iS0N3EAE
Anytime Fitness Orchard,Izzul ISLAM -SINGA3433-,5,The staff is very friendly and equipment is 100/100,,ChZDSUhNMG9nS0VJQ0FnSURqOVpxTU1BEAE
Anytime Fitness Orchard,la zer,5,"LOVED IT, especially the staff named Erol. 😍😍😍 …",,ChdDSUhNMG9nS0VJQ0FnSUQ5LU15NHNBRRAB
Anytime Fitness Orchard,Isaiah Tan,5,"Solid service, Umar and QJ were friendly and informative",,ChZDSUhNMG9nS0VJQ0FnSUNKc09IYUlREAE
Anytime Fitness Orchard,Malcolm Tan,5,Thanks Abigail for the quick and thorough sign-up!,,ChdDSUhNMG9nS0VJQ0FnSUREM3Q3ZHl3RRAB
Anytime Fitness Orchard,Jared Phay,5,Staff are very friendly and equipment are in very good condition,,ChZDSUhNMG9nS0VJQ0FnSUR4cThHWUh3EAE
Anytime Fitness Orchard,Hendra Khoo,5,"Friendly staff!
Clean and hygienic gym!",,ChZDSUhNMG9nS0VJQ0FnSUNKa2NPRVd3EAE
Anytime Fitness Orchard,Arjun Rao,5,"Farah, Collin and Amanda are the best facilitators over at this outlet. Thanks for the guidance.",,ChZDSUhNMG9nS0VJQ0FnSUMtbU5pLVFREAE
Anytime Fitness Orchard,Kimberly Lim,4,"Comprehensive equipment, friendly staff",,ChdDSUhNMG9nS0VJQ0FnSUNQbGRDaDJRRRAB
Anytime Fitness Orchard,Muhd Edry,5,Very nice gym! Friendly staff!,,ChZDSUhNMG9nS0VJQ0FnSUNKNUlDcmVREAE
Anytime Fitness Orchard,Lydiawati Samsudin,5,Clean and cozy. With smiley and attentive staffs.,,ChdDSUhNMG9nS0VJQ0FnSUNEdHVuU2tRRRAB
Anytime Fitness Orchard,Colin Lee,5,"ZAHIN AND UMAR great help at the gym, keep up the good work!",,ChdDSUhNMG9nS0VJQ0FnSUNKNXZySmhnRRAB
Anytime Fitness Orchard,Ian M,5,"Farah is very attentive & friendly
thumbs up & keep up the good work",,ChdDSUhNMG9nS0VJQ0FnSUMtbUs3RTFBRRAB
Anytime Fitness Orchard,Hayden Chen,5,"11/10 view
eleiko bar so new
squat and i feel like phew",,ChdDSUhNMG9nS0VJQ0FnSUNXOF9pRHN3RRAB
Anytime Fitness Orchard,gon,5,well equipped and love the staff company,,ChdDSUhNMG9nS0VJQ0FnSURqdWU3RnBRRRAB
Anytime Fitness Orchard,xuan quan,5,"Great vibes, and the aircon is cold 😅 …",,ChdDSUhNMG9nS0VJQ0FnSURqLVlLYnN3RRAB
Anytime Fitness Orchard,Nicholas Poh,5,"Love the training equipment, the friendly staff, and ambience",,ChdDSUhNMG9nS0VJQ0FnSURoajdEcjF3RRAB
Anytime Fitness Orchard,Laurens Oldenzeel,5,"Awesome Gym, great protein bars (yet to find out)!!",,ChZDSUhNMG9nS0VJQ0FnSUMtNkxQRFN3EAE
Anytime Fitness Orchard,Blaire Lee Jin Kyeong,5,Fantastic Boombastic Mayli. Send my regards to her.,,ChdDSUhNMG9nS0VJQ0FnSURqN3BPQ3NnRRAB
Anytime Fitness Orchard,Bhuwan Ghosh,5,"new machine and setup
v friendly staff",,ChdDSUhNMG9nS0VJQ0FnSURYeUtuSzd3RRAB
Anytime Fitness Orchard,Fion Woo,5,good vibes～,,ChdDSUhNMG9nS0VJQ0FnSUNua3MybjB3RRAB
Anytime Fitness Orchard,Dungriyal vlogs,5,💪 …,,ChZDSUhNMG9nS0VJQ0FnSURlNVpEYWJnEAE
Anytime Fitness Orchard,Eugene Lee,5,Well done very good,,ChdDSUhNMG9nS0VJQ0FnTURRcGFlZDdRRRAB
Anytime Fitness Orchard,kriallan,5,Nice location and very clean,,ChdDSUhNMG9nS0VJQ0FnSUMzaktIUG5RRRAB
Anytime Fitness Orchard,Эдуард Пауль,5,Train here everyday. Favourite place in whole Singapore,,ChdDSUhNMG9nS0VJQ0FnSUNKX04zYWpnRRAB
Anytime Fitness Orchard,Ang Qi Rui,5,Full of clean and well maintained equipment,,ChZDSUhNMG9nS0VJQ0FnSURMcHFtX1l3EAE
Anytime Fitness Orchard,JJ Lee,5,"first time here, vibes quite chill",,ChdDSUhNMG9nS0VJQ0FnSUNYX3JERXZ3RRAB
Anytime Fitness Orchard,Noe Cost,1,It’s hav been weeks and the water fountain is still under maintenance.,,ChZDSUhNMG9nS0VJQ0FnSUNSMHVYcWZ3EAE
Anytime Fitness Orchard,andy7 andy,5,Clean and hygienic with friendly staff,,ChZDSUhNMG9nS0VJQ0FnSURYMmJXYWNnEAE
Anytime Fitness Orchard,brandon lee,5,Awesome staff tonight :>,,ChdDSUhNMG9nS0VJQ0FnSURfbXNlSjZBRRAB
Anytime Fitness Orchard,Zixiong Wang,5,Isaiah is really helpful and kind for the whole time,,ChZDSUhNMG9nS0VJQ0FnSURqcmR1YkVREAE
Anytime Fitness Orchard,Cherish Neo,5,Super approachable staff with a warm & friendly environment :) thank you!!,,ChdDSUhNMG9nS0VJQ0FnSURXMUxmVzlRRRAB
Anytime Fitness Orchard,JunXian Goh,5,clean and well spread + maintained equipments.,,ChdDSUhNMG9nS0VJQ0FnSUR6ck1TWm13RRAB
Anytime Fitness Orchard,Yii Fatt Lim,5,Insane value for providing protein shake 🤯😮‍💨 …,,ChdDSUhNMG9nS0VJQ0FnSUNuMHRUYjJRRRAB
Anytime Fitness Orchard,Timothy Koh,5,well equipped with friendly staff,,ChdDSUhNMG9nS0VJQ0FnSUNuNDgySWpnRRAB
Anytime Fitness Orchard,Brian,1,Awful staff. Good gym equipment.,,ChZDSUhNMG9nS0VJQ0FnSUR4bXFlaklBEAE
Anytime Fitness Orchard,Rangga Kenaz,5,Amazing facility and amazing service as well,,ChZDSUhNMG9nS0VJQ0FnSUN6ejhMQ1Z3EAE
Anytime Fitness Orchard,Poached Salmon,5,Great accessibility and staff are great and friendly,,ChZDSUhNMG9nS0VJQ0FnSUNyMExfOFlnEAE
Anytime Fitness Orchard,Eric Yong,5,Great location with fantastic and helpful service.,,ChdDSUhNMG9nS0VJQ0FnSUNUX2VmS3d3RRAB
Anytime Fitness Orchard,何铭智,5,very good,,ChZDSUhNMG9nS0VJQ0FnTUNRaDc3QkpBEAE
Anytime Fitness Orchard,grandspurs6 6,5,Afiq is a good front desk,,ChZDSUhNMG9nS0VJQ0FnSUNQM1BMdldnEAE
Anytime Fitness Orchard,Shannon Tan,4,Well equipped. Convenient location.,,ChdDSUhNMG9nS0VJQ0FnSURYamFqbjV3RRAB
Anytime Fitness Orchard,Sabirah Ainn,5,Shah was very friendly and helpful in assisting me in the gym,,ChZDSUhNMG9nS0VJQ0FnSUN1aW96cUlBEAE
Anytime Fitness Orchard,Shakina Rohman,5,Very convenient and spacious,,ChdDSUhNMG9nS0VJQ0FnTURnamR2UzhRRRAB
Anytime Fitness Orchard,Vandy,5,great atmosphere and lovely people,,ChdDSUhNMG9nS0VJQ0FnSURIME5QOXVBRRAB
Anytime Fitness Orchard,Faith Xu,5,One of my fav af! Nice n friendly staffs,,ChZDSUhNMG9nS0VJQ0FnSUMydzhTLUxnEAE
Anytime Fitness Orchard,Ashley Nicolas,5,Super helpful and nice staff!,,ChZDSUhNMG9nS0VJQ0FnSUMzOHRxN0pREAE
Anytime Fitness Orchard,Eric C,5,Convenient location right in the heart of the city,,ChdDSUhNMG9nS0VJQ0FnSURuMEtEXzZRRRAB
Anytime Fitness Orchard,Alesha Ann,5,Great experience! Friendly staff,,ChZDSUhNMG9nS0VJQ0FnSUNUMUxhcFp3EAE
Anytime Fitness Orchard,vanessa,5,smaller than i thought but has what u need,,ChZDSUhNMG9nS0VJQ0FnSUNIa3VDS1RREAE
Anytime Fitness Orchard,Ramsey Yew,5,Best gym ever!!!,,ChZDSUhNMG9nS0VJQ0FnTUNJal9lRUVnEAE
Anytime Fitness Orchard,Shanice Chan,5,QJ and Anwar were very bubbly and helpful!,,ChdDSUhNMG9nS0VJQ0FnSUNKbU1iWm9nRRAB
Anytime Fitness Orchard,Alden,5,Staffs are very nice and helpful! shoutout to qiaojuan,,ChdDSUhNMG9nS0VJQ0FnSUNKbU1TSGxBRRAB
Anytime Fitness Orchard,H,5,best place for max gains 😙😙💪🏻💪🏻 …,,ChZDSUhNMG9nS0VJQ0FnSUNYMzh6VmJnEAE
Anytime Fitness Orchard,Kelvin chin,5,I’m enjoy the vibe and staff is being kind 😁 …,,ChdDSUhNMG9nS0VJQ0FnSUQ1OG92RHJRRRAB
Anytime Fitness Orchard,Keith Goh,5,"Nice environment, friendly staff",,ChZDSUhNMG9nS0VJQ0FnSURqdl9XQWZ3EAE
Anytime Fitness Orchard,Tsao Chengwen,5,Good service with detailed explanation,,ChdDSUhNMG9nS0VJQ0FnSURQbzViWndBRRAB
Anytime Fitness Orchard,Anson Chiang,5,best gym in orchard. legit,,ChZDSUhNMG9nS0VJQ0FnSURqLS1QWGRnEAE
Anytime Fitness Orchard,Julien,5,Superb equipment and friendly staff,,ChZDSUhNMG9nS0VJQ0FnSURqNTZQeFJBEAE
Anytime Fitness Orchard,shuih wah nik,5,Nice gym,,ChZDSUhNMG9nS0VJQ0FnSUR2a3RTSmF3EAE
Anytime Fitness Orchard,Elizabeth Wu,5,Great gym!,,ChdDSUhNMG9nS0VJQ0FnTURJaHR1Wnp3RRAB
Anytime Fitness Orchard,Seth Cheong (moist_liquid),5,big gym friendly staff,,ChdDSUhNMG9nS0VJQ0FnSUNQN0lPdDFRRRAB
Anytime Fitness Orchard,Keith Wong,5,Best gym in Orchard !!! Facilities are 10/10,,ChdDSUhNMG9nS0VJQ0FnSURodC03RTFBRRAB
Anytime Fitness Orchard,Michael Andreas,5,Love the friendly team in the club!,,ChZDSUhNMG9nS0VJQ0FnSUNONjVIYVVnEAE
Anytime Fitness Orchard,tengku eman,5,So grear and nice,,ChdDSUhNMG9nS0VJQ0FnTUNBNHRUZDRnRRAB
Anytime Fitness Orchard,Jay,5,Its great experience in this gym,,ChZDSUhNMG9nS0VJQ0FnSUNYdnFYa2V3EAE
Anytime Fitness Orchard,FizzyIzz,5,Facilities and Staff were so good!!!,,ChdDSUhNMG9nS0VJQ0FnSUNKcExfVWpnRRAB
Anytime Fitness Orchard,banglaciaga,5,👍 …,,ChZDSUhNMG9nS0VJQ0FnSUNYcnZHOEpBEAE
Anytime Fitness Orchard,Filipe Mello,5,I was very welcome on that gym.,,ChdDSUhNMG9nS0VJQ0FnSUMzOHJPTG5nRRAB
Anytime Fitness Orchard,winston deng,5,best gym,,ChZDSUhNMG9nS0VJQ0FnSUNYMy16akx3EAE
Anytime Fitness Orchard,JH soh,1,my belongings got stolen,,ChZDSUhNMG9nS0VJQ0FnSUNfdEtuN1F3EAE
Anytime Fitness Orchard,aharw,5,Fast friendly service,,ChZDSUhNMG9nS0VJQ0FnTUNRNG96QUlREAE
Anytime Fitness Orchard,Marcus Yeow,5,great gym,,ChZDSUhNMG9nS0VJQ0FnSUNuNHZxS0p3EAE
Anytime Fitness Orchard,Jose Cadiz,5,Good gym,,ChdDSUhNMG9nS0VJQ0FnSURIcl9hWnVBRRAB
Anytime Fitness Orchard,Michael Wong,5,Area is clean and well maintained,,ChdDSUhNMG9nS0VJQ0FnSUQ5LUxUWW93RRAB
Anytime Fitness Orchard,Jeremy Lim,5,Excellent equipment but quite packed.,,ChZDSUhNMG9nS0VJQ0FnSURXM3RHdWNREAE
Anytime Fitness Orchard,Tama,5,good gym,,ChZDSUhNMG9nS0VJQ0FnSURIME5Qc0dnEAE
Anytime Fitness Orchard,Edwin Lim,4,Convenient gym in the heart of town!,,ChZDSUhNMG9nS0VJQ0FnTURRNnVleUhREAE
Anytime Fitness Orchard,Ching Ling Lim,5,Not crowded in the morning.,,ChZDSUhNMG9nS0VJQ0FnSUNYM3N1ckhREAE
Anytime Fitness Orchard,Jarett Ng,5,Free apples after working out. Thumbs up,,ChdDSUhNMG9nS0VJQ0FnSUN4cmFqQ19RRRAB
Anytime Fitness Orchard,Sing Hale,5,Nice place to workout in SG,,ChdDSUhNMG9nS0VJQ0FnSURIMjlxLTlnRRAB
