outlet,author,rating,text,date_posted
Anytime Fitness hillV2,Mohd Nasir,1,The gym is very big but the generosity of the owner is indeed very small. Unless you sign up for PT you can't use their body scan machine. Unlike the other AF I went to where they allow all to use as long as AF member,Date not found
Anytime Fitness hillV2,Ma tt,1,"I’m not sure if the owner does read or act on the feedback given. It appears that the gym looks pretty much the same compared to before the revamping took place.

1. Lower the music. Even with noise cancelling earphones, the background music is extremely disturbing. It doesn’t help when the screens are playing other videos. The conflicting, blasting noise hurts the ears.

2. Lack of machines for bicep and abs. While there are free weights to cater to this, it will be great if there could be a greater variety of machines.

3. No hairdryer. The toilets came with only one bath area, one for each gender. Without the hairdryer, it can be very inconvenient if one is getting ready to head to work.",Date not found
Anytime Fitness hillV2,litty x,2,"Quite accessible due to location and distance to MRT. However lacks in variety of equipment, understandably due to lack of space. However it might be worth investing in a weight rack perhaps?

Condition of the gym has dropped over the years, with corners of dirt and dust frequently being overlooked and a persistent general layer of grime on surfaces (not just equipment, willing to overlook due to frequency of use) even after the cleaners leave. Would be fine if they chose to close the gym every now and then just for a refresh.

Incredibly warm nearly all the time I visit.

However toilets are kept clean and people are also nice here.",Date not found
Anytime Fitness hillV2,Nicholas N,5,"Visited this gym 2 times so far during lunch, not crowded and area is very well maintained and clean. Equipment is also reasonable given the size of the area.

Special shoutout to Tina who is very friendly towards me and my friend!",Date not found
Anytime Fitness hillV2,khrhms,4,Pretty good spot for a quick workout. Not a huge outlet but has everything you need. Not too busy in the evening too.,Date not found
Anytime Fitness hillV2,richard mcnick,5,"Love the staff,
love the playlist, needs to be louder,
hope the aesthetic will include dimer lights like the other outlets
love the new treadmills with phone charging ports!
friendly Trainers  who are helpful.
hopefully will have renovation soon as some machines needs to change . Kettlebells need to change. But whatever you need its there.",Date not found
Anytime Fitness hillV2,Edward,5,"I just want everyone who uses this gym to know that the only reason why the air-conditioning isn't turned off at ~10PM is because in 2022, I emailed the management incessantly about it (""Anytime Fitness? Or Until 10PM Fitness?"") until they gave in.

You're welcome.",Date not found
Anytime Fitness hillV2,Jayvinn Wong,3,"Came here on a weekend at 9am, and there were only 5 other people here.

Tldr: Great equipment for limited space, but v warm if you come early in the morning (before the aircon kicks in).

+ Limited space but they fit in a great selection of equipment. All the essential machines, cables, 2 full racks with attached platforms, and 3 addition half racks, as well as crossfit equipment like kettlebells.
+ Attached toilet and changing room facilities.
+ Plenty of sanitizing sprays and wipes provided.

- Came here during unstaffed hours, so no comment on service. However, the air conditioning was noticably lacking, with the room being very warm. It became better around 10.30am, so perhaps the air conditioning is on a timer.",Date not found
Anytime Fitness hillV2,Christopher Bobin,5,"I've used many Anytime Fitness outlets in Singapore and HillV AF is one of the more solid AF facilities.  There's something for everyone here but the emphasis is on weights, with plenty of stations for bench, dead lift and presses.  The facility was recently renovated and a number of machines were added, particularly for targeting back and shoulder: a huge upgrade.  There are machines for legs and aeorobics as well.  Located in the HillV centre, there are a number of good restaurants, grocery and cafes nearby.  Highly recommended.",Date not found
Anytime Fitness hillV2,S. Sulianah,5,"Another favourite branch. It is like the one in Greenwich V but feels like abit bigger here probably cos there are classes for this branch (if I am not wrong). If u like serene and quiet environment especially not many people, be here at non-peak period. I tried at 3pm to 5pm on a weekday. So it is nice. Spacious too and all equipments looks new and well-maintained.",Date not found
Anytime Fitness hillV2,Jerome Tong,1,"First impressions: convenient 24/7 gym, had all the required equipment and in decent condition, somewhat packed but didn’t require booking which was a big plus for me.

After ~1 year with the place: Weights left lying about on the floor, some equipment “out of order”, kettlebells’ paint peeling off and rusting. Photos attached

Side note on front desk staff - completely clueless on the booking system; allowing people who did not book to enter, and people with valid reservations can’t get in due to capacity, forcing them to wait outside for up to 30 mins during peak hours. Defeats the purpose of having a booking system.",Date not found
Anytime Fitness hillV2,Juliana Seng,1,"Goods
- Threadmills are new. As well as the kind reminder sticker to not spray disinfecting liquid on the screen.
- Dumbbells are not rusty.

Bads
- Barbells looks very rusted.
- Plastic leather cover on some equipment looks worn out. Doesnt affect functionality, but can consider replacing.
- Only 2 bench press in front of the dumbbell racks and the minimal space in front of the mirror.
- Only 2 toilet with shower and 1 changing room
- Some fans at the corner are black with dust and in need of a wash.

Unacceptable
- I went at 840am, walked in and my first impression is that outside is way cooler than inside. Unbelievable. I searched for any aircon remote lying around, but alas, there was none.

The aircon looks like it is running, there are helpful paper strips stuck on the aircon to show that wind is indeed blowing out from the unit. The little paper strips just tells me that the aircon has been an ongoing problem.

As I run on the threadmill, some (conspiracy) theories floated in my mind. Maybe the aircon is centralized and the shopping mall has not turned it on yet. Maybe the aircon is on fan mode and not cool mode, and the management want to save aircon money. 9am, 915am, no signs of any centralised aircon switching on. There are more people and it is getting warmer and stuffier and I feel abit light headed. Maybe the oxygen in the room is decreasing too. Cant take it anymore, gonna hop over to another AF outlet.

On my way out, I pop over to the little employee office and asked if the aircon has always been like this. They mentioned they are aware of the issue, it is abit humid and are going to fix it.

Yeah, it is extremely warm, humid, stuffy and fixing it needs to be a top priority. Recommend they get portable aircon. And I am really salty that the employee office, enclosed in its glass walls and separated from the perspiring humans outside, is more cooling. Angry emoji.",Date not found
Anytime Fitness hillV2,Steve Demers,1,"Let me tell you a story of why you shouldn't use this location at HV2 and I never will again - I'll be telling everyone I know who lives around here too.

I travel a lot and make use of many different gyms abroad .

I've had an Anytime Fitness membership so that I can use their facilities when they are available abroad.  Often there's one nearby, I've never had a bad experience - until this one.

This location is actually near to my home but have never bothered to use it because our condo gym is decent and convenient to use by just walking downstairs.

Recently I decided to check out it though, maybe there's a couple of exercises that can add to my routines that would be beneficial.

After a very short time there I began to see the degradation of this facility.
Machines that seem to be perpetually broken, water fountain that is out of service, washrooms with equipment that just had a sign on them indicating they'll never be repaired, replaced or removed.

It's a bit of a dirty gym too.
There's layers of dirt in the corners from nobody cleaning for long periods.
There's spray bottles on the equipment with little rags to wipe with - but after a few days of seeing the exact same rags not being replaced or cleaned - I could tell that they seldom get changed out.  Several of them are brown from mildew and dirt...gross.

Pretty much every piece of padded equipment is fraying at the stitch seams.

This place may have been in good shape when HV2 opened but it's been maintained poorly.

Notwithstanding all of that I went for a few days because my membership is set to expire at the end of the month and I wanted to decide whether or not to renew again.  If I did then I'd start using this location.

Well...my last visit assisted in making that decision for me!

When attempting to use the cable rack I noticed a badly failed carabiner.  I'm sure you're familiar with them and what they do - also what a failed unit looks like.
This one wasn't returning to the lock position on its own after changing out grips.
This is a horrible accident waiting to happen, if someone uses it and it snaps (which they certainly do) it'll injure that poor soul very badly.

Having seen this before my 30 years of gym training I took off and went to see about getting a new one from the staff - whom the door says are available from 10 am.

I've asked for these to be replaced before at other gyms and they always have them available just in case - they're cheap equipment that is important.  It's good to have spares right?

It was 11 am - there was nobody to be seen.  So I placed the carabiner on the staff door handle.

At 11:18 I noticed a staff member came in.  While he was getting his keys out to unlock the staff office he saw the carabiner and picked it up to look at it.

I went over to explain where it came from and to ask for another one - I'd be happy to place it.

He hands it back to me saying that it's fine to use and that all I have to do is move the lock mechanism over by hand every time.

This was a bit shocking.  He was telling me to just keep using the dangerous failed carabiner!
I insisted that it should not be used and told him that someone could get hurt.  Still he told me it's fine.

I argued that a gym shouldn't have this sort of injury liability in their facility and he finally took it from my hand with a very grumpy look and mumbled something about getting one online.

Asking him how long it will take to be replaced he said with a very annoyed look that he had no idea and that he'll have to find somewhere to ""source"" one.

This was surprising!  Not only did this gym not have one but seemed reluctant to even place it on a priority so that members can continue use the facility fully.

As a joke and a test to see how far this will go I told the now angry looking fellow that ""How about I just buy one with my own money and bring it in then?""

He was quite agreeable to this with a ""okay that sounds good""

I'm not doing that!
Thank you Marcus for helping me decide to not renew my membership.",Date not found
Anytime Fitness hillV2,rosesx caramel,1,"unhelpful management team, heartless and no consideration for members. just money making organisation. never again.",Date not found
Anytime Fitness hillV2,A G,1,"I wonder if it’s the worst outlet of AF. So much equipment always out of order, one of 3 treadmills has been broken for over half a year!!! The music speakers are broken and make muffled noise and yet they blast the music all the time, have to wear earplugs and still can hear that horrible sound. Some members find it fun to throw the weights loudly on the floor, and none of the staff tells them anything",Date not found
Anytime Fitness hillV2,Sahaf Ibrahim,3,"Good enough facilities but it's ultra accessible to folks living around hillv2. They have a lot more cables since the last renovation, but still miss certain machines, the most glaring being the core",Date not found
Anytime Fitness hillV2,Jessica L,1,"I had great experiences at this gym, however, a recent situation happened to me that I had to give it a low 1 star.

So, I forgotten to bring my KeyFOB with me, and usually if it’s during staffed hours, they will manually registered me into the gym, no problem. However, today, they turned me away and said that they have a new “No KeyFOB, No entry” policy. I tried to reason with the staff but he did not give any wiggle room.

I find this completely unreasonable. It’s during staffed hours, it’s a super simple process and you will be doing your customer a huge favour. And don’t you want happy customers? I just don’t understand why can’t this be done.

Besides the adorable cleaning uncle, the management and logic of this gym is questionable and frustrating.

@Hillv2AF’sManagement, please consider lifting this policy at your gym. You’ll be doing us tired gym goers a huge help, when we made the effort to go to your gym and not be turned away. Thanks.",Date not found
Anytime Fitness hillV2,Thanapon Rudeerat,1,"If I could, I’d give this gym 0 stars. The management of this franchise is horrible. They just suck your money up even when you want to cancel your membership. Gym was poorly maintained and always crowded. So crowded to the point there won’t be space to work out. Never coming back to Anytime Fitness.",Date not found
Anytime Fitness hillV2,bharat soni,1,"A few staff members are rude. The gym rules don't apply to the people who have paid for a personal trainer.

I have been a member for more than 2 years, the old staff members were nice and polite. But few of people are very rude.

Most of the times it seems like they are just after your money. Always cutting costs.The basic supplies like paper towel runs out of stock for many days. Equipments will be out of order many days. Few staff members only treat the people who paid for PT nicely. And are rude to others.",Date not found
Anytime Fitness hillV2,Varun Kapila,1,The treadmill has been out of service for more than a month. The gym is already too compact for the amount of people working out and now everyone is also waiting for treadmills. Very limited machines and a lot of members are more interested in making reels and filming workouts than actually working out hence increasing the time of wait.,Date not found
Anytime Fitness hillV2,T Q,1,"Ladies, beware. This is the gym where you will find some of the rudest guys here who occupy gym equipment for more than 1 h (not exercising but just sitting at the side), some slam weights and others intimidate you. The female bathroom is always used by guys and now the gym decided to convert the one and only female toilet into a unisex one, with the male toilet beside it. Covid rules have been relaxed but they still refused to provide mats to users. Wouldn’t it be more unhygienic to lie on the floor?

A self-entitled guy even asked me to move away to another area while I was halfway through a workout, even though I was there first and used only 1 m2 of space. Not sure if he’s one of the staffs. There was a HUGE area where he already occupied with various equipment. He got angry when I ignored him and purposely hurled the weighted ball continuously while standing near me, it was absolutely dangerous and could have hit me. The staffs did nothing to stop him, or any other rude behaviours displayed by some of the members. There is a sense of sexism here in the gym.

I’m definitely going to switch my home gym. 😡",Date not found
Anytime Fitness hillV2,Borislav Georgiev,4,"Excellent gym!

Great location, very clean and pleasant interior, friendly staff. The equipment is new and well maintained. Highly recommended!

Edit: Feb-2022. They must really remove these reservations requirements if you want to go in the morning or late in the evening. What a nonsense. And I still don't understand why they keep asking for your keyfob number every time you enter. Removing 1 star because of these.",Date not found
Anytime Fitness hillV2,Chili Red Arowana,4,"Contrary to the 3.3 stars.. I find this outlet quite large compared to Orchard outlet (the ants nest) and aircon is strong, unlike in some other outlets.. the people are more Atas type, compared to Telok Bangla, over there have tattoo old men punks.. so overall this is better",Date not found
Anytime Fitness hillV2,Abhay Jaykar,3,"Average gym. Pretty crowded. Customer Unfriendly policies if you forget the Key fob.

21/11/2022: Service has definitely improved after interacting with Vanessa from the team. She has been super helpful and prompt in her follow ups.

21/09/2022: Very sad to revise this to one star.
- Had a 1 year fully paid membership which expired. I am happy to renew  but they could not accept the payment as register closed which is fine as it was 8pm ish and I cant use the facility that day even though I have been an advance paying member for a year and expressed the intent to renew.

- Scheduled to make payment on the weekend but activate it on 29th as I am travelling, but corporate policy does not allow that.

- No online payment.

Really struggling to be a loyal member. Lack of other choices within the vicinity.

The review is not meant towards the facilities managers or trainers as they are EXCELLENT, but seemed to be bound to the corporate policies.",Date not found
Anytime Fitness hillV2,Hans Chan,5,"I'm surprised this gym got a streak of bad reviews previously? I think this gym has the most barbell racks I've seen in a AF gym (4 racks and 2 barbell stands on other end, and 2 deadlift platforms. And they have assault bike and concept2 rower as well. Perfect for people into free weight/power lifting/cross trainings. I can't review for machines cuz i don't care about those. Only hope to have is more benches for free weights. Most of the time I literally only see 1 available bench for dumbbell area.

Toilet is clean and 1 for each gender. Really like the convenience of this location as well.",Date not found
Anytime Fitness hillV2,YH,3,"If you want to wear your masks at all times in the gym. Come here.

""WEAR YOUR MASK AT ALL TIME"". I was instructed by the gym trainer in a rather unfriendly tone when I visited there for the first time. Most other gym trainers in other locations were very very friendly. That's fine really, but the wording is wrong. WEAR YOUR MASK WHEN YOU ARE RESTING sounds better and more reasonable. But this is also disputable according to Singapore Covid rules because:

For indoor activities, masks may be taken off when performing strenuous
activity or as part of a class requirement but will have to be put on after the completion of such strenuous sporting and physical activity/class and during rest breaks.

And technically the entire workout session in any gym can be considered a single activity albeit with short breaks in between sets. But that's besides the point.

If you want to wear your masks at all times in the gym and being treated like an army recruit. Come here.",Date not found
Anytime Fitness hillV2,siru chen,5,"The good range of equipment and friendly coaches at this outlet means that although I can technically go to any other outlet (one of the perks of the Anytime Fitness menbership), I hardly ever do.

Only downside is that it gets crowded between 6pm and 9pm, so I really have to time my workout well if I don't want to be waiting for the treadmill or worrying about floor space for my mat workouts/cool downs.",Date not found
Anytime Fitness hillV2,Peanut Butter James Koh Z H,2,"So far the outward appearance looks pleasent. Clean gym, good equipment. Gym trainer are friendly. The good old days friendly management has gone. The 24hrs gym also gone at Hillv2. While other AF gym can function 24hrs. This is real disappoint too. Hillv2 still cannot find staff to stand in? Last time they even close at 8pm. They have no fix hour to gym. You never know when they are closing early. I'm their regular member in the past now I make my decision to move away from them I never regret. But the dark side is always unsound and have to be identify. Can see the hopeless look from the staff. The management team at Hillv2 is not as friendly, not reasonable not even customer centric. 2 stars was given to their poor service. This is one of the gym out of all the Anytime Fitness gym does not allow members to use there gym mats. Their reason was to reduce the spread of covid virus and they said that is sweat absorb. High risk. Question is why all other anytime fitness gym allow using the gym mats and statistic did not even show that gym mats will spread covid virus. Let's look at the statistic and don't give your own reason by reading artical that is not valid. Few months ago they even doesn't allow members to use the shower room. Same reason their own unrealistic answer the moisture in the toilet will speard the Virus. But when I check out with so many Anytime Fitness gym they did not restrict members to use it. If all the AF gym I visited does allow user to use the shower room and gym mats why This Hillv2 gym mamangment so poor in customer service and they suggest me to visit other gym? I'm OK to follow the rules but please make sure is standardise throughout all the AF gym. Even though is a franchise gym but it really sucks to had such an unrelistic reply from them. Even other AF gym manager also feedback to Hillv2 management and no one can do anything to them because they sound so bossy and they like to set their own unreasonable rules and never listen or take members feedback seriously. Are they too lazy to clean up the toilet or to clean the equipment or they just want to safe water bills? The same management team is handling jurong and yishun outlet. Since the incedient happen, I have not visit them till now. If they have open up those facilites, good for the gym user. To members you should go try out other AF gym, and out of surprise you may find much better service and equipment Compair to Hillv2 AF. Tiong Bahru, Raffles, Bukit timah, Tanjong Pagar, clementi they are one of the better gym.",Date not found
Anytime Fitness hillV2,wilson tay,1,"After visiting other outlets, suffice to say this is one of the most pathetic AF outlet.
Should consider making all AF members visit this outlet at least once to foster appreciation for their home gym.",Date not found
Anytime Fitness hillV2,John Lee,1,Air conditioning is so damn hell stuffy I feel like I’m working out in a sauna,Date not found
Anytime Fitness hillV2,Boon Lin Chua,1,"If can give no star, I would have. Poor staff attitude, many hidden fees (including $10 admin fee just to get a copy-and-paste excel sheet invoice each month), even had to pay an extra month of fees just to cancel the membership. To prospective AF signers, please think twice before you sign onboard AF HillV2. Or just hope your home gym don’t switch to here.",Date not found
Anytime Fitness hillV2,Simmie,1,"This gym did not handle my termination well during covid. They used google form for the termination application. Little did i know when there was a handover internally, my termination was never put forth properly hence my subscription ran for another few months, without me realising. In the end i got a demand letter to pay up for those months. And the staff did not care to resolve this issue. Left a very bad taste in my mouth.",Date not found
Anytime Fitness hillV2,Hong Tee Tay,1,"If can give zero star i will. Gym is not customer oriented. The guys there are like discipline masters. During covid time, it wss already difficult when they had their mask on policy while other branches have relaxed as with govt policies. And now they will keep “policing” u on their other rules. I suggest the owner just convert the gym to personal use. Im not here to be school by you. I go to schools for that. Suggest to go other branches not run by the same franchise owner. Avoid",Date not found
Anytime Fitness hillV2,Ming Yang,1,"Aircon is too cold, only 35°c. Would recommend installing more heaters to make the place warmer",Date not found
Anytime Fitness hillV2,Kamsah Hami,1,"I went to the gym a week ago with a group of my friends. The gym equipments were kinda lousy. Unhygienic place to workout. The supervisor was rude and was showing faces to the members.

Overall, it was quite a bad experience.",Date not found
Anytime Fitness hillV2,김일범,1,"8 Dec 2021, evening: The counter part-time staff is very unkind and rude. He ordered me to wear a mask with putting his hands in the pockets of his pants and glaring at me fiercely. He could request me to wear a mark nicely. Hasn’t he taken even basic service training? Please don’t provide poor service to your customer. We are not your enemy.",Date not found
Anytime Fitness hillV2,Jun Jie Pang,1,"I wasn’t allow access to the gym cause I wasn’t a “hillV2 home member”. But this runs in contradiction to the overall AF policy of providing members with access to all AF outlets. So unless I transfer my membership over, if not I will not be allowed in. In the end I figured it just isn’t worth patronizing.",Date not found
Anytime Fitness hillV2,Jordan Seah,1,"Convinced me to sign up for a free trial pass but required me to book appointment before coming without informing me. They would rather reject me at the door instead of accommodating.

Anytime fitness aren’t available any time.",Date not found
