outlet,author,rating,text,date_posted,review_id
Anytime Fitness Orchard,Benjamin Milne,5,Ayden was super friendly and made the whole signup process really clear and easy. Thanks.,,ChdDSUhNMG9nS0VJQ0FnTUNRMVBfTzBnRRAB
Anytime Fitness Orchard,Zahin Abdul muttalib,5,"Amazing staff, song choice and ambience. Equipments are very well maintained and the gym smells super good!",,ChZDSUhNMG9nS0VJQ0FnSUNUZ2R1T0R3EAE
Anytime Fitness Orchard,Rachel Ooi,5,"Went on Tuesday night to sign up the presale with my friend. Met with the most cheerful and helpful staff! Glad to sign up with them and I can't wait for the opening :)

This af outlet teamed up with reformd, which is a few units away, for their classes.",,ChZDSUhNMG9nS0VJQ0FnSURtNXNMRkR3EAE
Anytime Fitness Orchard,Marcus Lim,5,"Great gym and staff.

The staff here rotate between Buona Vista and Orchard Central. I got into a serious accident in the Buona Vista gym. Abbas, Kester, Farah and Siti rescued me. I will never forget them.",,ChZDSUhNMG9nS0VJQ0FnSUNlOUlmT0NREAE
Anytime Fitness Orchard,Jack Trueman,1,"Very small gym, extremely crowded 5pm onwards & AC is set to a super low level which is not good for the muscles. Swines kept my $85 deposit for the fob required to enter the gym. Avoid.",,ChdDSUhNMG9nS0VJQ0FnSURad295N3hBRRAB
Anytime Fitness Orchard,Xiu Hui Kim,5,gym is well equipped and clean! convenient location to gym at and offers attractive packages.,,ChZDSUhNMG9nS0VJQ0FnSUR2OGZ2SURREAE
Anytime Fitness Orchard,Ryan Mikael,5,"The gym is very well maintain and the equipments are stack nicely. The staff there are very friendly and fun to talk to. Ozy and Aishah are very approachable. Overall, it’s a really great experience.",,ChdDSUhNMG9nS0VJQ0FnSUNPd2J2QjNBRRAB
Anytime Fitness Orchard,Yuki,5,"Very clean and nice GYM, the equipments were clean and neatly placed, the staffs were very helpful, friendly and engaging too, if i remember correctly they’re QJ and Anwar ;))",,ChdDSUhNMG9nS0VJQ0FnSUN4b2JmVzhRRRAB
Anytime Fitness Orchard,Ray,5,Great gym with clean and well maintained equipment.,,ChZDSUhNMG9nS0VJQ0FnTUN3dl9LOUpBEAE
Anytime Fitness Orchard,Jamie Hiew,5,"The gym is neat and tidy, the staffs are friendly as I can chat with them and AF Orchard makes me feel like I belong here 👍
I love it here! Anwar, Umar & Farah the best!! …",,ChZDSUhNMG9nS0VJQ0FnSUR4eF91VmRREAE
Anytime Fitness Orchard,amber ho,5,"Superb gym !! Love the facilities & amazing customer service crew, especially Erol, who was very sincere !! 10/10 will visit again !",,ChZDSUhNMG9nS0VJQ0FnSUNqazdMQUdnEAE
Anytime Fitness Orchard,Yani Tech Reynoso,5,First time visiting this branch. The staff are friendly and very helpful.,,ChdDSUhNMG9nS0VJQ0FnTUNJdnVMcjhBRRAB
Anytime Fitness Orchard,sasuke dbz,5,"The staff I met were really friendly and helpful when clearing my doubts about the gym, really recommend coming here to train and meet them",,ChZDSUhNMG9nS0VJQ0FnSUR6amZLbVFBEAE
Anytime Fitness Orchard,Mat Hee,5,Great place to workout! Central and easily accessible! One of the better outlets as well!,,ChdDSUhNMG9nS0VJQ0FnSUNQOXU3dmxnRRAB
Anytime Fitness Orchard,allycia teo,4,AF Orchard is quite equipped and a pleasant place to train with friendly staff.,,ChZDSUhNMG9nS0VJQ0FnTUNnaWRfNVpnEAE
Anytime Fitness Orchard,Ivory Lee Hong,5,First time at this gym so awesome friendly staff as well!,,ChdDSUhNMG9nS0VJQ0FnSURQZ29YRzR3RRAB
Anytime Fitness Orchard,Fazal Siddiqui,5,"Great gym, clean and well maintained with a wide array of equipment!",,ChdDSUhNMG9nS0VJQ0FnSUMzMTlmQm5BRRAB
Anytime Fitness Orchard,Anne Monica Carlos,1,"Never been so devastated, I already cancel my mambership due to health issue and for the past 3 months still deducting membership fee. I have never been using their facility for the longest time and try to email them but still trying to put the blame on me they still deduct payment from my bank account and try to connect thru email but never give me a proper answer and did not refund my payment",,ChZDSUhNMG9nS0VJQ0FnSUMtdHJXV2RREAE
Anytime Fitness Orchard,Shaun Chen,5,"Spacious gym with a variety of equipment available. There are only shower rooms and changing rooms available, else the nearest toilets can be found in the Orchard Gateway mall premise on the same floor.",,ChZDSUhNMG9nS0VJQ0FnSUNlcW96V0dnEAE
Anytime Fitness Orchard,gwen rx,5,great air conditioning and clean equipment,,ChdDSUhNMG9nS0VMNlZ3dWpic2RDSGtnRRAB
Anytime Fitness Orchard,Firas Khan,5,First time dropping by this gym and thoroughly enjoyed my experience here! The staff and members were really friendly! Will drop by again!,,ChZDSUhNMG9nS0VJQ0FnSUNCcDllUUNBEAE
Anytime Fitness Orchard,Seng Keat,5,It's always an amazing experience in AF Orchard since 2023.,,ChZDSUhNMG9nS0VJQ0FnTURRME0yUGJnEAE
Anytime Fitness Orchard,Freddy,1,"Second time in the gym and will never visit again. I was asked to leave bcoz I wear my KEEN shoes to do squat. The staff said it’s not “proper gym shoes” for workout. And it has never happened before for other anytime fitness branch I went to ( Kovan/ tanjong pagar etc). When I asked them if there’s any written rules or policy i can refer to, they cannot answer me and said it’s basic gym manner, and it will increase my “injury rate”.

The other 2 guys beside me were deadlifting with barefoot which I think it’s fine. And the staff asked them to wear their running shoes to do deadlift ! If ur reason is to reduce injury, I believe if u stand on running shoes and do deadlift will make ur injury rate higher….if the staff really know what’s weightlifting.

I asked the deadlift guy if he was told to wear shoes when deadlift in other gym, he also said never. He just joined this gym and felt very weird.

So other people wear converse/ vans are considered proper gym footwear ? I don’t know their logic.

Will never visit again for sure.",,ChdDSUhNMG9nS0VJQ0FnSUMyNV91N3FRRRAB
Anytime Fitness Orchard,Eriq Iskandar,5,The staff named Nurul Anwar was the most professional salesman I’ve ever interacted with and he under promised and over delivered his services to me and overall the gym itself is a 5 star experience especially when you need things done fast in and out.,,ChZDSUhNMG9nS0VJQ0FnSUMtNkp5OE93EAE
Anytime Fitness Orchard,Darren Banana,5,Staff is really really friendly especially Dominic Goh ❤️ I miss him so much. Equipment was good also .,,ChdDSUhNMG9nS0VJQ0FnSUREdllYOHNRRRAB
Anytime Fitness Orchard,A,2,"No changing rooms, no toilets, only 3 power racks and rubber ez bars only go up to 20kg..
Spaces are tight, cable machine is less than a meter apart from the shelves to put our bags..
Only 3 benches in dumb bell area..

Update: Changing room was added and spacing improved a bit but a major red flag 🚩 no slamming weights sign appeared.. If you want to deadlift heavy be prepared to waste energy doing negatives
I suggest them adding padding below lifting platforms instead of having users do this.",,ChZDSUhNMG9nS0VJQ0FnSUNXcmRxSGZnEAE
Anytime Fitness Orchard,Shadiqqin Muhammad,5,Very nice gym with very good equipment and amenities. Location of it being in town area is a big + point as well,,ChZDSUhNMG9nS0VJQ0FnSUROME1Hd0VnEAE
Anytime Fitness Orchard,Robiaatul Adawiya Tan,5,"awesome gym to be at. good location, facilities and even great staff! Love it",,ChZDSUhNMG9nS0VJQ0FnSUREMTVQalhnEAE
Anytime Fitness Orchard,Cess Colico,5,Anwar gave me a tour on the gym and I have registered easily. He also talked to me the best option I should get. Thank you!,,ChdDSUhNMG9nS0VJQ0FnSUNuOU1fR2d3RRAB
Anytime Fitness Orchard,JIA MING KHING,5,"Gym is very clean , well equipped and maintained. Staff is very friendly and helpful towards members , overall very pleasant experience . I would like to thank the staff , Siti and Kester for always being helpful and welcoming :)",,ChZDSUhNMG9nS0VJQ0FnSURXaHV5QlZ3EAE
Anytime Fitness Orchard,Renel Alcantara,5,Nice gym in orchard and accommodating staff  Aaqil.,,ChdDSUhNMG9nS0VJQ0FnTUR3emVxUF93RRAB
Anytime Fitness Orchard,Nat Choo,5,"Amazing gym! Clean, cold and staff are very friendly! Love the vibes and have been hitting many PR’s there 🙏🏻 …",,ChZDSUhNMG9nS0VJQ0FnSURodDk2dFNBEAE
Anytime Fitness Orchard,Aaron Liew,5,Been here a couple of times walk in and have been enjoying it thus far! Thanks Umar for your help as well with the membership queries!,,ChdDSUhNMG9nS0VJQ0FnSURIel8yMF93RRAB
Anytime Fitness Orchard,irfan amran,5,"it was my first time having my workout here and i have to say the equipment here was great,the gym was clean and the workers here are friendly too,will look forward to my next workout here again :)",,ChZDSUhNMG9nS0VJQ0FnSURPb1BHeU5REAE
Anytime Fitness Orchard,Yau Ming,5,My PT trainer Herzy is the best PT trainer I have ever had. He is extremely knowledgable and intelligent. His anatomy knowledge is superb. And he knows the best exercises and stretches that you should do. I give him 10/10,,ChZDSUhNMG9nS0VJQ0FnSURPNHBXRFVBEAE
Anytime Fitness Orchard,Blake Edwards,5,Zahin and Renaldo were very welcoming and it's a nice gym.,,ChZDSUhNMG9nS0VJQ0FnSURma0liVFJnEAE
Anytime Fitness Orchard,Benjamin Kociok,5,Nice and clean gym where I did enjoy my full body workout✅,,ChZDSUhNMG9nS0VJQ0FnTURBNUotV2FBEAE
Anytime Fitness Orchard,Ian Tan,5,"One of the better AFs i’ve been to in SG. Really clean, proper and top equipment around!",,ChdDSUhNMG9nS0VJQ0FnSUNINVBxX3RnRRAB
Anytime Fitness Orchard,Rachel Anne Yam,5,It’s always a great experience here at AF Orchard!! Staff is also friendly and accommodating :),,ChZDSUhNMG9nS0VJQ0FnSURuOE9TZUV3EAE
Anytime Fitness Orchard,Clems G,3,Gym music is VERY loud - I can still hear their music when my earbuds are set to 70% loudness.,,ChdDSUhNMG9nS0VJQ0FnTURJMmNuNHN3RRAB
Anytime Fitness Orchard,Lil Pearl,5,"Nice place to workout. Clean bathrooms, decent music, they have a Dyson hair dryer  and a modern water faucet to refill your bottles easier.",,ChdDSUhNMG9nS0VJQ0FnSURPeGUzYnN3RRAB
Anytime Fitness Orchard,Joviseee Tan,5,Friendly staff and clean place.,,ChZDSUhNMG9nS0VJQ0FnTURRMjRLSUV3EAE
Anytime Fitness Orchard,Jon Lee,1,"Grimy equipment, always something broken. No A/C and zero ventilation in the mornings for over a week.",,ChdDSUhNMG9nS0VJQ0FnTUR3bnR6Z19RRRAB
Anytime Fitness Orchard,Kimberly Tan,5,"well-equipped, spacious and friendly staff :)",,ChZDSUhNMG9nS0VJQ0FnTURvNXFfdmRREAE
Anytime Fitness Orchard,Farah Hamdan,5,Amazing gym! Premium feel! I love the playlist! Friendly and welcoming staffs! Kudos to Farah and Anwar! Well done AF Orchard!,,ChZDSUhNMG9nS0VJQ0FnSURCcmV2Z0NBEAE
Anytime Fitness Orchard,AceJoker 15,5,Really love the vibes here. The staff here are really friendly and nice as well. Facilities here are well maintained and the wash up area is always clean 👌 …,,ChdDSUhNMG9nS0VJQ0FnSUNCNHRPYmtRRRAB
Anytime Fitness Orchard,buyan,5,"Love the place, great environment and clean equipments. The staffs there are friendly and very helpful as well, especially anwar.",,ChZDSUhNMG9nS0VJQ0FnSUNKMHMyOUVREAE
Anytime Fitness Orchard,J Yap,2,"Probably the smallest and most crowded anytime fitness gym I've ever seen, comparable to activesg gym. Could have written Orchard gateway on the address but no, it's only meant to confuse people.",,ChdDSUhNMG9nS0VJQ0FnSURKZ3JmZDhRRRAB
Anytime Fitness Orchard,James S,1,"Old, rusty equipment, half-hearted cleaning, waaay too small. Avoid this one.",,ChZDSUhNMG9nS0VJQ0FnTUNvN2Q2WEJnEAE
Anytime Fitness Orchard,Wilger Loo,5,Umar was very helpful and friendly. Great atmosphere and well maintained equipment.💯💯 …,,ChZDSUhNMG9nS0VJQ0FnSURIbzgtMVlnEAE
Anytime Fitness Orchard,Ashmitha,5,Love this outlet! Maya (the staff) was kind and helpful. definitely would come here again !😍 …,,ChdDSUhNMG9nS0VJQ0FnSURMelluaXNRRRAB
Anytime Fitness Orchard,Wee Chong Neo,5,Spacious and clean to do workout in. Come here often during lunch time to release stress and build muscles! 💪🏻 …,,ChZDSUhNMG9nS0VJQ0FnSUNYX3VTM0tnEAE
Anytime Fitness Orchard,Lawrence L,4,"Room for improvement.
It’s a hassle to access the gym after midnight, visited on 13 Mar, 12:50AM (Sunday). Perhaps the lift should stop at the 4th floor?

Orchard Gateway finds it logical to limit lift movement to 5th & 1st floor when they have a 4th floor gym in operation 24hrs. Basically if you park your vehicle on 5th floor, you take the lift down to 1st floor before climbing up the escalator to the 4th floor to access the gym. Same way down and lift back up to 5th floor carpark. Good luck if you have bad knees.",,ChdDSUhNMG9nS0VJQ0FnSURXeEt6TjlnRRAB
Anytime Fitness Orchard,shandi mak,5,"Staff Amanda & Farah is helpful and assisted me in every way, such as membership and gym equipment. They are always smiley,cheerful and energetic 😊 …",,ChZDSUhNMG9nS0VJQ0FnSUMtcEphN1h3EAE
Anytime Fitness Orchard,Nicole Low,5,"Great gym with good equipment located at a central location, friendly staff too!",,ChdDSUhNMG9nS0VJQ0FnSUR6cktUMDBnRRAB
Anytime Fitness Orchard,Cliff Pak,5,Great facility and environment to gym in!!👍🏼 …,,ChdDSUhNMG9nS0VJQ0FnTUNJdnJxWG13RRAB
Anytime Fitness Orchard,Benedict ong,5,Friendly and approachable staff at counter helping to ease the membership process.,,ChZDSUhNMG9nS0VJQ0FnTURnMGZmdU5BEAE
Anytime Fitness Orchard,Jing Han,5,"Excellent location, can do a quick workout post shopping, compact gym with everything I need",,ChZDSUhNMG9nS0VJQ0FnSURIdXRHeE1REAE
Anytime Fitness Orchard,Filza Alisha,5,"Gym is neat and tidy, management is friendly and helpful as well! I love coming here in the morning! Thank you Farah and Team!",,ChdDSUhNMG9nS0VJQ0FnSUR4eDV1RHRBRRAB
Anytime Fitness Orchard,Qashrina Hisham,5,This gym is such a great place to workout. Staffs are very friendly and nice!,,ChdDSUhNMG9nS0VJQ0FnSUNUcGNLdGlnRRAB
Anytime Fitness Orchard,Charmaine Wu,5,Machines are well spread out and placed in a good flow for people who tend to work out certain body parts in one session!,,ChdDSUhNMG9nS0VJQ0FnSUNQN092MXl3RRAB
Anytime Fitness Orchard,Lim Tom,1,orchard anytime fitness Once I forgot to take the key and asked the staff fat girl to help me open the door and go in. she said that I have to wait for the person in charge to come. I have been here for a few months. Poor service and racist I am willing to go to another branch,,ChZDSUhNMG9nS0VJQ0FnSUNlOWZLSWV3EAE
Anytime Fitness Orchard,Tim Lim,5,Visited this place after a year. The gym upkeep is still as lively and as well maintained since.,,ChZDSUhNMG9nS0VJQ0FnSURYbXBTeFp3EAE
Anytime Fitness Orchard,LaZZyBird Lim,5,Great gym great facilities,,Ci9DQUlRQUNvZENodHljRjlvT2t0WU1UVjZTV3QxVEZNelUxVjNTR0Z4YzBaWUxWRRAB
Anytime Fitness Orchard,Jeremy Seow,5,The staff at Anytime Fitness Orchard are very friendly and approachable. Well equipped amenities and relatively near to Somerset MRT. Definitely a go to gym to train!,,ChZDSUhNMG9nS0VJQ0FnSUMtNko2ZUtBEAE
Anytime Fitness Orchard,Linda Lee,5,More equipments than i try first at yew tee. But the aircon feels full blast. Is very cold.,,ChZDSUhNMG9nS0VJQ0FnSUNMMHF1YWJREAE
Anytime Fitness Orchard,Caleb Wan,5,Nice and cozy gym with good equipments. Staff Colin is very approachable and friendly during my visits 10/10.,,ChdDSUhNMG9nS0VJQ0FnSUMtNklyLXVBRRAB
Anytime Fitness Orchard,cal,5,"first time gymming here, isaiah provided answered all the doubts i had regarding the membership. amazing service.",,ChdDSUhNMG9nS0VJQ0FnSUREbDcyZXV3RRAB
Anytime Fitness Orchard,Mattias Chew Hui Jie,5,"Great atmosphere, staff are always smiling, approachable and friendly",,ChdDSUhNMG9nS0VJQ0FnSUNfbm95T29nRRAB
Anytime Fitness Orchard,Mishal Chian,5,"Love the cleanliness and tidiness of the gym, would be better if there’s more new abs building equipment.",,ChZDSUhNMG9nS0VJQ0FnSUNUX2JYRFZ3EAE
Anytime Fitness Orchard,aunie,5,"Super cold, super yummy, super great machines!😛😛😛😛 …",,ChZDSUhNMG9nS0VJQ0FnTUNva09xdEJnEAE
Anytime Fitness Orchard,John Matthew Buerano,5,Erol did an astounding job in helping to give us knowledge about different exercises and muscle group! Fantastic job!,,ChdDSUhNMG9nS0VJQ0FnSUNMLWZPcDdBRRAB
Anytime Fitness Orchard,Eugene Sadovski,5,24/7. Nice team. Highly recommend,,ChZDSUhNMG9nS0VJQ0FnSUNaMmJMLUNREAE
Anytime Fitness Orchard,Jeff Ng,5,Staff are really friendly and equipment is top tier. The place makes working out conducive and helps me be efficient.,,ChdDSUhNMG9nS0VJQ0FnSURodC1XRzhnRRAB
Anytime Fitness Orchard,kim xh,5,clean gym & friendly staff! convenient location as well.,,ChZDSUhNMG9nS0VJQ0FnSUN2MHM3WVdBEAE
Anytime Fitness Orchard,Albert Dolandz,5,"had a splendid time with good music + ac
place is clean too",,ChdDSUhNMG9nS0VJQ0FnSUQzclpfMTRnRRAB
Anytime Fitness Orchard,maomaoliang,5,"Kind and understanding staff, clean gym, good environment!",,ChZDSUhNMG9nS0VJQ0FnSUN2NTR6bEhnEAE
Anytime Fitness Orchard,Rev A7X,5,"Double thumbs up for pre-sales on the booth assisted by Verlin and Jacinta! Everything I enquired was promptly answered!
Excellent customer service and wonderful staffs!
Thank you once again! And can’t wait for gym to be open soon!",,ChdDSUhNMG9nS0VJQ0FnSUNtcjV5a3pBRRAB
Anytime Fitness Orchard,Haney Qistina,5,Staff has been very helpful and kind!! Well maintained equipment with great ambience to workout.,,ChZDSUhNMG9nS0VJQ0FnSUN4b2JmeU53EAE
Anytime Fitness Orchard,Michelle Hoang,5,"Friendly staff, Anwar especially! Clear explanation and always a smile on his face!",,ChdDSUhNMG9nS0VJQ0FnSURQZ3VueHBBRRAB
Anytime Fitness Orchard,Ting En Neo,5,"Farah has been very helpful, all the staff here are extremely welcoming and friendly! Its always a pleasant experience gymming AF Orchard :-)",,ChdDSUhNMG9nS0VJQ0FnSUMtbU9yWjV3RRAB
Anytime Fitness Orchard,Yihlam Wen,5,"Probably one of the best gym in town, can find most of the machines here. Provide enough training space as well as amazing town view.",,ChdDSUhNMG9nS0VJQ0FnSUMyME1TM2p3RRAB
Anytime Fitness Orchard,Eugene Ng,5,gym is clean & staff are extremely friendly. Farrah is friendly & welcoming. drop by and experience it on your own!!,,ChdDSUhNMG9nS0VJQ0FnSURXajdEMzJnRRAB
Anytime Fitness Orchard,Ninthsine,5,Clean and conveniently located. Gym also offers more premium equipments as compared to other AF such as IPF Eleiko barbells,,ChZDSUhNMG9nS0VJQ0FnSUN4cmJEYmNnEAE
Anytime Fitness Orchard,Han Wilson,5,"Its a cosy place to workout. Equipment is well maintained and spacious. Staff in duty (Farah, Siti, Eason) was helpful and engaging. Definitely worth a second visit.",,ChdDSUhNMG9nS0VJQ0FnSURXX05Db25RRRAB
Anytime Fitness Orchard,aloy aloy (Alloy),5,"Always welcomed by their lovely staff, especially Farah and Amanda! Keep up the good work! Cant wait to be back",,ChdDSUhNMG9nS0VJQ0FnSUMtNlBlZnBnRRAB
Anytime Fitness Orchard,syamil safari,5,Love the layout of the gym and the staff here are very welcoming and helpful. Would totally recommend more people to visit this outlet if they are nearby.,,ChZDSUhNMG9nS0VJQ0FnSUNPaGRMWWZnEAE
Anytime Fitness Orchard,Aaron Ng,5,"Amazing facilities, friendly staff, highly recommended!!!",,ChdDSUhNMG9nS0VJQ0FnTURnMGZmazlnRRAB
Anytime Fitness Orchard,Hyeji Yoon,5,The staff named Kate was so kind and guided me so that I could understand her even though i am a foreigner🫶🏻😊 …,,ChdDSUhNMG9nS0VJQ0FnSUQ5bGV1YnRBRRAB
Anytime Fitness Orchard,Young White,5,This is my go to gym. The staff are friendly and the convenient location which makes getting to and from easy.,,ChZDSUhNMG9nS0VJQ0FnSURqalpTYUZREAE
Anytime Fitness Orchard,doughboy,5,"lovee this gym for the warm welcomes and the equipments provided, will recommend this gym to my friendss",,ChZDSUhNMG9nS0VJQ0FnSUNUeUwyYWVBEAE
Anytime Fitness Orchard,Alex Pang,3,"The gym is cosy well equipped but the gym member is very intimidating during Sunday night, I will only go to gym when I'm around the neighbourhood, I would not to the gym after my work as it's troublesome for me to go home after workout.",,ChdDSUhNMG9nS0VJQ0FnSURXOExfTnd3RRAB
Anytime Fitness Orchard,YG Choi,5,"Hey fix the door lock for the changing room it's been weeks
Also bring the wipe back plz",,ChdDSUhNMG9nS0VJQ0FnSUN2dGRUUzVRRRAB
Anytime Fitness Orchard,Alice Zation,5,If u love the cold this is the place to be. Aircon blasting like winter is coming❄️,,ChZDSUhNMG9nS0VJQ0FnSUNQcXRlWFdnEAE
Anytime Fitness Orchard,Mark Koh,5,"My favorite gym across SG - compact, well equipped but most importantly, great vibes!",,ChZDSUhNMG9nS0VJQ0FnSUNKNmZpeUR3EAE
Anytime Fitness Orchard,S.P,5,First time sign up!! Staffs are friendly and explained everything in details! Environment is clean!,,ChZDSUhNMG9nS0VJQ0FnSURqMFB6RWZBEAE
Anytime Fitness Orchard,Jeffrey Tay,5,"Great location, ample equipment, clean and well maintained, and most of all — the most affable staff! Can’t ask for more!",,ChZDSUhNMG9nS0VJQ0FnSUNKNnJmZWFnEAE
Anytime Fitness Orchard,Shawn,5,"Awesome vibe here, very chill and equipments are decent! 💪🏻 …",,ChZDSUhNMG9nS0VJQ0FnSURYcnRHOWRnEAE
Anytime Fitness Orchard,Randall,5,Best gym,,Ci9DQUlRQUNvZENodHljRjlvT20xVFlXNWhTRkpHVm5BNWJ6SnRPR3hLVDFCT1luYxAB
Anytime Fitness Orchard,Leonard Wong,5,"Convenient, near my work place, gets the work done, fast sign up, no hassle",,ChZDSUhNMG9nS0VJQ0FnSURQc2JDWkZ3EAE
Anytime Fitness Orchard,badminton,5,best outlet with outstanding staff,,ChdDSUhNMG9nS0VNX3Y0NkM0bW9XaTFnRRAB
Anytime Fitness Orchard,Koh Jin Haw,5,Amazing gym with great staff and atmosphere 10/10 would recommend!,,ChZDSUhNMG9nS0VJQ0FnSUNUdnBXcU1BEAE
Anytime Fitness Orchard,Jasper Law,5,Nice gym,,ChdDSUhNMG9nS0VJYTV2THZDei0tZjJRRRAB
Anytime Fitness Orchard,Eddy Suhardi,5,"This gym has all you need! Very vibes, very amazing staff especially Anwar!",,ChZDSUhNMG9nS0VJQ0FnSURUMGNmd1lBEAE
Anytime Fitness Orchard,Rafee,5,"Great equipment, great location very convienient to me",,ChdDSUhNMG9nS0VJQ0FnSUNQN01PRTFRRRAB
Anytime Fitness Orchard,Orik Blaku,5,Membership staff is very kind & gym is well equipped,,ChdDSUhNMG9nS0VJQ0FnSURYLTdXaHlnRRAB
Anytime Fitness Orchard,amir,5,Very good staff named Zahin erol anwar & umar i love the gym,,ChdDSUhNMG9nS0VJQ0FnSURMcG82c29RRRAB
Anytime Fitness Orchard,sofiya,5,this is the best gym ever! i love it so much i will not go to other gyms ever again.,,ChdDSUhNMG9nS0VJQ0FnSUNKcFAteHFRRRAB
Anytime Fitness Orchard,Mel Wong,5,Sign up process was seamless! Anwar was super helpful.,,ChZDSUhNMG9nS0VJQ0FnSUNQb1pDalVREAE
Anytime Fitness Orchard,Andiani Sufi,5,"amazing gym equipments, friendly staffs & convenient location as there’s nearby MRT station (Somerset)",,ChZDSUhNMG9nS0VJQ0FnSUNOZzcyU2NBEAE
Anytime Fitness Orchard,presad Rajandran,5,Love this outlet. Very clean and nice facilities. The doorman Kimmy is a very friendly and helpful chap.,,ChdDSUhNMG9nS0VJQ0FnSUR4ejZ6TG1RRRAB
Anytime Fitness Orchard,Natalie Koh,5,has a good ambience and is a very convenient branch around town :),,ChdDSUhNMG9nS0VJQ0FnSUNuMHB6YXFRRRAB
Anytime Fitness Orchard,Grey Blanket,5,Well maintained and great utilisation of space.,,ChZDSUhNMG9nS0VJQ0FnTUR3dm91TEdnEAE
Anytime Fitness Orchard,Weixuan Tay,5,There are many equipments in AFO 👍🏻👍🏻 Gym is very clean too! …,,ChZDSUhNMG9nS0VJQ0FnSUNIOWUzVEFnEAE
Anytime Fitness Orchard,Lester Teo,5,My favourite AF outlet among all the AF outlets I have been to. Dyson hairdryer for the win!,,ChdDSUhNMG9nS0VJQ0FnSURSOG91MTBRRRAB
Anytime Fitness Orchard,Aiman Amino,4,Overall pretty solid gym for town area with good amenities. Would recommend,,ChZDSUhNMG9nS0VJQ0FnSUN4b2FlYUpREAE
Anytime Fitness Orchard,Vishnu malarvannan,5,"Great place with awesome staff. However, would be better if the place was a little bigger. But overall a great experience for start ups!",,ChdDSUhNMG9nS0VJQ0FnSUNPbzhEbW9RRRAB
Anytime Fitness Orchard,Toasty Crunchz,5,"had a amazing workout session here, clean equipments, utilities.",,ChdDSUhNMG9nS0VJQ0FnSUNuNHNyRmdnRRAB
Anytime Fitness Orchard,dawn koh,5,This gym is a hidden gem! Equipments are clean and super friendly staff!!!,,ChdDSUhNMG9nS0VJQ0FnSUNONl9ucHpRRRAB
Anytime Fitness Orchard,Shaun tan,5,"Worth the travel from the east side! Friendly, welcoming staff & great vibes. Will definitely come here often now!!!",,ChZDSUhNMG9nS0VJQ0FnSUNXX2IyaEhBEAE
Anytime Fitness Orchard,Dave Low,4,Super good . Equipment are all news.  But shower area abit small though. Overall 4.5,,ChZDSUhNMG9nS0VJQ0FnSUQtcVl1N0hREAE
Anytime Fitness Orchard,Gallant Tang,5,"Good equipment, short wait time, lots of cleaning stuff available.",,ChZDSUhNMG9nS0VJQ0FnSUN6X1lyTWRnEAE
Anytime Fitness Orchard,DW Tan,5,"Cleanest AF in Singapore.
Small but got everything, including friendly and helpful staffs! Awesome AF",,ChdDSUhNMG9nS0VJQ0FnSUMtOUo3Rm5nRRAB
Anytime Fitness Orchard,Tanya Tan,5,Superb location in the heart of town with clean & new facilities :),,ChZDSUhNMG9nS0VJQ0FnSUNYb2ZxQ2RnEAE
Anytime Fitness Orchard,Pink Josh,1,i was fined $30 for something i didn’t do. Just don’t come here if they can’t find the real criminal  they will target the person next to them . Solid the only time i hates anytime fitness,,ChdDSUhNMG9nS0VJQ0FnSUNCb0xhZ193RRAB
Anytime Fitness Orchard,Danish Hilmann,5,"Friendly and quick with all the processes, clean and a nice view to boot when working out",,ChdDSUhNMG9nS0VJQ0FnSUNMcEpydml3RRAB
Anytime Fitness Orchard,Mich,5,Friendly and approachable staffs :) well equipped with good location and can get pre and post workout food anytime HAHA,,ChdDSUhNMG9nS0VJQ0FnSUNPNFpXQ3lRRRAB
Anytime Fitness Orchard,Exel Tan,5,"Nirel Very Good, Aisha very Good oso, Rafael the best. Farah also very good. The vibes very good. I only come here cause the people very nice.",,ChdDSUhNMG9nS0VJQ0FnSUNPc3RlZ3Z3RRAB
Anytime Fitness Orchard,Kimmy Lin,5,Great gym for its size. Has equipments suitable for training any muscle group you wish to,,ChdDSUhNMG9nS0VJQ0FnSUN4cmVEVjZ3RRAB
