outlet,author,rating,text,date_posted,review_id
Anytime Fitness Orchard,M N hakim,5,I am very pleased with the staff in the afternoon shift today. They willing to help me transfer the dumbells from reformed Personal training Area to the public gym willingly and helpfully,,ChdDSUhNMG9nS0VJQ0FnSURYMGNxb3BnRRAB
Anytime Fitness Orchard,Luane chia,5,"Friendly staff and a great place to workout! 💯

Would recommend their weekly functional class, special mention to Colin. Who is constantly checking out on us during and after the sessions, ensuring that we are doing the workout with proper posture. He changes the routine weekly based on the feedback he received from the class the week before! 🙌🙌",,ChZDSUhNMG9nS0VJQ0FnSUNCNHN2aEJ3EAE
Anytime Fitness Orchard,Tim Koh,5,Fantastic service by Anwar. Friendly chap. No fuss. Would 100% recommend. Hit him up if you’re looking for a gym!,,ChZDSUhNMG9nS0VJQ0FnSURQaEo3ekNnEAE
Anytime Fitness Orchard,Muhammad Nabil,5,Had an amazing experience at AFO !!! The staffs are very friendly & easy going. Huge compliments for Andiani & Anwar for assisting me when I do not know how to operate the machines !! One of the best Anytime Fitness branch in Singapore  <3,,ChZDSUhNMG9nS0VJQ0FnSUNOZzlYamJREAE
Anytime Fitness Orchard,Ashbae,5,Awesome cozy gym with good lighting and unique equipment! 👍🏻 …,,ChdDSUhNMG9nS0VJQ0FnTURvNXFmZTlnRRAB
Anytime Fitness Orchard,Ken,5,"Walked in to do a free trial today to find a suitable gym near my home and I have to say, it's one of the better equipped, cleaner and professional gym in town. Staff were also professional in explaining the various rates, gym rules, terms and conditions clearly and making sure I understood every term before I paid for the membership.",,ChZDSUhNMG9nS0VJQ0FnSUN4cmNqY1FREAE
Anytime Fitness Orchard,nadhirah yasmin,5,the staff there named maya is so helpful and kind. She is very interactive and answered all my enquirers! made my time at AF orchard a better time,,ChdDSUhNMG9nS0VJQ0FnSURMemZxNG93RRAB
Anytime Fitness Orchard,Heidi Yu,1,"Super crowded and you could easily hit or touch the gym-goer next to you while doing your gym moves. The place is way too small for a popular/central location like Orchard. It should be called Anytime Crowded. If you join be prepared to be able to use the gym during limited hours, maybe in the early mornings or during office hours. But the gym was crowded even at 5pm and fellow locals should still be at work (yet they said it’s crowded because it’s after office hours).

Sales’ services and attitude aren’t great and they tried to disclaim their responsibility for gym experience. They wouldn’t “give a nice experience” but they offered “a suggestion to help you have a more comfortable experience”. Please own the quality of your service rather than relying on your customer to find a nice experience.",,ChdDSUhNMG9nS0VJQ0FnSURKajRpZzdBRRAB
Anytime Fitness Orchard,AL SL,1,"The payment receiver they use suck, no reminder, unnecessary late payment fee, worst communication from anytimeftness staff , no inform for late payment fee when I asked them about 2nd charge
Poor communication for membership cancelation procedure too about the payment date",,ChdDSUhNMG9nS0VJQ0FnSUNYdnNYWXBBRRAB
Anytime Fitness Orchard,Novan Tan,5,"The staff members here are the best in SG. Hands down. Super duper friendly & approachable. Very clean machines & working in great condition.

To add, Anwar & Colin helped me to buy a new underwear after I hit a PR on deadlift. They deserve employees of the year award",,ChZDSUhNMG9nS0VJQ0FnSUNKa1ozcEh3EAE
Anytime Fitness Orchard,Sandra Tov,5,"Amazing team! Super helpful location staff always smiling , always helpful! Very professional 👌 I enjoy always coming to this location! Well maintained …",,ChZDSUhNMG9nS0VJQ0FnSURYeUlYRE93EAE
Anytime Fitness Orchard,Sreypor Chan,3,"The gym is good and the staff are friendly except for the cleaning lady. She always clean where people are using. One time she just dragged the vacuum on my phone and my water bottle, muffle in Chinese loudly that I can’t understand too. Please take care of this",,ChZDSUhNMG9nS0VJQ0FnSUNoby1yR2ZnEAE
Anytime Fitness Orchard,Jerry Ong,5,Another fantastic branch by REFORMD.,,ChdDSUhNMG9nS0VJQ0FnSURUdGNLQzl3RRAB
Anytime Fitness Orchard,James Low,5,Well located gym at the heart of orchard. Ample of equipments to use. Washrooms are well maintained as well. Had a chance today to workout in this gym but had a small mishap. Suffered quite a deep cut due to my carelessness but was attended quickly by the staff named Rafael. Kudos to him for helping me to get the first aid kit and bandaged for me! Definitely recommended if anyone is looking to sign a gym membership!,,ChdDSUhNMG9nS0VJQ0FnSUR1by1DaHdRRRAB
Anytime Fitness Orchard,Siti Salihah,5,"Great free trial experience, staff are friendly.",,ChZDSUhNMG9nS0VLU00wcmlGd0wyek5nEAE
Anytime Fitness Orchard,Aidan Bong,5,"moving from a conventional tiny condo gym, i definitely feel like i made the right choice. walking in here never felt intimidating or overwhelming. everyone was friendly and respectful and i always leave with a smile on my face. don’t hesitate to reach out to their staff or ask about different plans as well, they’ve definitely shared plenty of information for me to make the right choice. come say hi :)",,ChZDSUhNMG9nS0VJQ0FnSUNCNHVXZFBBEAE
Anytime Fitness Orchard,saafi malek,5,Anwar and Syakir have exceptional customer service. The facilities there are also well put and maintained! most definitely recommend people to come here!,,ChZDSUhNMG9nS0VJQ0FnSUNYNTZpYlhnEAE
Anytime Fitness Orchard,Romeo Kong,5,"A variety of gym equipments!, the place is well maintained and staffs are friendly. shoutout to Anwar for helping me with my purchase of a protein shake from the vending machine! would recommend coming here if youre in town (:",,ChdDSUhNMG9nS0VJQ0FnSUNOZzZtazVRRRAB
Anytime Fitness Orchard,bella bella,5,There were plenty of machines and staff were really friendly! Highly recommended!,,ChdDSUhNMG9nS0VJQ0FnTUNJaHVpTzVnRRAB
Anytime Fitness Orchard,Sanjay S nair,5,Recently went to this outlet and felt very satisfied. The equipment was of good quality and condition. I had an amazing time working out with my friends,,ChZDSUhNMG9nS0VJQ0FnSUNqNDRmYlhREAE
Anytime Fitness Orchard,Taufiq Ismail,5,When I came to gym Staff  Anwar was super nice to me as he introduced me to the gym as I am not familiar with the gym! Keep up the work!:),,ChdDSUhNMG9nS0VJQ0FnSURYaTdfcGx3RRAB
Anytime Fitness Orchard,Moses,5,Shoutout to Wilger and Bern for taking the time to show us around the gym! Really appreciate the effort—y’all made it a great experience.,,ChZDSUhNMG9nS0VJQ0FnTURBNTgyQkpREAE
Anytime Fitness Orchard,Chloe,5,"really love the vibes and atmosphere of this gym, the equipment is top notch and the place smells and looks great. I'll definitely be coming by often!!!! highly recommend checking this branch out :)",,ChZDSUhNMG9nS0VJQ0FnSURodDVxQk9REAE
Anytime Fitness Orchard,Yassy Chan,4,"Love the convenience of this place. A 24 hour gym in town makes it a favorite spot. If you go late at night, though, you need to know how to get to the gym, which is in the 4th floor. A lot of the usual passageways may be closed.

The only thing I would say is that sometimes the gym equipment and cleaning supplies aren't as well maintained. There was once the leg press was out for a week. The cleaning cloths and sprays sometimes don't work (wear and tear) and given it's 24-hour but the staff won't always be there, the weights and machine attachments can sometimes be just jumbled up.

All in all, the gym is still worth it if you like the flexibility to be able to workout any time in the heart of the city.",,ChdDSUhNMG9nS0VJQ0FnSURoeTVhcjFBRRAB
Anytime Fitness Orchard,Kana Jimbo,5,First time going to the gym! such a good experience. The staffs are friendly and helpful 😆 would definitely recommend AF Orchard! …,,ChZDSUhNMG9nS0VJQ0FnSUNYcWJPM0dBEAE
Anytime Fitness Orchard,ayra lee,5,the club has really good equipment and overall nice vibe. staff are friendly too :),,ChZDSUhNMG9nS0VJQ0FnTURROHVLc1lREAE
Anytime Fitness Orchard,kristin goh,5,Gym is kept clean and tidy! Love the friendly staffs here as they were really prompt with their responses. Would highly recommended AF Orchard!,,ChdDSUhNMG9nS0VJQ0FnSURqdXE3ZmdnRRAB
Anytime Fitness Orchard,Sayuri,5,"I'm so grateful that I had Abbas as my personal trainer. I successfully improved my posture and equipped lifelong knowledge about training through 15 sessions with him.

He corrected my movement precisely, and I was amazed at the slight adjustment made to the effectiveness of the training.
I want to recommend him to beginners like me.",,ChZDSUhNMG9nS0VJQ0FnSURPejgySExnEAE
Anytime Fitness Orchard,Jake Pang,5,"One of the best gyms around and especially in town! What’s more it is open 24 hrs!

Best staff award goes to Anwar for the service and assistance rendered throughout.",,ChdDSUhNMG9nS0VJQ0FnSURqamNybDhBRRAB
Anytime Fitness Orchard,xuan,5,"The location of the gym is really accessible and convenient! Felt really comfortable working out as the gym is very spacious with well-equipped facilities and amenities. Not to forget, they have super friendly and encouraging staffs too! Shoutout to QJ and Anwar for making my experience even better :) Highly recommend others to visit.",,ChdDSUhNMG9nS0VJQ0FnSUNKbU1fLTlBRRAB
Anytime Fitness Orchard,Iris Chang,5,"Good enough selection of machines and weights, clean and don’t smell. For lift access, use the one next to Coffeesmith (not the one behind Henri Carpentier)",,ChdDSUhNMG9nS0VJQ0FnSUM3NnRlSGlnRRAB
Anytime Fitness Orchard,XY. L.,3,"Pros: Relatively snazzy, good location, clean and new equipment.
Cons: Literally so crowded and cramped it's impossible to workout between 6-9pm unless you want to be interrupted by people working out only one feet away from you, aggressively share equipment and still get heckled by other impatient gym-goers.
I went in and was out in 30 mins without completing my workout and would never return again LOL. Other outlets are honestly just less crowded and cramped. This is just my personal experience.",,ChZDSUhNMG9nS0VJQ0FnSURoNnRUTUR3EAE
Anytime Fitness Orchard,Jayden,5,The gym is really big and also the staff here is very nice !,,ChdDSUhNMG9nS0VJQ0FnTURRcTktOGxBRRAB
Anytime Fitness Orchard,Rusydinah,5,"oh ya the staff here are super friendly and helpful as wel! From the moment I signed up, they made the process smooth.",,ChdDSUhNMG9nS0VJQ0FnTUNnaHZLZHdBRRAB
Anytime Fitness Orchard,Meena O'Mahony,5,"Great location, amazing set up but a bit too cold to my liking.",,ChdDSUhNMG9nS0VJQ0FnTUNnaVp1M29RRRAB
Anytime Fitness Orchard,christina,5,i love this place advanced n better machines than my home gym! great aircorn and amenities,,ChdDSUhNMG9nS0VJQ0FnSUNQblA2VmlBRRAB
Anytime Fitness Orchard,Luthfi Bin ismail,5,Love the environment in AF Orchard. Farrah and Anwar are very friendly and professional. The music gym vibe is awesome and the ambience is fit for a good workout. Keep up the great work AF Orchard!! 💪💪💪 …,,ChZDSUhNMG9nS0VJQ0FnSURCbTRpMVFBEAE
Anytime Fitness Orchard,Adam Malik,5,"Clean gym, friendly staff , great equipment",,ChdDSUhNMG9nS0VJQ0FnTUNZcExmU3B3RRAB
Anytime Fitness Orchard,Mohamad Aisy,5,The place is clean and hygienic plus it's fairly spacious. The staff there was also very helpful and friendly; I remembered one of them named Erol gave me some advice on the exercise I was doing.,,ChZDSUhNMG9nS0VJQ0FnSUREM2VtVWJREAE
Anytime Fitness Orchard,Joshua Chew,5,"I had the best gym experience of my life thanks to zahin and anwar, ive never had an experience better any where in the world and ive been all around the world #mrworldwide",,ChdDSUhNMG9nS0VJQ0FnSURQdGJURXF3RRAB
Anytime Fitness Orchard,Johnson Tay Wei Fan,5,Wonderful equipments and great atmosphere for working out. Pleasant crowd and not much pressure when need to share space or items.,,ChdDSUhNMG9nS0VJQ0FnSUNqbGYzZnRRRRAB
Anytime Fitness Orchard,alf Md hafidz Zainal Abidin,3,"I drop by the gym yesterday 1st Mar 2022 on their first day of operating. I like the place but one thing I don't like is that they don't have a changing room or toilet. What they have is a shower room. So how can I change my cloth in the wet area? I think they should think about ppl who from work who came down with the office attire. The staff should be more proactive, they can suggest changing my cloth at the mall toilet.",,ChZDSUhNMG9nS0VJQ0FnSUNXNmZxVFhREAE
Anytime Fitness Orchard,Jonas L,5,"This place is near my workplace
Will come every time",,ChZDSUhNMG9nS0VJQ0FnTURRMjRMNGVBEAE
Anytime Fitness Orchard,Jeanjean Jeanjean,1,Please turn on the airco in the morning before someone dies😄 …,,Ci9DQUlRQUNvZENodHljRjlvT2xjMUxXTnJTemx2YlVoSGFtMTVTbFEwZUhkeFNIYxAB
Anytime Fitness Orchard,keane tan,5,"Great outlet, very cosy, good ambience. Super friendly staff as well. Showering facilities are top-notch, imo opinion, fancy feel, cleanliness up to standard fr real. Can get crowded during crowded hours though. but nice equipment.",,ChZDSUhNMG9nS0VJQ0FnSUMyd19XbUpnEAE
Anytime Fitness Orchard,Aisyah Ariffin,5,"Very different from other clubs, cool lighting at free weights area! Need more lockers. I was able to work out during peak period due to the 60 mins ruling. Thank you TEAM ORCHARD you did well 👍🏻 …",,ChdDSUhNMG9nS0VJQ0FnSUNXNC1teXFBRRAB
Anytime Fitness Orchard,MIZY,5,"Thanks to instructor Colin, who teaches functional exercise classes every week, I am having a lot of fun .And I also like the facilities of this gym.  There are many kinds of machines, and always kept clean.",,ChdDSUhNMG9nS0VJQ0FnSUNCa3NpcDJ3RRAB
Anytime Fitness Orchard,s0m80dykillu,5,It has a wide variety of equipment which makes it very flexible even at peak hours,,ChdDSUhNMG9nS0VJQ0FnTUNJdnB6bnNnRRAB
Anytime Fitness Orchard,Najat Alhabshi,5,"Been working with PT Herzy for the past couple months. I’ve got a muscular dystrophy on my arm and with his background in physiotherapy, he’s quickly helped me exercise motion and strength. He’s attentive, got an amazing personality and just the right amount of motivation that makes for an overall holistic and fun experience every session. Couldn’t be more pleased with him as a trainer :)",,ChZDSUhNMG9nS0VJQ0FnSUNlb05MbUZREAE
Anytime Fitness Orchard,kai wei,5,"The stuff Bernadette, Anear is having a good servicing and Thé professional experience also can let me getting good feel.",,ChZDSUhNMG9nS0VJQ0FnSURmZ05lN09REAE
Anytime Fitness Orchard,Edward Kendall,5,"Anwar is a legend, really friendly, super helpful and knowledgeable.

Great gym and great staff.

Thanks!",,ChdDSUhNMG9nS0VJQ0FnSUQzeEoyNmlRRRAB
Anytime Fitness Orchard,Joshua Lim,5,"Good gym with everything you'd need, staff member Zahin was super helpful, but a bit crowded in the evenings",,ChZDSUhNMG9nS0VJQ0FnSUN2aG9UZ0N3EAE
Anytime Fitness Orchard,KS Chen,1,Environment become dirty and few machine faulty. So disappointed,,ChZDSUhNMG9nS0VMRFZrX1gxdnAtU2R3EAE
Anytime Fitness Orchard,abigail belisario,5,"Nice ambience, quite a poppin gym I must say. Good variety of equipments and a nice view of Emerald hill as well. Staff are amicable and helpful!",,ChZDSUhNMG9nS0VJQ0FnSURELUtqYkF3EAE
Anytime Fitness Orchard,Tan Yi Hng,5,Nice location and well maintained! Great lighting and friendly staff as well.,,ChZDSUhNMG9nS0VJQ0FnTURnejRTRFBREAE
Anytime Fitness Orchard,Edward Chan,5,"I like this branch of AF for its convenient location, the variety of machines (positioned a bit too close, though) and the very friendly staff.",,ChZDSUhNMG9nS0VJQ0FnSUNYM3MzckRREAE
Anytime Fitness Orchard,gina lim,5,"The functional workouts are fun! Instructor Colin who give hands on instant feedback and guide us during the workouts with right amount of encouragement, make us feel really comfortable !Amazing gym!",,ChdDSUhNMG9nS0VJQ0FnSUNCNHZ2T2dRRRAB
Anytime Fitness Orchard,Tuff Monkey,5,Nice gym and cozy for a morning routine. Staffs are always smiley and welcoming even in the early morning hours. Rafael’s helping hand was speedy in assisting my queries. Appreciate his assistance !,,ChdDSUhNMG9nS0VJQ0FnSUNlcy1ySm1RRRAB
Anytime Fitness Orchard,Sai Varshini,5,"Kate is amazing, she’s so friendly and has the best attitude! Place is also well maintained, vending machine is in perfect working condition.",,ChdDSUhNMG9nS0VJQ0FnSUNOZzVXXzJRRRAB
Anytime Fitness Orchard,yg,5,"Bars were good, friendly staff there and good bars, it is clean and fresh",,ChZDSUhNMG9nS0VJQ0FnTUNJdnRUU1JBEAE
Anytime Fitness Orchard,John Zero,5,"Fantastic atmosphere, good equipment and most importantly friendly staff! Thank you and keep it up!",,ChZDSUhNMG9nS0VJQ0FnSURYeW9XcElBEAE
Anytime Fitness Orchard,Woshi Rajan,5,"Maya has been a great (pretty) staff at AFO. Thanks to her, I got all of my enquires settled and really well explained!",,ChdDSUhNMG9nS0VJQ0FnSURMemE2LTRnRRAB
Anytime Fitness Orchard,farhan taib,5,The staff here are friendly and the gym vibes are great! Will definitely recommend others to come this gym,,ChZDSUhNMG9nS0VJQ0FnSUNQX0lISmFREAE
Anytime Fitness Orchard,Carlos Garcia,5,Went in afternoon to check out facilities. Many people there but machines/weights have availabiliry. Erol and yuda were the two who walked me thru the process and they were friendly + helpful. Took under 15 mins to get everything up and running for a work out.,,ChZDSUhNMG9nS0VJQ0FnSUNqMDZ2a2NBEAE
Anytime Fitness Orchard,Chermaine Ho,5,The equipments are good and new! Staff are helpful and friendly too!,,ChZDSUhNMG9nS0VJQ0FnTUR3N0l2bkx3EAE
Anytime Fitness Orchard,Sheryl Gabby,5,Great place. Well maintained and clean facilities,,ChdDSUhNMG9nS0VJQ0FnTURvNXN2N21nRRAB
Anytime Fitness Orchard,Dominic Tan,5,"Been coming here for the last 4 years, service is great and it’s always clean and the equipment is well maintained",,ChdDSUhNMG9nS0VJQ0FnSUNYM3I2ajB3RRAB
Anytime Fitness Orchard,Brendan Zachary,5,clean and well maintained equipment and friendly staff. you can find staff here until a much later time compared to other AFs. can get abit crowded during peak hours but otherwise its great,,ChdDSUhNMG9nS0VJQ0FnSUNONl8tbjhBRRAB
Anytime Fitness Orchard,Aleem,5,"Friendly staff, alot of good equipments",,ChZDSUhNMG9nS0VJQ0FnTUNZcExlekpREAE
Anytime Fitness Orchard,Hykiel Abdullah,5,"Farrah, Amanda and Midzi was very friendly and attentive. I had issues with one of the machines and they attended to it in a very professional manner. Thanks!
Just wish the gym is bigger!",,ChZDSUhNMG9nS0VJQ0FnSUMtbUxiYVV3EAE
Anytime Fitness Orchard,muhd khidir,5,"Equipped with great facilities, huge space with platforms, amazing community. Not to mention, great staffs too!",,ChZDSUhNMG9nS0VJQ0FnTUNRMjZhWVhnEAE
Anytime Fitness Orchard,Daniel Ng,4,"I like this gym prime location,good equipment,very well gym atmosphere by playing all the hits songs drive our energy while training, however the air conditioner is too cold, after feedback still the same, especially during night when is too strong for the air-con make you feels too comfy and sleepy , and doest not sweat a lots because the air cool down so much , hope they can check with management by adjust the air con temperature would be great.",,ChdDSUhNMG9nS0VJQ0FnSUMtc056OWtnRRAB
Anytime Fitness Orchard,Jenn Lo,1,"Gym is nicely decorated but staffs are overly friendly and pushy for sales. They just want to get their commission. Not all classes are free. Can you believe that you pay gym and you have to pay extra for some classes they offer…

Can I highlight that they actually incentivise members if they write google review! So imagine how many reviews are really authentic???

Take a look at Google's policies, content that has been incentivised by a business in exchange for discounts, free goods, and/or services is prohibited.",,ChdDSUhNMG9nS0VJQ0FnSUMyMjUzVzVBRRAB
Anytime Fitness Orchard,Muhammad Anafiya,5,"Friendly staff, good vibes and the gym has almost everything you need for a workout. Located in a prime location, easy to find. Would visit this outlet again if the opportunity arises!",,ChZDSUhNMG9nS0VJQ0FnSUN4N2VpMVhBEAE
Anytime Fitness Orchard,Kevin Haldeman,2,"-This particular outlet is extremely crowded except between midnight and 5am.
-A lot of members sitting on machines playing on phones in between sets, further limits availability of equipment
-Advertised benefit that you can use all Anytime Fitness centers across the globe is not as straightforward as it sounds",,ChdDSUhNMG9nS0VJQ0FnSUNlamZiU3hRRRAB
Anytime Fitness Orchard,rhnsmsi,4,"I love the ambiance and environment of the gym. Lots of equipments, the space is sufficient. It looks big because of the mirrors, either way overall the gym looks nice. Staffs are friendly.",,ChdDSUhNMG9nS0VJQ0FnSUNPaGJLS3FnRRAB
Anytime Fitness Orchard,Ethan,5,The staff were friendly and kind. They gave us a tour of the gym and gave details about membership,,ChZDSUhNMG9nS0VJQ0FnTURnczZUc0NnEAE
Anytime Fitness Orchard,Kiyo Ong,5,both Anwar and Khals were very professional and patient in helping me to do my AF onboarding . Kudos !!!,,ChdDSUhNMG9nS0VJQ0FnSUNQdVlHaC1BRRAB
Anytime Fitness Orchard,basilia pang,5,Lovely ambience and very good equipment! Was greeted with very cheerful staff during each of my visits - a very homely gym! Staffs were also very helpful :),,ChZDSUhNMG9nS0VJQ0FnSURodDdidlZ3EAE
Anytime Fitness Orchard,jxxy neo,5,amazing gym! top tier equipment with polite and genuine staff named maya. answered my enquiries with passion and honesty!,,ChZDSUhNMG9nS0VJQ0FnSURMemRhZEJnEAE
Anytime Fitness Orchard,Tabbitha,5,Awesome vibes and plenty of equipments to target all body parts!! Shoutout to the front desk team for always being welcoming 🤓 …,,ChdDSUhNMG9nS0VJQ0FnSUNYcVpQM2hRRRAB
Anytime Fitness Orchard,daniel,5,"Anytime Fitness Orchard hits different with the music and ambience to life! Very welcoming staff especially Anwar and Farrah! Super convenient as it is located in the central so visit when you’re nearby!
💪🔥 …",,ChdDSUhNMG9nS0VJQ0FnSURCbmF6aWx3RRAB
Anytime Fitness Orchard,Daniel Chong,5,Came here for a trial and was very impressed! Gym was big and clean :) Thank you to Jadel for the hospitality!,,ChdDSUhNMG9nS0VJQ0FnSURYdVpYLXFnRRAB
Anytime Fitness Orchard,Chan,3,"You get all the essential equipment like power rack and weight machine. Tight space, and it's really crowded. Can't really walk through without having to squeeze through others when they are working out.

Borderline dangerous, if they are not watching out on who's walking by. 3 small shower cubicle and it's unisex co-share, quite openly with a small little bench for changing shoes. Can't say much about privacy.

A little too much treadmill, will be good to remove some and just provide more walking space instead",,ChZDSUhNMG9nS0VJQ0FnSUNXX2N2R0tREAE
Anytime Fitness Orchard,shilpa shastry,4,"Finding this place was a thrilling moment for me since this was exactly what I was looking for. A 24 hour full fledged gym which is spacious and right in the middle of orchard. A great place to workout which is also very well maintained.

I was also lucky to find a great personal trainer in Herzy. A personal trainer is not only the one who guides and motivates you to give your best during a workout session, but he is the expert who should know the workings of the body, the bones and the muscles. Herzy is all of that and more. He fully understands your requirement and accordingly customises your workout to suit your current needs and future goals. The overall experience under his training has been extremely motivating and intense yet made easy by his precise instructions and explanations. Thank you Herzy.",,ChdDSUhNMG9nS0VJQ0FnSUN1OHRqU2tRRRAB
Anytime Fitness Orchard,Tony Ma,5,"Good facilities, bit crowded but manageable",,ChdDSUhNMG9nS0VJQ0FnTUNZeXJUVG13RRAB
Anytime Fitness Orchard,Jillian Yeo,5,Anwar and Dian were very friendly and extremely helpful in helping me set up my Anytime Fitness account very fast. Thanks guys!,,ChZDSUhNMG9nS0VJQ0FnSURYbXRpSkl3EAE
Anytime Fitness Orchard,nusha dakshyni,4,staff are friendly! a range of equipment but quite a big crowd cuz it's town. showers are small & no toilets :( but overall quite a good place to get a workout done!,,ChZDSUhNMG9nS0VJQ0FnSUN1cExmSVVREAE
Anytime Fitness Orchard,Sarah Sfdn,5,The gym has good equipements and is very clean and tidy! Kate at the front desk is very friendly and always ready to greet with a smile!,,ChZDSUhNMG9nS0VJQ0FnSUNOZzgzZmV3EAE
Anytime Fitness Orchard,Aqilo milo,5,friendly staffs and good machines,,Ci9DQUlRQUNvZENodHljRjlvT2tObVJpMTJXVU5sWVROb1dsWm5VRWQ1U1dGRVFtYxAB
Anytime Fitness Orchard,In2rovert Life,5,"Pros
- Love the New Black Equipment
(Makes it feel High Class)
- Convenient location, just above Somerset MRT on the 4th floor of Orchard Central/Gateway (I get confused) with tons of post workout meal options below
- Mid sized, not gigantic but sufficient
- Has an inclined Leg Press to put on 200kg+

Cons
- Lacking in some machines, but only very specific ones like Tricep Seated station etc, besides that you're fine
- Can be crowded since its in the middle of Orchard (even at late night)
- No vending machine at my time of visit, but then again you got food options in the mall
- Didn't visit the showers or baths, unknown if they have them though.

I visit here once in a while if I'm passing by and on the way to work for a quick workout, but will stick to my usual locations for less people

Good if you're on vacation and an AF member I guess",,ChdDSUhNMG9nS0VJQ0FnSURPZ05HMWx3RRAB
Anytime Fitness Orchard,マーク,5,"Justin & Umar gave excellent customer service regarding my billing issues. Other than that, the gym is well kept.",,ChdDSUhNMG9nS0VJQ0FnSUNydTVPSjRRRRAB
