name,place_id,address,rating,user_ratings_total,maps_url
Anytime Fitness MacPherson Mall,ChIJX41bNAAX2jER8L9rlgPDC7E,"401 MacPherson Rd, B1-01 MacPherson Mall, Singapore",5.0,126,https://www.google.com/maps/place/?q=place_id:ChIJX41bNAAX2jER8L9rlgPDC7E
Anytime Fitness City Square Mall,ChIJDzz1mk8Z2jER9spstsimgQE,"180 Kitchener Road, Mall, #06-04 City Square",4.9,1051,https://www.google.com/maps/place/?q=place_id:ChIJDzz1mk8Z2jER9spstsimgQE
Anytime Fitness Bedok 85,ChIJa71bPCI92jERWtJc9IYBGUo,"Blk 88 Bedok North Street 4, #01-163, Singapore",4.9,1047,https://www.google.com/maps/place/?q=place_id:ChIJa71bPCI92jERWtJc9IYBGUo
Anytime Fitness Bukit Timah Central,ChIJU5AB6_sb2jERZXpNUjEz7Fk,"559 Bukit Timah Rd, #B1-01 King’s Arcade, Singapore",4.9,960,https://www.google.com/maps/place/?q=place_id:ChIJU5AB6_sb2jERZXpNUjEz7Fk
Anytime Fitness Buona Vista,ChIJS1v-9jQb2jER7XzNEUFv8uM,"11 Biopolis Wy, #01-04/05/06/07 Helios, Singapore",4.9,837,https://www.google.com/maps/place/?q=place_id:ChIJS1v-9jQb2jER7XzNEUFv8uM
Anytime Fitness Havelock Outram,ChIJJyOThiMZ2jER9H-usPsO2g0,"405 Havelock Rd, #02-02, Singapore",4.9,606,https://www.google.com/maps/place/?q=place_id:ChIJJyOThiMZ2jER9H-usPsO2g0
