outlet,author,rating,text,date_posted,date_posted_normalized,review_id
Anytime Fitness,Danny Ling Khuen Yew,5,I went to the gym and found out there are a lots of sport activities there which I could have fun with a group of friend. After workout we chill and have our dinner. Very nice envirnoment,2 years ago,November 2023,ChZDSUhNMG9nS0VJQ0FnSUNSd3RqRVp3EAE
Anytime Fitness,Osman Amat,3,It's a great place. I make my 2 MacDonald ice-cream floot there and it's great. ( Sorry no picture ),5 years ago,November 2020,ChZDSUhNMG9nS0VJQ0FnSUNzbzZDa0NREAE
Anytime Fitness,Raza Tj,5,"TWCC is located with alot of shops, Food Courts and the Club Facility is very convenient to the Community in the west.",4 years ago,November 2021,ChZDSUhNMG9nS0VJQ0FnSUNxbGZyTU5REAE
Anytime Fitness,allyson,5,"Many activities you can sign up for and join. Good eateries around like Mac Donald's and Starbucks, also a few good coffee shops along the street.",5 years ago,November 2020,ChdDSUhNMG9nS0VJQ0FnSURNZ3R2T3VnRRAB
Anytime Fitness,Sam Ng,4,Many food choices around the area. The bubble tea shop is not bad. A small town centre,4 years ago,November 2021,ChdDSUhNMG9nS0VJQ0FnSUR5b2JXR21RRRAB
Anytime Fitness,Yurei,1,"Was not very helpful with administrative stuff and not flexible, and no empathy at all.",10 months ago,January 2025,ChdDSUhNMG9nS0VJQ0FnSURmb3RITTdnRRAB
Anytime Fitness,bran wong,5,"I’ve been to couple of anytime fitness and this one is by far the most satisfied.
The gym equipment are well maintain and stérilisé all the time.",2 years ago,November 2023,ChZDSUhNMG9nS0VJQ0FnSURScHJQWmJBEAE
Anytime Fitness,Iskandar Mazlan,2,"This gym is clean, equipments are in good condition, the staff is friendly and approachable but they only repeat the same 8 spanish songs everyday 😭 …",2 years ago,November 2023,ChZDSUhNMG9nS0VJQ0FnSURwMXBqVUx3EAE
Anytime Fitness,Congee Ling,5,"Plenty of amenities, comfortable environment with a number of eateries. One of my favourite places to hangout in the neighbourhood.",5 years ago,November 2020,ChdDSUhNMG9nS0VJQ0FnSUNDMHF1V3p3RRAB
Anytime Fitness,Ride & Destroy,4,"Nice location. After your gym session, got Macdonalds, Starbucks and also 24hrs Mamak shop nearby.",2 years ago,November 2023,ChZDSUhNMG9nS0VJQ0FnSUNSZ3J2aVR3EAE
Anytime Fitness,Chris Kow Yong Han,4,Great place with most of the facilities available couple along with all time favourite for most people - Starbucks & macdonald,2 years ago,November 2023,ChZDSUhNMG9nS0VJQ0FnSUNSZ3R2T1F3EAE
Anytime Fitness,Eric Foo,5,"Great place to hang out with a few food outlets, and the committee is really great, having free movie screening at times.",6 years ago,November 2019,ChdDSUhNMG9nS0VJQ0FnSUNZdDRuY3hnRRAB
Anytime Fitness,Loy Huan Chia,4,"With Macdonald's, a cool new playground, regular movie nights, and many others, it's a great neighbourly hangout!",6 years ago,November 2019,ChZDSUhNMG9nS0VJQ0FnSURVM29DS2VREAE
Anytime Fitness,Lakshmi Krishnan,5,"As i visited this this for the first time , there is a best offer with membership given by them and especially for women they give us best solution to reduce the weight . i really prefer this one as a good service with trainer",2 years ago,November 2023,ChdDSUhNMG9nS0VJQ0FnSURScHZEem13RRAB
Anytime Fitness,Kelvin Ang,4,Great place to relax especially the Starbucks... There's also Subway and McDonalds... Playground for kids to play while adults can relax...,6 years ago,November 2019,ChdDSUhNMG9nS0VJQ0FnSURVa182bnBnRRAB
Anytime Fitness,Chan James,5,Very Good Atmosphere with plentiful of Supermarket. Hawker centre Transportation is also Good . Nice food.,5 years ago,November 2020,ChZDSUhNMG9nS0VJQ0FnSUNDNzdIcFVnEAE
Anytime Fitness,Rifaie Zul,4,"A place to hangout with friends, study, exercise at their Anytime Fitness gym, badminton at the multi purpose hall, basketball at the court and quick grab at MacDonalds, starbucks and others such as Subway. Theres lots of activities too such as Yoga and some dance class. Go check them out!!!",6 years ago,November 2019,ChdDSUhNMG9nS0VJQ0FnSUNJN3B5VnRnRRAB
Anytime Fitness,Baofa Yap,4,"Active Community Club with good YEC Team. Holds regular events here for people. Has a starbucks, Macdonalds and a Lan Shop!",10 years ago,November 2015,ChZDSUhNMG9nS0VJQ0FnSUNRal9yUlRnEAE
Anytime Fitness,Sujon R,5,"Nice Simple CC.
Most of the facilities are mentioned by others.
They have basketball court, badminton court, dance studios, Macs, Starbucks",2 years ago,November 2023,ChdDSUhNMG9nS0VJQ0FnSUQtallpWDh3RRAB
Anytime Fitness,Muhammad Hata,5,The club may be small but it is rarely very crowded. It's very homely and intimate and the friendly and helpful staff are always happy to help you.,7 years ago,November 2018,ChZDSUhNMG9nS0VJQ0FnSURBc3NDSVN3EAE
Anytime Fitness,KW Robin Ong,4,There are few fast food & drinks withing CC. Numerous coffee shops & retailers surrounding.,4 years ago,November 2021,ChdDSUhNMG9nS0VJQ0FnSUNpaTh6M21RRRAB
Anytime Fitness,Edward Tan,5,Fun place for kids and parents. Only need to look out for those on bicycles and smoking outside the cc mac.,4 years ago,November 2021,ChZDSUhNMG9nS0VJQ0FnSUR5aGVtekxREAE
Anytime Fitness,Nizam Mohd,5,Photos from Ramadan Bazaar,6 years ago,November 2019,ChZDSUhNMG9nS0VJQ0FnSURZZ2F2TEZREAE
Anytime Fitness,Abdul Karim Noor,4,A good and clean airy CC and having 3 fast food outlets compliment with a good parking area and surroundings.👍👍👍👍 …,6 years ago,November 2019,ChZDSUhNMG9nS0VJQ0FnSURZN2VlaUVREAE
Anytime Fitness,Moushumi Ghosh,4,Love the open foyer and there's Tea Tree cafe for my bubble tea fix :),5 years ago,November 2020,ChdDSUhNMG9nS0VJQ0FnSUQ4aFktcTdBRRAB
Anytime Fitness,elias ang,4,Small gym but has good quipment to work out with. Highly recommended. It's near home. Bus stops and MRT within 5 min of walking,6 years ago,November 2019,ChZDSUhNMG9nS0VJQ0FnSURrclpieWVREAE
Anytime Fitness,Sylvia Sim,3,Good enough atmosphere for cc but a bit laid back & slightly rundown during daytime,5 years ago,November 2020,ChZDSUhNMG9nS0VJQ0FnSURNM1lQa0tnEAE
Anytime Fitness,Faustin Benedict,3,"Surrounded with good eateries like, fast food n local foods malay,Chinese n Indian food also fruit stalls.",Edited 4 years ago,November 2021,ChdDSUhNMG9nS0VJQ0FnSUNTeUlUSS13RRAB
Anytime Fitness,o4t9gv grace,4,"An active club with many happenings, and surrounded by affordable food and daily necessities. Has a children playground too.",6 years ago,November 2019,ChdDSUhNMG9nS0VJQ0FnSURVMU9EZjVnRRAB
Anytime Fitness,Edwin Lau,5,"There's a cafe upstairs , basketball court , gym , Macdonald's , indoor sports hall ( badminton court ) , Starbucks and a dancing room . Great amenities .",8 years ago,November 2017,ChdDSUhNMG9nS0VJQ0FnSUNRd3YyVmhRRRAB
Anytime Fitness,Natalie,4,"Clean. Quiet in the afternoon. Lively in evening. Not much but a Mc Donald's, Subway Sandwich and Starbucks.",6 years ago,November 2019,ChZDSUhNMG9nS0VJQ0FnSUNvcFpUQ1p3EAE
Anytime Fitness,Joe Greener,1,Poor use of public funds - businesses are of poor quality. Starbucks in particular is over priced and coffee is very weak,6 years ago,November 2019,ChdDSUhNMG9nS0VJQ0FnSUNZOGMtcjFRRRAB
Anytime Fitness,Randy Foong,5,Great place to hang around at the heartland. With 24 hrs gym. Fast food and coffee bean is also around the corner,5 years ago,November 2020,ChdDSUhNMG9nS0VJQ0FnSUNzcHJmWTJRRRAB
Anytime Fitness,Mokhtar Amin,3,A well located CC with amenities all around. The best part is that it telecasted the EPL and currently EURO 2016,9 years ago,November 2016,ChdDSUhNMG9nS0VJQ0FnSURncl9YVDlnRRAB
Anytime Fitness,raymond S2009g,4,"Great place to hangout with fast food, community activities, gym, open space at surrounding area.",6 years ago,November 2019,ChZDSUhNMG9nS0VJQ0FnSURrbnVEUGRnEAE
Anytime Fitness,Shazaz alattas,5,This community club has almost everything tat I luv.... The gym... Macdonald... Playground for the kids and alot more. This place for all age group. 😍 …,6 years ago,November 2019,ChZDSUhNMG9nS0VJQ0FnSURFbll6MElnEAE
Anytime Fitness,Liza Yacob,1,"Been called them but never answer the call, service very bad, when visited the office no one attend 😕 so upsetting the CC. …",4 years ago,November 2021,ChZDSUhNMG9nS0VJQ0FnSUN5b3VfZFBREAE
Anytime Fitness,ragul balasubramaniyan,5,Anytime fitness Tampines west inside lot of things have very nice place gym intirer very good some indoor play ground also very nice,2 years ago,November 2023,ChZDSUhNMG9nS0VJQ0FnSUR4ajZpU0NREAE
Anytime Fitness,Schermann (Sczwt),4,"Place has a McDonalds, Subway, Starbucks and a Computer LAN gaming area. Great place for casual meetups.",8 years ago,November 2017,ChdDSUhNMG9nS0VJQ0FnSURBa2RxQ3VBRRAB
Anytime Fitness,Angel T,5,"My favourite place after a long day of work! You should join, too!",2 years ago,November 2023,ChdDSUhNMG9nS0VJQ0FnSURScG9DcXlnRRAB
Anytime Fitness,Jason Koh,4,There is Subway and MacDonald restaurant at level 1. This place is always busy but not crowded and noisy.,7 years ago,November 2018,ChZDSUhNMG9nS0VJQ0FnSUN3bXBDMFJBEAE
Anytime Fitness,Sri Ayu,3,"There's a great cafe at the second floor called BFF, they sell amazing food and coffee.",7 years ago,November 2018,ChZDSUhNMG9nS0VJQ0FnSURncjlmSkdREAE
Anytime Fitness,X2,4,Nice place for some fast food or coffee with friends. Thanks to Kam Ying (SHSS) for directions to this place.,Edited 4 years ago,November 2021,ChZDSUhNMG9nS0VJQ0FnSUN5b0tqcFNREAE
Anytime Fitness,Sam Noah,5,"They have gym, fast food restaurants, cafes, badminton court .. a nice place to hangout with friends",4 years ago,November 2021,ChZDSUhNMG9nS0VJQ0FnSURTcnRHZUVREAE
Anytime Fitness,fauzie mahmood,4,"Gets pretty crowded during the weekends, there starbucks, subway and macdonalds just to name a few",4 years ago,November 2021,ChdDSUhNMG9nS0VJQ0FnSURxb3BiX3JRRRAB
Anytime Fitness,Trinath Vajinepalli,5,Nice place to spend some time with family and you have lot of fun activities to try.,7 years ago,November 2018,ChdDSUhNMG9nS0VJQ0FnSUNBOTY2V3FRRRAB
Anytime Fitness,Wei Jie Lim,5,My first time there but it's packed with so many good stuff,6 years ago,November 2019,ChZDSUhNMG9nS0VJQ0FnSUNVNFp6dGVBEAE
Anytime Fitness,Tharakeshavan Parthasarathy,4,"Had nice facility. Has McDonald's, subway and Starbucks",Edited 6 years ago,November 2019,ChdDSUhNMG9nS0VJQ0FnSUNVejRlUHBnRRAB
Anytime Fitness,Aze Lee,5,My home gym. Nice and cozy. Empty just after lunch when I head there. Lovely staff too.,8 years ago,November 2017,ChZDSUhNMG9nS0VJQ0FnSUNBMHItNWJBEAE
Anytime Fitness,Mohammed Faiz,3,"Awesome staffs.
BUT, mask to be on at all times. Unless you're exercising.
Quite cramp and small.",3 years ago,November 2022,ChdDSUhNMG9nS0VJQ0FnSUNtN3JMa3ZRRRAB
Anytime Fitness,Sherman TBH,4,"Singapore, I have to said have the best community club in Asia. You visit and see it by yourself. You will know I am right.",6 years ago,November 2019,ChZDSUhNMG9nS0VJQ0FnSUNZblBlcFV3EAE
Anytime Fitness,Thomas Chin,4,Nice place to chill out and have fun. I cant remember which course I took here but it was a lot of fun!,6 years ago,November 2019,ChZDSUhNMG9nS0VJQ0FnSUMwOGRYQ2ZnEAE
Anytime Fitness,Noraschid Ghani (The_City_Landscapist),5,"From McDonald's to Brothers in Fine Food, you will fill yourself here with quality food.",8 years ago,November 2017,ChdDSUhNMG9nS0VJQ0FnSUNRckp2S2x3RRAB
Anytime Fitness,Mark Gidwani,5,Place to come get your mac and avoid the sun. Well ventilated with indoor basketball court,6 years ago,November 2019,ChZDSUhNMG9nS0VJQ0FnSUNveDlEVk53EAE
Anytime Fitness,Dina Djafar,4,Starbucks not so crowded. Mac and subway as other options for food.,7 years ago,November 2018,ChdDSUhNMG9nS0VJQ0FnSUNBdDVMXzRBRRAB
Anytime Fitness,Nazrul Mohideen,5,"Starbucks, Subway and McDonald's at one location. Great place to bring my kids.",6 years ago,November 2019,ChZDSUhNMG9nS0VJQ0FnSUNJdzUyekZ3EAE
Anytime Fitness,catalyst mamba,3,Great gym with many nice equipments. Nearby makan place is very nice too,2 years ago,November 2023,ChdDSUhNMG9nS0VJQ0FnSUR4bDd1dTVnRRAB
Anytime Fitness,Douglas Cheong,3,Good place for makan got subway macdonald and starbucks.,4 years ago,November 2021,ChdDSUhNMG9nS0VJQ0FnSURTNGNtZG13RRAB
Anytime Fitness,Gayathri,5,Love it here! Well equipped gym with multiple facilities for everyone!,2 years ago,November 2023,ChdDSUhNMG9nS0VJQ0FnSUR4NV9lRmpnRRAB
Anytime Fitness,Muhammad Hafiz Amir Zainol,4,Best community centre as it has macdonald n subway and now it has arnold chicken..,Edited 5 years ago,November 2020,ChZDSUhNMG9nS0VJQ0FnSUNBbU1fMldnEAE
Anytime Fitness,yusri mohamed,5,Quiet place to chill with Starbucks/Mcdonalds and Arnolds to choose as your spot to relax.,5 years ago,November 2020,ChZDSUhNMG9nS0VJQ0FnSUNpa09EVUhnEAE
Anytime Fitness,Yap Casper,5,"Basketball court, Starbucks, Seminar room for seminars and occasional live football telecast, McDonalds, Subway and etc. What more can you get from a CC like this?",8 years ago,November 2017,ChdDSUhNMG9nS0VJQ0FnSURnNmNudjlRRRAB
Anytime Fitness,Rosemarie Claire Domingo,5,Looking for a place to release your stress at work. ANYTIME FITNESS will be the perfect place to energize your body soul.,2 years ago,November 2023,ChdDSUhNMG9nS0VJQ0FnSUNSZ29lNWpRRRAB
Anytime Fitness,Irene Ho,4,McDonald and subway can be found in this CC. The surrounding area is a small central with lot of shops,6 years ago,November 2019,ChdDSUhNMG9nS0VJQ0FnSURrZzYtTjh3RRAB
Anytime Fitness,Gregory Koh,5,Spacious with good food depending on the certain sport you play there.,5 years ago,November 2020,ChZDSUhNMG9nS0VJQ0FnSUNjbFkyOGNREAE
Anytime Fitness,Sean,4,"Arnott chicken has opened. There is also McDonalds, Starbucks and Subway",5 years ago,November 2020,ChdDSUhNMG9nS0VJQ0FnSURzOHJLVTNnRRAB
Anytime Fitness,# ichad26,5,very nice place to get fitness... complete equipment they have and mostly freindly crew..,2 years ago,November 2023,ChZDSUhNMG9nS0VJQ0FnSUR4NTgtekRBEAE
Anytime Fitness,Chamz Zheng,5,Enjoying the eateries there especially Mcdonald's that open 24hr.,4 years ago,November 2021,ChdDSUhNMG9nS0VJQ0FnSUNxNVlIc3VnRRAB
Anytime Fitness,Jack Hsu,4,"Arnolds chicken outlet is on the 2nd floor,  nice and goid tasting fried chicken",5 years ago,November 2020,ChZDSUhNMG9nS0VJQ0FnSUNpeHJXY1ZREAE
Anytime Fitness,Gene,2,Fans are not switched on to ventilate the common areas despite the ongoing Covid outbreak.,4 years ago,November 2021,ChZDSUhNMG9nS0VJQ0FnSUNxX3AzSkJnEAE
Anytime Fitness,Ramesh Krish,5,Wow a very sprawling gym. Guys head to fitness gym tampines west cc to impress your GF,2 years ago,November 2023,ChZDSUhNMG9nS0VJQ0FnSUNSZ3Z1aE13EAE
Anytime Fitness,Norazah Anwar,3,Good ambience here there are lots fo good food nearby.,8 years ago,November 2017,ChZDSUhNMG9nS0VJQ0FnSUN3NV8zNGVnEAE
Anytime Fitness,Saranjay Manohar,5,"aye my area, in fact i am actually a member there. Helpful staffs",2 years ago,November 2023,ChdDSUhNMG9nS0VJQ0FnSUNSZ3V1ZjhBRRAB
Anytime Fitness,JOE LEE,5,"Nice place，Mcdonald, subway all there! and indoor basketball court",6 years ago,November 2019,ChZDSUhNMG9nS0VJQ0FnSUNvdVl1MWVnEAE
Anytime Fitness,Mohd Eshan,4,Go there to get my cpf statement printout.being served by a helpful staff.thank u 👍👍👍 …,4 years ago,November 2021,ChdDSUhNMG9nS0VJQ0FnSUNhaDZMNW13RRAB
Anytime Fitness,Evan Liu (EvanQP),5,Nice place to grab lunch/hang out at after school,5 years ago,November 2020,ChdDSUhNMG9nS0VJQ0FnSUNzdXRlNnZnRRAB
Anytime Fitness,Raynuga Suppiah,5,"Alot of choices for fast food... Subway, Mcdonalds, Arnold's chicken and Starbucks...",5 years ago,November 2020,ChdDSUhNMG9nS0VJQ0FnSUNzMkp2MnRBRRAB
Anytime Fitness,Very Agung,5,Good place to hang out with family and friends. Good food.,5 years ago,November 2020,ChdDSUhNMG9nS0VJQ0FnSUNzc0pIazBnRRAB
Anytime Fitness,Winston Ong,3,"New basketball court (now concrete) is worse than the blacktop it had before, definitely an unnecessary downgrade",7 years ago,November 2018,ChZDSUhNMG9nS0VJQ0FnSUNna2JYMllBEAE
Anytime Fitness,Dion San,5,Well equipped place with good facilities and good location,2 years ago,November 2023,ChdDSUhNMG9nS0VJQ0FnSUR4ajdERHpBRRAB
Anytime Fitness,Hasnah Ahmad,4,Ambience gd. Went to dinner w family at BFF rest. Nice n cosy..,7 years ago,November 2018,ChdDSUhNMG9nS0VJQ0FnSUNBdVBMdXZBRRAB
Anytime Fitness,zen,1,nothing. the colosseum sucks and the guy inside is a prick as he say he want to ban me forever after i made member the previous time.,10 years ago,November 2015,ChdDSUhNMG9nS0VJQ0FnSUNBbWJTbTdBRRAB
Anytime Fitness,Sudhakar Rao,5,Excellent shopping centres ànd clean environment àlso very safe.,6 years ago,November 2019,ChdDSUhNMG9nS0VJQ0FnSUMwODV5OF9BRRAB
Anytime Fitness,Darin Cheong,5,"The receptonist there is so welcoming, friendly and helpful and the environment is so pleasing.",5 years ago,November 2020,ChdDSUhNMG9nS0VJQ0FnSUNzMWRTZ253RRAB
Anytime Fitness,Andy Chen,5,Has a basketball court and badminton hall that requires booking and Anytime Fitness(gym). Also has a starbucks and macdonalds,7 years ago,November 2018,ChZDSUhNMG9nS0VJQ0FnSUNndDhtbVZBEAE
Anytime Fitness,Siti Arbahya,5,Very convenient for neighbour to come down join the club.,2 years ago,November 2023,ChZDSUhNMG9nS0VJQ0FnSUR4dF9uT0FnEAE
Anytime Fitness,Joelle Goh,5,"Starbucks, Macdonald's and Subway
It's usually crowded but good enough for hang outs.",7 years ago,November 2018,ChZDSUhNMG9nS0VJQ0FnSURRbFlHV0tREAE
Anytime Fitness,EsuFun,5,Such a spacious gym with the best equipments ! Would totally recommend it to gymmers,2 years ago,November 2023,ChZDSUhNMG9nS0VJQ0FnSURKcklmS1hBEAE
Anytime Fitness,Ivan L.,4,"Always here for the f&b spaces. Toilets are clean, common spaces are clean.",4 years ago,November 2021,ChZDSUhNMG9nS0VJQ0FnSURTdHB5YlRREAE
Anytime Fitness,Noorbani Yusoff,5,Have many Halal eateries. Good place for family.,4 years ago,November 2021,ChZDSUhNMG9nS0VJQ0FnSUN5eG95YlVnEAE
Anytime Fitness,Si Thu Nyein Chan,4,"They take care of my health,  The training teacher is good",2 years ago,November 2023,ChdDSUhNMG9nS0VJQ0FnSURKck1mTzl3RRAB
Anytime Fitness,Alvin Ho,1,"No aircon for one month
No 24hrs
Machine not fix for so long
No idea why I paid $95 a month for this",5 years ago,November 2020,ChdDSUhNMG9nS0VJQ0FnSUNDa0lDWnhRRRAB
Anytime Fitness,Benjamin Ong,5,"McDonald's, any time fitness, Starbucks, a nice cafe, what more can u ask for?",5 years ago,November 2020,ChdDSUhNMG9nS0VJQ0FnSUQwdGFxMW5nRRAB
Anytime Fitness,Geoffrey Tay,4,next to macdonald and Subway and Starbuck . convenient place,Edited 4 years ago,November 2021,ChZDSUhNMG9nS0VJQ0FnSUNJczZpeVhREAE
Anytime Fitness,Tayaa Baran SonOf Haridas,5,"Great gym with fully equipped training materials.
Good work out",2 years ago,November 2023,ChZDSUhNMG9nS0VJQ0FnSURSeHVlZ1pREAE
Anytime Fitness,Charles Stanley,4,"Spacious, a few choices of food, many shops nearby.",6 years ago,November 2019,ChZDSUhNMG9nS0VJQ0FnSUNZa3RicVhnEAE
Anytime Fitness,Shem Sung10,5,"Home of MacDonalds, Starbucks and an awesome cafe Brothers in fine food.",7 years ago,November 2018,ChZDSUhNMG9nS0VJQ0FnSUNBcTdQemNnEAE
Anytime Fitness,Raymond Foo,5,Many food eatery stall in this CC. An alternative pls when looking for foods after a game.,4 years ago,November 2021,ChdDSUhNMG9nS0VJQ0FnSURLemN5NTZRRRAB
Anytime Fitness,Joey Tan,5,Nice place to hangout with many variety of food!,5 years ago,November 2020,ChZDSUhNMG9nS0VJQ0FnSUNpaEwzOVR3EAE
Anytime Fitness,BloodTrinity,4,"CC, has a starbucks, also a Teo Heng above.",5 years ago,November 2020,ChdDSUhNMG9nS0VJQ0FnSUNNdFpqWDd3RRAB
Anytime Fitness,Geow Koh Chu,3,This community club has: Starbucks cafe; McDonald's; Subway kiosk for refreshments.,8 years ago,November 2017,ChZDSUhNMG9nS0VJQ0FnSUN3eDU3VVdREAE
Anytime Fitness,Seng Chong Tan,3,"Meeting place of the residents of Tampines West to eat, play, learn and have fun",Edited 8 years ago,November 2017,ChZDSUhNMG9nS0VJQ0FnSURnMll5NFRnEAE
Anytime Fitness,Danson Mobile - D & G Marketing,2,Never failed to disappoint us basketball players without Net on their Basketball rings..,6 years ago,November 2019,ChdDSUhNMG9nS0VJQ0FnSUMweEplTnBBRRAB
Anytime Fitness,Jake Poh,5,"Great compact gym, with very friendly staff! Always glad to visit this branch",Edited 4 years ago,November 2021,ChdDSUhNMG9nS0VJQ0FnSUM4cTl2bndnRRAB
Anytime Fitness,Elias R,5,Nice place.. My fav places to eat,Edited 4 years ago,November 2021,ChZDSUhNMG9nS0VJQ0FnSURvclpuTEJREAE
Anytime Fitness,"陈 兄 弟屋 业,销售楼盘",4,Atm pop up machine queue was short to change new notes,4 years ago,November 2021,ChZDSUhNMG9nS0VJQ0FnSUN5bGN6WUZnEAE
Anytime Fitness,Kee Chiat Yeo,3,Got Arnold's Fried Chicken at level 2 now,5 years ago,November 2020,ChdDSUhNMG9nS0VJQ0FnSURzOHZqWThnRRAB
Anytime Fitness,Ashley Tan,5,Good facilities and location! Recommend to come!,2 years ago,November 2023,ChdDSUhNMG9nS0VJQ0FnSURSdVphVHNnRRAB
Anytime Fitness,Muhd Iszaki,5,"Weekly movie
and football screening",Edited 6 years ago,November 2019,ChZDSUhNMG9nS0VJQ0FnSUNJNTVpZFpBEAE
Anytime Fitness,Senthilkumaran Manisekaran,5,Great place for wants more activity at one stop.,Edited 6 years ago,November 2019,ChdDSUhNMG9nS0VJQ0FnSUNBX3RYUm5RRRAB
Anytime Fitness,Liang Seng Lim,3,The layout is a little confusing but once use to it there a good variety of activities,5 years ago,November 2020,ChZDSUhNMG9nS0VJQ0FnSUNDdDgzY0JREAE
Anytime Fitness,wayne5851,5,Great gym with many nice equipments. Nearby makan place is very nice too,2 years ago,November 2023,ChZDSUhNMG9nS0VJQ0FnSURSeHJlbVhBEAE
Anytime Fitness,Homaun Kabir Kabir,5,This place is Very nice  have ply grown for baby,5 years ago,November 2020,ChdDSUhNMG9nS0VJQ0FnSUNDd3M2ZnBRRRAB
Anytime Fitness,Fadina Chan,3,"Went to Mc'donalds ard 5plus pm, long queue....",5 years ago,November 2020,ChZDSUhNMG9nS0VJQ0FnSURjckptdERBEAE
Anytime Fitness,Toh Kah Lun,5,"Near to starbucks, mcD, food court, prime supermarket and variety of heartland shops",6 years ago,November 2019,ChdDSUhNMG9nS0VJQ0FnSURJNHViVC1nRRAB
Anytime Fitness,Harkishen Singh,5,Decent place to workout. Try to avoid after working hours,2 years ago,November 2023,ChZDSUhNMG9nS0VJQ0FnSURKclB2ZVN3EAE
Anytime Fitness,Rosalind Chan,4,Coffee shops are lively place in the weekend mornings,6 years ago,November 2019,ChdDSUhNMG9nS0VJQ0FnSUNvcVBqVW93RRAB
Anytime Fitness,Henry “The Gangs”,4,Nice place to spend your free time.,7 years ago,November 2018,ChZDSUhNMG9nS0VJQ0FnSUNBMFAyVUZ3EAE
Anytime Fitness,Dino Thangamany,3,"Nice variety of fruits, good prices for some.",6 years ago,November 2019,ChdDSUhNMG9nS0VJQ0FnSUMwbmJ5UzRRRRAB
Anytime Fitness,Chin Guan Soh,5,Very cheerful and friendly people and staff around,5 years ago,November 2020,ChdDSUhNMG9nS0VJQ0FnSUNpcnJ1RjhBRRAB
Anytime Fitness,Adam Chow,3,"Went there to get cny new notes, looks good the place",6 years ago,November 2019,ChdDSUhNMG9nS0VJQ0FnSUNvaE1tYTFnRRAB
Anytime Fitness,R King,3,Damn crowded on weekends. Need another community center nearby to handle human flow,7 years ago,November 2018,ChdDSUhNMG9nS0VJQ0FnSUR3M1BYcGlRRRAB
Anytime Fitness,Aloysius Ong,3,I think need more upgrading but lots of hawkers and community shops,5 years ago,November 2020,ChdDSUhNMG9nS0VJQ0FnSUM4cXYzRm9nRRAB
Anytime Fitness,Joan Chung Guyll,5,Nice cooking studio. Easy access by bus,4 years ago,November 2021,ChdDSUhNMG9nS0VJQ0FnSUN5OTktLV9nRRAB
Anytime Fitness,XIN TANG,4,"one of the bigger ones, many eating places around for catchup with friends after gym time",2 years ago,November 2023,ChdDSUhNMG9nS0VJQ0FnSURScHJpWXN3RRAB
Anytime Fitness,Myo Min Swe,4,Very spacious and comfortable plus amenities atound,6 years ago,November 2019,ChdDSUhNMG9nS0VJQ0FnSUNvamViOGx3RRAB
Anytime Fitness,Keon Tang Zhi Yong,4,Great place to chill out with MacDonald and Starbucks,9 years ago,November 2016,ChdDSUhNMG9nS0VJQ0FnSUN3c3RxSmpnRRAB
Anytime Fitness,Adrael Pereira,1,A lot of young punk's playing techno music and riding e scooters and shouting knn,7 years ago,November 2018,ChdDSUhNMG9nS0VJQ0FnSURnN3VUOTlBRRAB
Anytime Fitness,Desmond Kok,4,Have a big open air seats for McDnd,4 years ago,November 2021,ChdDSUhNMG9nS0VJQ0FnSUN5MHV2QWpRRRAB
Anytime Fitness,Augustine Ramachandran,4,Nice place to relax n get a bite,6 years ago,November 2019,ChdDSUhNMG9nS0VJQ0FnSURJbk9qNnJRRRAB
Anytime Fitness,Roz,4,surrounding outside the public areasf ound to be cleaned...etc.,5 years ago,November 2020,ChZDSUhNMG9nS0VJQ0FnSURjMGFMck1REAE
Anytime Fitness,Zeenat Kausar,3,Subway meal is slightly more expensive than Macdonald.,6 years ago,November 2019,ChdDSUhNMG9nS0VJQ0FnSURvNF9LNl9nRRAB
Anytime Fitness,pragnesh virani,4,Good place,7 years ago,November 2018,ChZDSUhNMG9nS0VJQ0FnSURBOF9MQkdREAE
Anytime Fitness,Alvin Chia,5,Art Jamming for Valentines day,7 years ago,November 2018,ChZDSUhNMG9nS0VJQ0FnSURnOWFYQ1N3EAE
Anytime Fitness,Lai Lai,4,The service and the attitude of the staff is very good.,Edited 4 years ago,November 2021,ChZDSUhNMG9nS0VJQ0FnSUNJZ3RYWEJREAE
Anytime Fitness,KK Jek,5,"There are eateries, especially fast food, Western meals, and fitness center",7 years ago,November 2018,ChdDSUhNMG9nS0VJQ0FnSUNBay1iMnNnRRAB
Anytime Fitness,Chee Hian Ng,5,"Great gym with fully equipped training materials.
Good work out",2 years ago,November 2023,ChZDSUhNMG9nS0VJQ0FnSUNSZ3B2MUN3EAE
Anytime Fitness,Christony Lau,5,A heartlanders zone for pleasant rest and people watching,6 years ago,November 2019,ChdDSUhNMG9nS0VJQ0FnSURZbDlENTVRRRAB
Anytime Fitness,Rohana Hamson,5,Simply the best CC I can think of in Singapore!,8 years ago,November 2017,ChZDSUhNMG9nS0VJQ0FnSURRdGF5M2J3EAE
Anytime Fitness,N Fikri (Nabih Fikri),4,This community centre has a cinema? Nice!,6 years ago,November 2019,ChdDSUhNMG9nS0VJQ0FnSURVaHZ5RTJRRRAB
Anytime Fitness,Chromacry,4,Really nice place with activities and facilities,5 years ago,November 2020,ChdDSUhNMG9nS0VJQ0FnSUNzc01fN3V3RRAB
Anytime Fitness,norazah binti anwar,4,"Good environment, lot of eateries.",6 years ago,November 2019,ChZDSUhNMG9nS0VJQ0FnSUMweFlfTU1BEAE
