outlet,author,rating,text,date_posted,date_posted_normalized,review_id
Anytime Fitness,Benjamin Neo,5,"Have been training here for over 2 years, and I would highly recommend this AF outlet. Although the space is a little small, this AF outlet offers excellent facilities and gym equipment, while having members of staff that consistently ensures the cleanliness of the gym space and gym equipment.

Unlike other gyms, the members of staff at this AF outlet engages both newcomers and seasoned AF members with a friendly, encouraging, and positive attitude. Should you have any questions or issues, the members of staff are quick to respond and resolve them.",2 months ago,September 2025,Ci9DQUlRQUNvZENodHljRjlvT2w5NmFrRk5MV2RqVjFVNFRHbExOMUo1UmtGallWRRAB
Anytime Fitness,Hazel H,1,"Kinda small outlet with decent equipments. Two toilets sometimes come with special “aroma”. Afternoon can be a bright place here, as sunlight shine into the premise.
Please wear sunglass if you come to this outlet. Lol. (advised by the Anytime fitness management).",Edited 9 months ago,February 2025,ChZDSUhNMG9nS0VJQ0FnSUQzOWJYMUtREAE
Anytime Fitness,Stormy,4,"Nice Simple CC.
Most of the facilities are mentioned by others.
They have basketball court, badminton court, dance studios, Macs, Starbucks, Subway.

The basketball court serves as a multipurpose hall too. Very airy which is good.

Nice cosy Starbucks place to be at, that is if there are no noisy peeps around to create noise pollution. This Starbucks has a nice foreign feel, does make you feel like you are not in Singapore. I love it. ☺ ❤",7 years ago,November 2018,ChdDSUhNMG9nS0VJQ0FnSUNBOXBmSWt3RRAB
Anytime Fitness,Shirley “MuseFaery” NKL,5,"Excellent facilities! The lighting for the badminton courts are one of the best if not the best. The club is well integrated with plentiful of food outlets like Subway, Starbucks and McDonald's. There is also an AXS machine and a gymnasium on the premise.",7 years ago,November 2018,ChdDSUhNMG9nS0VJQ0FnSUNROTdma2pBRRAB
Anytime Fitness,Sophie,4,The playground is very interesting and a little bit challenging. I like the design. Downside is a lot people were smoking there when we visited around 7pm.,4 years ago,November 2021,ChZDSUhNMG9nS0VJQ0FnSUNxNzRueEVREAE
Anytime Fitness,KiM BooN LeE,3,Look huge but seem small once inside... All sort of things for the community but due to convid only the MacDonald is busy n a Starbucks...,4 years ago,November 2021,ChZDSUhNMG9nS0VJQ0FnSUN5aDRUS0J3EAE
Anytime Fitness,Irfan Lutfil Hadi,5,Amazing staff members 10/10 always easy to approach to ask for assistance and never cease to impress me how friendly they are,2 months ago,September 2025,Ci9DQUlRQUNvZENodHljRjlvT2pVdFZVeFFNMmwxZG5WM1dHWjFNbUpWWW5kRlVrRRAB
Anytime Fitness,khrhms,4,Quite ok range of equipment and machine. Relatively small outlet. Crowd is not bad during off peak. 2 toilets with shower facilities.,2 years ago,November 2023,ChZDSUhNMG9nS0VJQ0FnSUNaamFIYVB3EAE
Anytime Fitness,Tunvir Arora,5,"One of the friendliest people I have met for staff shoutout to the team they are so considerate and keep the gym clean and make sure you are comfortable thanks

Niyaaz, Raidah, Emma",3 months ago,August 2025,Ci9DQUlRQUNvZENodHljRjlvT2t0U1owZ3lkR1Z4ZVVwMVJqbGxiV2hGWTFkSE1FRRAB
Anytime Fitness,Andik Kurniawan Santoso,5,Very big and nice community centre. Close to a few schools. You can only get here by feeder buses. Sure bt tt. That part of tampines is pretty secluded. Alot of programs are conducted here every weekend. tampines west community club is near st hildas n near the shell kiosk. its quite common to see students here as there is a mac outlet. poly students eat here all the time.,6 years ago,November 2019,ChdDSUhNMG9nS0VJQ0FnSUNVMzVLZ3pnRRAB
Anytime Fitness,Shaik Humarhamdani,5,Good gym. Small but fully equipped. Friendly staff. Bright and clean.,6 years ago,November 2019,ChZDSUhNMG9nS0VJQ0FnSURVM3N6LVV3EAE
Anytime Fitness,Jonathan Boon,1,"Changing room is basically the toilet/shower room, which means there’s a 90% chance the floors of the changing room are soaking wet.

The most egregious problem here is the absolutely trashy and inappropriate music that’s blasting 24/7.",7 months ago,April 2025,ChZDSUhNMG9nS0VJQ0FnTURRODVpTFlnEAE
Anytime Fitness,Eng Ann Lee,4,One of my favourite CC for world cup watching and other activities. Not sure why the McDonald is always long que and pack with people.,6 years ago,November 2019,ChZDSUhNMG9nS0VJQ0FnSUM0NFo2eUJREAE
Anytime Fitness,Bub Hezock,5,Great customer service and assistant by the tall and handsome Reeve and charismatic Niyaaz,4 months ago,July 2025,Ci9DQUlRQUNvZENodHljRjlvT2pacFZHVkhZalJxVW5Wa2RUTnBSRlY2VUZReFRWRRAB
Anytime Fitness,Syazzy Slackster,5,Quite near my house. Love ordering thru Mobile Order and collect here because parking is free if within grace period.,4 years ago,November 2021,ChZDSUhNMG9nS0VJQ0FnSURhaGNERER3EAE
Anytime Fitness,James Tey,5,Newly open Arnold's chicken. My favourite fried chicken in Singapore.,5 years ago,November 2020,ChZDSUhNMG9nS0VJQ0FnSUNNcDZqSVd3EAE
Anytime Fitness,Drifterdrift Aka Bryan leong,5,Just a #simple story sharing session... Great hangout place.. There's a Starbucks also...,5 years ago,November 2020,ChdDSUhNMG9nS0VJQ0FnSUNDbEoyMnBBRRAB
Anytime Fitness,Chew Michael,5,"Nice place (CC) Food food food, large TV screen, workout n martial art",4 years ago,November 2021,ChZDSUhNMG9nS0VJQ0FnSUR5dXRIQVpnEAE
Anytime Fitness,Jackson L,4,"Quite a chill nice place, not alot of equipment due to the small space, but you have everything you need",10 months ago,January 2025,ChZDSUhNMG9nS0VJQ0FnSURmLWRPQlhnEAE
Anytime Fitness,Angela Lansbury,4,Busy bustling place with busy fast food restaurants on the ground floor and a big outdoor children's playground at the back. When on the bus you can spot it easily opposite the back of the school (from Tampines you pass the front of the school first and the bus goes around the block. The building has a distinctive twisted tower. Some people dislike the design but I like it.,5 years ago,November 2020,ChdDSUhNMG9nS0VJQ0FnSUNNcTh2NDlBRRAB
Anytime Fitness,Francis Goh,5,My favourite fried chicken,4 years ago,November 2021,ChdDSUhNMG9nS0VJQ0FnSUM2MFBLYndRRRAB
Anytime Fitness,John Goh,5,"Coming from the west and central part of the island, I wasn't comfortable hanging around the Mcdonald without a peace of mind. The two visits made me change my perspective. Its a relatively safe place for gathering of different interest groups with their own objectives. It's generally safe.",5 years ago,November 2020,ChZDSUhNMG9nS0VJQ0FnSUNzcTlMYVhnEAE
Anytime Fitness,Ashikin Zulkifli,5,"Small outlet but surprisingly well equipped. At least 1 machine for every muscle group and free weights go up to 50?kg IIRC. 2 squat racks, 1 smith machine & 2 benches. At the time I’m posting this it’s right as their club refresh is starting. Can’t wait to see the new look.

No deadlift platform due to space constraint but a good sized functional area + equipment.

Convenient for me to get a workout in as it’s nearby home. Though I’m unsure of how bad the crowd gets on weekday evening as I prefer to frequent on weekend mornings (~7am) and it’ll be quite empty.

The staff are also all friendly and greet you with a smile as you come in. I really appreciated it when I was first starting my fitness journey and made me feel secure enough to sign membership here :)",2 years ago,November 2023,ChdDSUhNMG9nS0VJQ0FnSURGX1luZGpnRRAB
Anytime Fitness,Roland Seh,4,"Came to this place on recommendation from a friend of Starbucks having a store here. When I reached here, I was surprised to see more than just Starbucks! There is McDonald as well as Subway. Overall, the CC looks pretty hippy to hang around. Would definitely revisit due to Starbucks!",9 years ago,November 2016,ChdDSUhNMG9nS0VJQ0FnSURRd2VlczFRRRAB
Anytime Fitness,Michele Chang,5,"Anytime Fitness Tampines West CC is a convenient and accessible gym located in Tampines, Singapore. It offers a range of fitness facilities and services, making it a popular choice for individuals looking to stay active and fit.

The gym is well-equipped with a variety of exercise machines and equipment, catering to different workout preferences and fitness levels. Whether you prefer cardio exercises, strength training, or group fitness classes, Anytime Fitness Tampines West CC has something for everyone. The gym is clean and well-maintained, providing a comfortable and safe environment for workouts.

One of the key advantages of Anytime Fitness is its 24/7 access, allowing members to exercise at their convenience. This flexibility is particularly beneficial for individuals with busy schedules or those who prefer to work out during off-peak hours. The gym also offers secure access, ensuring members can work out with peace of mind.",2 years ago,November 2023,ChdDSUhNMG9nS0VJQ0FnSUR4NTktTDFBRRAB
Anytime Fitness,Marvin Woo,5,"I love this place. It's small, old & run down. The toilets are smelly & dirty. BUT this community centre leads the way in linking up residents by having lotsa cool & fun activities organised frequently. There are movie nights, EPL nights, fringe activities, lots of freebies like snacks, balloons sculptures, fun photo-taking sessions, plus many more activities to keep families & kids engaged & occupied. Great!!!",5 years ago,November 2020,ChZDSUhNMG9nS0VJQ0FnSUNzMTdHZVJ3EAE
Anytime Fitness,Wee Jun Yang (Joe),4,"Great place with a Starbucks and McDonald. Though the Starbucks is not 24 hours, but great place to chill and hang out. Facilities include basketball court which is indoor and some other facilities for rental. Do visit the CC for some food and activities!",7 years ago,November 2018,ChZDSUhNMG9nS0VJQ0FnSUNndVpmaVF3EAE
Anytime Fitness,Prakhar Trivedi,5,"This place is absolutely amazing with all the amenities while being with walking distance to people within Tampines West. It has restaurants such as Subway and McDonalds including activities for children to do. There are also Taekwondo classes and other classes for children too. Overall, its a 10/10 place to visit!!!",5 years ago,November 2020,ChZDSUhNMG9nS0VJQ0FnSURDdU9YYkpBEAE
Anytime Fitness,Cherry Chacko,5,"Great meeting place. Has MacDonalds, Starbucks, Subway, Arnold's for a quick bite. Indoor basketball court, badminton courts, meeting room, event hall, mobile library. PA offices, AXS  machine. Nice place to meet friends and chill.",5 years ago,November 2020,ChZDSUhNMG9nS0VJQ0FnSUNzX3VtbGR3EAE
Anytime Fitness,Muhd Danish,5,The fastfood outlets there (McDonalds and Arnold's Fried Chicken) are pretty good. There is also plenty of space to hangout with friends or even study though it can get a little crowded and noisy.,Edited 4 years ago,November 2021,ChdDSUhNMG9nS0VJQ0FnSURBcXJxNXZBRRAB
Anytime Fitness,Yeo Eileen,4,"There is a very enthusiastic staff. Engage with the customers. If not, it will be two stars because of the poor Cleanliness and no table for seating. Had to rush and cannot even enjoy my meal.",6 years ago,November 2019,ChdDSUhNMG9nS0VJQ0FnSUM0enVuRXdRRRAB
Anytime Fitness,Sharizam Cairel,5,the staff here are super friendly and welcoming!!!,5 months ago,June 2025,ChRDSUhNMG9nS0VPcmg0dl83M3FONBAB
Anytime Fitness,Zachary. Guo,5,"Anytime Fitness Tampines West Community Club is a well-equipped gym located in the heart of Tampines West. It offers a variety of modern fitness equipment, including cardio machines, weightlifting equipment, and free weights. The gym is clean and well-maintained, and the staff is friendly and helpful. One of the highlights of this gym is its 24/7 access, allowing members to work out at any time that suits their schedule. The membership fees are affordable, making it a great option for those on a budget. Overall, Anytime Fitness Tampines West Community Club is a great choice for those looking for a convenient and affordable gym in the Tampines area",2 years ago,November 2023,ChdDSUhNMG9nS0VJQ0FnSURScHJ6SmxBRRAB
Anytime Fitness,Faridah Ismail,3,Helpful staff. However toilet is not advisable for use as toilet attendant behaved as an inspector instead of an attendant and a a foreign one at that. He did not refill the soap dispenser and normally even the toilet rolls aren't there. This one should be sent back to his country unless the local supervisor is not doing his job.,6 years ago,November 2019,ChdDSUhNMG9nS0VJQ0FnSURJMTRpZnJ3RRAB
Anytime Fitness,EeraShorty Ahcir,5,"My kids loving the playground as there are swings. Where else we can find those swings right?? Nowadays playgrounds at BTO is not that interesting compared to those old ones. Best thing here? While the kids enjoy themselves, i can indulge and have some food or  drinks at Macdonald's, starbucks, subway and their new food chain Arnold's!",5 years ago,November 2020,ChZDSUhNMG9nS0VJQ0FnSUNza1k3VkNBEAE
Anytime Fitness,Bryan,5,"Thank you to Nate, Raidah and Niyaaz for the great customer service and professionalism - dealing w my queries while ensuring that my needs are met. Even before I start using this gym, am impressed alr. Highly reco!",a year ago,November 2024,ChZDSUhNMG9nS0VJQ0FnSURsLTdfRVRnEAE
Anytime Fitness,Hardik Viradiya,5,"AWESOME LOCATION! Where else can you hang out late with Kakis for exercise? Very sinful though—after working out, there are several restaurants to choose from. NEED TO GO MORE REGULARLY.",2 years ago,November 2023,ChZDSUhNMG9nS0VJQ0FnSURKck9mLURREAE
Anytime Fitness,Khai Gaffor,1,"This community centre at tampines west have the most rude staffs working inside. During the distribution of masks, they should be more proactive and help to guide visitors who came to collect masks instead of sitting in the comfort of their air conditioned office well before lunch time smilling and chatting on the phone.",5 years ago,November 2020,ChZDSUhNMG9nS0VJQ0FnSURjdE9URGJnEAE
Anytime Fitness,peter chua,4,Able to collect the free masks at this community club from mask vending machines.,5 years ago,November 2020,ChZDSUhNMG9nS0VJQ0FnSURDc3E2dGZBEAE
Anytime Fitness,Dalia David,4,"Quick eatery...McDonald and Subway both available here till midnight...however McD was 24 hrs before the lockdown and now weekends open till 02am...
They are open for 24 hrs on 12 13,14Feb2021 for Chinese New Year",4 years ago,November 2021,ChZDSUhNMG9nS0VJQ0FnSUN5clppck1BEAE
Anytime Fitness,Faizal Mohd. Shariff,4,"Still functional but i still prefered Mr Fauzani cause he gave me motivation , advised plus his own pocket money just to make a good day for my problems.I being treated like a younger brother to him & that 's why i loved his approachable manner in handling difficult case like mine.I really appreciated what he had done to me so far,thanxs Mr Fauzani, from Faizal.",5 years ago,November 2020,ChZDSUhNMG9nS0VJQ0FnSURjd3NhNkpBEAE
Anytime Fitness,Sham Abdullah,4,"Best Community Club in Tampines. House some good arrays of facilities including study rooms, basketball court, coupled with some good cafes such as Subway, Starbucks and MacDonald.
A town centre with various shops and coffeeshops are also just next to this community club",7 years ago,November 2018,ChdDSUhNMG9nS0VJQ0FnSURneWMzNTV3RRAB
Anytime Fitness,Rayan Bettis07,2,"Along the pavements  entrance CC the technician creates post side lamps  underground it doesn't gives so much impact it just creating worst for cycles during night the lamps supposed to airm the wall, but no wall to trigger the lamps looked like strong beam for cycles prepare to invite accidents
SM Razak wasn't they anymore",3 years ago,November 2022,ChdDSUhNMG9nS0VJQ0FnSUQyMDdUS3hBRRAB
Anytime Fitness,Sharizah Shariff,5,"The community club has starbucks, macdonalds, subway etc, and is near to Tampines Hub. It is nestled in a great neighbourhood with shops providing various goods and services. Various buses serves the area and it is also within walking distance from Tampines West Mrt.",5 years ago,November 2020,ChZDSUhNMG9nS0VJQ0FnSUNNcDlqM0lnEAE
Anytime Fitness,radhakrishnan k s naidu,5,"The female malay staff with the lsptop booking was friendly, polite and helpful when i requested for a change of date for the 2nd vaccination. However, when i first took my queue at the cc, a malay lady checking the people on line approached me. When i told het about my request, she on the spot told me that the venue Tampines hub is fully 'booked'. Shre ask me to go to Bedok or Pasir Ris. I feel she should not give such information without first checking the computer or the person in charge. Otherwise my visit was pleasant and smooth. Thank you.",4 years ago,November 2021,ChZDSUhNMG9nS0VJQ0FnSUNLNkpYTFRREAE
Anytime Fitness,NEO URISE,5,"The place is vibrant with people of all ages . They provide courses from children to adults. There are always new things to look out for. This place also have Macdonald, Subway, Starbucks and B.F.F eateries.",7 years ago,November 2018,ChdDSUhNMG9nS0VJQ0FnSUNRdmQ2UTNRRRAB
Anytime Fitness,hugo ye,4,Would've preferred if they have a ring or punching bags. But overall its very nice and comfortable.,a year ago,November 2024,ChZDSUhNMG9nS0VJQ0FnSUQ5MnZPT0NREAE
Anytime Fitness,Muzmil Asmui,5,"Thank you...Mr.Security (Chinese)and one more is (Indian Lady)must be Security to...Both of them...at the Counter...
.
Thank you for being so nice..polite and always smile 😊 While on duty at TWCC...

It happens on last Saturday afternoon around 1530pm..... they greed me GOOD AFTERNOON.....and address me to go to 2nd Floor...to Change my Trace Token (no battery)...

Thank you 😊 Mr.Security and Lady Security....and the Staff handling the Token at 2nd floor..... they very polite...

Good Job 😁 Well done

May God 🙏 Bless

Thank you 💖",Edited 4 years ago,November 2021,ChZDSUhNMG9nS0VJQ0FnSURTMHJmX0dnEAE
Anytime Fitness,Shrikant More,5,"Excellent facilities! The lighting for the badminton courts are one of the best if not the best. The club is well integrated with plentiful of food outlets like Subway, Starbucks and McDonald's. There is also an AXS machine and a gymnasium on the premise.",2 years ago,November 2023,ChdDSUhNMG9nS0VJQ0FnSURSeHBmQXhnRRAB
Anytime Fitness,i_AM_AC _,5,Quite near my house. Love ordering thru Mobile Order and collect here because parking is free if within grace period.,2 years ago,November 2023,ChZDSUhNMG9nS0VJQ0FnSURSeHVmZEJBEAE
Anytime Fitness,Justin Y,5,"This CC is so upscale with MacDonald, Subway, Starbucks and even a Lan cafe in Basement. Have Indoor basketball court too. CC is opened 24/7.",8 years ago,November 2017,ChZDSUhNMG9nS0VJQ0FnSURnbE1yV0tBEAE
Anytime Fitness,DHIRAJ BODKHE,4,"Joining Fees $98
Charge for the Key (Entry Access Card) $70+ Taxes

And then the plans:
01 Month Plan $138
06 Month Plan $118
12 Month Plan $098
18 Month Plan $088

& if you want to back out of any of these plans, you need to provide 1 month Notice Period and proper medical reason and bear $100 charge.",Edited 6 years ago,November 2019,ChZDSUhNMG9nS0VJQ0FnSURZZzg3a0JBEAE
Anytime Fitness,Surya Sadikin S24,5,"The food here is same as other McD. But the auntie there was very helpful, she helped me when I spilled my coffee accidentally. She even offered me a new cup of coffee 👍 …",Edited a year ago,November 2024,ChZDSUhNMG9nS0VJQ0FnSURDb0pPVFJ3EAE
Anytime Fitness,christina santhyagoo,5,"I really prefer to go to this fitness centre, hardly I will get my time for gym, but here they allowed  members to work out at any time that suits their schedule time. It's really very convenient as is adjustable to my daily routines.",2 years ago,November 2023,ChdDSUhNMG9nS0VJQ0FnSUR4bDdxMXlnRRAB
Anytime Fitness,Mr Goh,4,"Fast food, coffee shops, Community Centre, all types of shop houses andwet market are together. Sufficient parking lots nearby HDB.",4 years ago,November 2021,ChdDSUhNMG9nS0VJQ0FnSUN5dGJIeTRBRRAB
Anytime Fitness,Rasyad,3,"This place seemed runned down. Old. Out of place.
Even if the building is new.  It doesn't feel new.  And to be honest.  This building is useless.  Converting this place to a bigger activity area would be better instead of what It is now.",6 years ago,November 2019,ChdDSUhNMG9nS0VJQ0FnSUNVOGN2VDdRRRAB
Anytime Fitness,GrowingUpWith The Danishes,5,"Always lively with macdonalds, starbucks,subway and 24hr gym. Plyground also for young adults. Affordable courses like cooking sewing dancing etc. Rentable badminton court, basketball court. Usually plays movies over weekends with free popcorn. Good stuffs.",6 years ago,November 2019,ChZDSUhNMG9nS0VJQ0FnSUNJamVIMFRREAE
Anytime Fitness,Alen Sojan,1,The air condition (AC) is not working for the last 4 days and they don't repair it until now. Why? If any one go to gym he can do two things in a single time workout and bathing . And there is no enough cooling fan also. Why the staff is become like this?,5 years ago,November 2020,ChdDSUhNMG9nS0VJQ0FnSUQ4bTZxZ3F3RRAB
Anytime Fitness,SC,4,"The CC has a range of activities planned for people in the neighbourhood. It is often crowded with activity participants or facility users. It also has a 24-hr McDonalds, a Starbuck, a Subway outlets. These outlets are hang-out places for students from nearby polytechnic and schools.",9 years ago,November 2016,ChRDSUhNMG9nS0VJQ0FnSUNRcWRobxAB
Anytime Fitness,Susan Lee,4,"There are ample fans in the basketball court and make the place very cooling. In addition, the badminton hall is also air- conditioned, and very comfortable.",7 years ago,November 2018,ChZDSUhNMG9nS0VJQ0FnSURnMzR2VEhREAE
Anytime Fitness,angie toh,4,"Cleaner toilets compare to years back.

Got 24 hours MacDonald on weekends , subway up to 10pm week night.

Got starbucks, fruit juice stall etc",4 years ago,November 2021,ChZDSUhNMG9nS0VJQ0FnSURjdk5QNWF3EAE
Anytime Fitness,law soon chai,1,The place is nice to sit n relax.however the children playground was always little by rubbish n cigarete stain. Every morning there are a group of teenagers smoking.at the swing.,6 years ago,November 2019,ChZDSUhNMG9nS0VJQ0FnSUNvLWJ2c0x3EAE
Anytime Fitness,kazuki lim,1,"The aircon has been down for a month, timing keeps getting shortened by the management. Other gyms are starting to extend hours to the original 24 hours, whereas this gym doesn’t just avoid extending it, they even shortened it. Why do we pay for a 24 hour gym then?",5 years ago,November 2020,ChdDSUhNMG9nS0VJQ0FnSUNDNnUzYnBBRRAB
Anytime Fitness,Timothy Chan,5,Awesome place to watch live telecast of EPL match on big screen. Delicious zhi-char food at coffee shop opposite TWCC.,6 years ago,November 2019,ChdDSUhNMG9nS0VJQ0FnSURveE0zbC1nRRAB
Anytime Fitness,Yen Sim,5,Nice gym for family. There is a nice playground  and my kids enjoyed it. Convenient to reach and eat. But always crowded.,2 years ago,November 2023,ChdDSUhNMG9nS0VJQ0FnSUR4OTlIR3ZBRRAB
Anytime Fitness,desertrose TAN,5,"Was at Tampines West CC for MCD take away. Entry screen at MCD is good despite having to wait outside under the hot humid weather.
Service at MCD is good & professional",5 years ago,November 2020,ChZDSUhNMG9nS0VJQ0FnSURjdHZUUk9nEAE
Anytime Fitness,Allenism,3,"many youngster hangout here , sometime was quite disturb that the kids who played at this playground creating alot rubbish on the ground and maybe bought things from mcdonald and spill it on the floor rendering a weird smell filling the surrounding air.",6 years ago,November 2019,ChZDSUhNMG9nS0VJQ0FnSUNvOXFEZ01REAE
Anytime Fitness,Danial Syafiq,1,"Started my membership at this outlet on the 1st of August 2020 with the sudden change of operating hours with unjustified reasons. The staff said this is due to safely measures on the amid of the pandemic as during the evening, there is no one cleaning the gym. Even with someone cleaning the gym, the gym is still a mess. Air-conditioning broke down on the 28th July 2020 and up until now (7th August) it is not resolved. Again, with unjustified reason, they said the air-conditioning repairs is done by the facility management. I am not comfortable in exercising in a hot and very muggy environment with poor ventilation with the current pandemic. They suggested to me to freeze my membership until the repairs is done. If I were to freeze my membership, I would have joined other commercial gyms in the first place.",5 years ago,November 2020,ChZDSUhNMG9nS0VJQ0FnSUNDb09PdVNREAE
Anytime Fitness,song vincent,5,"Have Large screen live broadcast premier league, while just beside other room shows film for kids. Very considerate",6 years ago,November 2019,ChZDSUhNMG9nS0VJQ0FnSUMwLVBLcVpREAE
Anytime Fitness,Leong Kenny,5,"Has 24hrs Starbucks, Macdonald's, subway and cafe. Nearest MRT station is DTL TAMPINES WEST but need to walk a bit. Alternatively, from Tampines bus interchange take bus service 291, 293 or 46. Make sure to check that they go towards st 81/82/83",7 years ago,November 2018,ChZDSUhNMG9nS0VJQ0FnSURnbmZyOVh3EAE
Anytime Fitness,Yumi Chan,5,"GREAT LOCATION..! Where else can you get a late hangout with kakis for fitness.. very sinful though.. after workout, spoilt for choice with all the eateries nearby.. NEED TO GO MORE OFTEN..!!",2 years ago,November 2023,ChdDSUhNMG9nS0VJQ0FnSURSeHRmWV9BRRAB
Anytime Fitness,Mina Bhattarai,5,"Anytime Fitness Tampines West Community
Club is a well-equipped gym located in the heart of Tampines West. It offers a variety of modern fitness equipment, including cardio machines, weightlifting equipment, and free weights. The gym is clean and well-maintained,",2 years ago,November 2023,ChdDSUhNMG9nS0VJQ0FnSUR4NThfTm1nRRAB
Anytime Fitness,Caroline Seah,5,"There's Starbucks to chill while doing your work, Cafe on 2nd floor with hip and cool concept, Mcdonalds,Subway, studio and some activities and events with good facilities and hall",7 years ago,November 2018,ChdDSUhNMG9nS0VJQ0FnSUNnaU5ldjdnRRAB
